time,rr,tg,tn,tx,pp,hu,fg,qq,et,year,month,day
01.01.1990,0,-4.47,-5.31,-3.86,1022.4,92.15,1.03,30,0.2198423,1990,1,1
02.01.1990,0,-2.74,-5.45,-0.42999998,1023.5,91.375,0.98999995,33,0.26112494,1990,1,2
03.01.1990,0,-1.05,-3.52,-0.29,1024.4,86.18,2.09,15,0.12744904,1990,1,3
04.01.1990,0,-3,-4.11,-0.78999996,1027.9,88.585,2.22,30,0.234045,1990,1,4
05.01.1990,1.4,-1.4599999,-3.5,-0.87,1027.8,92.46001,1.56,14,0.11669883,1990,1,5
06.01.1990,0,-1.87,-2.6699998,-0.57,1030.7001,92.125,1.89,17,0.13902692,1990,1,6
07.01.1990,0,-6.1,-8.349999,-2.85,1035.8,92.97895,1.52,26,0.17484516,1990,1,7
08.01.1990,0,-5.68,-6.56,-4.91,1039.2001,93.00556,1.18,37,0.2533276,1990,1,8
09.01.1990,0,-3.9099998,-6.3199997,-2.29,1039.9,92.590004,0.97999996,31,0.23042686,1990,1,9
10.01.1990,0,-3.9099998,-5.21,-0.74,1036.3,90.335,0.83,34,0.2533118,1990,1,10
11.01.1990,0,-3.09,-6.6499996,-1.91,1035.8,94.28334,1.0799999,29,0.2242224,1990,1,11
12.01.1990,0,-7.24,-9.66,-3.04,1034.7001,88.945,0.94,42,0.26721698,1990,1,12
13.01.1990,0,-5.47,-11.2,-2.12,1032.4,88.515,0.87,58,0.4029328,1990,1,13
14.01.1990,0,-4.9,-8.559999,-1.64,1029.3,88.325005,1.3299999,47,0.3360926,1990,1,14
15.01.1990,0,-2.8999999,-7.2999997,-1.03,1030.6,91.295006,1.87,43,0.33636785,1990,1,15
16.01.1990,0,3.8799999,-2.21,5.23,1028.4,89.68,3.1799998,26,0.26590052,1990,1,16
17.01.1990,3.3,3.73,2.98,4.71,1024.8,94.65834,2.74,23,0.23443834,1990,1,17
18.01.1990,0,-0.48999998,-2.6299999,4.37,1027.9,87.340004,1.66,49,0.42509425,1990,1,18
19.01.1990,0,-0.59999996,-3.21,3.27,1031.3,85.885,2.1299999,52,0.44819474,1990,1,19
20.01.1990,0.90000004,1.5699999,-1.9399999,2.58,1031.5,85.16,3.23,20,0.18772545,1990,1,20
21.01.1990,0,2.44,-0.32,7.2,1035,93.49334,2.34,30,0.290327,1990,1,21
22.01.1990,0,1.52,-2.9099998,6.25,1034.4,93.71765,1.7099999,54,0.5050696,1990,1,22
23.01.1990,4.8,-0.72999996,-2.09,1.35,1025.6,91.93158,1.91,54,0.46455273,1990,1,23
24.01.1990,2.7,5.13,-1.42,7.75,1011.7,76.455,4.81,43,0.46288276,1990,1,24
25.01.1990,4.5,7.77,-0.65999997,11.42,1006,78.380005,5.02,22,0.25807035,1990,1,25
26.01.1990,0,4.7,1,11.679999,1004.8,59.255,6.5699997,66,0.70289016,1990,1,26
27.01.1990,0,2.77,-0.82,9.0199995,1011.7,69.14,4.2599998,63,0.6250489,1990,1,27
28.01.1990,0,4.24,-1.68,8.86,1005.9,76.105,3.84,39,0.40869564,1990,1,28
29.01.1990,0,1.43,-0.65999997,5.13,1012.5,88.075005,2.4099998,64,0.60404027,1990,1,29
30.01.1990,0,2.02,-1.8299999,5.87,1011.60004,89.590004,2.47,40,0.3861495,1990,1,30
31.01.1990,0,1.18,-3.02,7.47,1011.4,85.375,2.83,71,0.6641973,1990,1,31
01.02.1990,0,1.89,-1.54,7.2799997,1013.7,88.175,1.12,45,0.431814,1990,2,1
02.02.1990,3.6000001,2.3,-1.37,6.1,1015.9,92.455,2.6599998,42,0.4086772,1990,2,2
03.02.1990,0,6.33,-2.19,9.9,1018,73.66,4.29,77,0.85901403,1990,2,3
04.02.1990,0,2.12,-1.06,10.54,1030.8,73.91,4,96,0.9202461,1990,2,4
05.02.1990,0,0.65999997,-4.44,10.26,1030.8,76.165,1.4699999,98,0.88853663,1990,2,5
06.02.1990,0,-0.52,-6.1099997,8.07,1022,78.865005,1.18,92,0.79998326,1990,2,6
07.02.1990,0,2.6699998,-4.27,11.11,1021.5,79.545,2.4099998,92,0.90456396,1990,2,7
08.02.1990,0,8.19,0.65,14.95,1018.60004,63.645,5.33,49,0.57854813,1990,2,8
09.02.1990,0,1.8399999,-0.22,7.04,1030.4,74.765,3.07,76,0.7211071,1990,2,9
10.02.1990,11.8,1.88,-5.19,6.29,1019.8,75.245,2.54,74,0.70738816,1990,2,10
11.02.1990,2.4,2,-0.64,5.43,1007.8,82.925,4.54,52,0.50270134,1990,2,11
12.02.1990,3.7,0.98999995,-1.7199999,4.29,994,89.515,4.21,46,0.431566,1990,2,12
13.02.1990,15.2,1.12,-0.78999996,3.12,998.60004,86.87,3.7099998,58,0.5453791,1990,2,13
14.02.1990,25.9,4.18,0.22,7.3599997,991.9,76.53,6.89,40,0.42146182,1990,2,14
15.02.1990,20.2,2.55,-0.08,4.0299997,994.5,76.75,5.0899997,46,0.4571381,1990,2,15
16.02.1990,0,0.96,0.16,4.16,1011.10004,71.735,3.57,68,0.6309097,1990,2,16
17.02.1990,0.7,2.23,-3.6599998,6.6299996,1019,80.5,2.09,87,0.8429067,1990,2,17
18.02.1990,0,5.85,2,13.23,1017.8,82.54,1.51,92,1.010798,1990,2,18
19.02.1990,0,5.15,1.8299999,9.349999,1021.7,86.61,1.38,60,0.6429889,1990,2,19
20.02.1990,0,6.37,-0.01,16.449999,1028.6,79.855,1.35,126,1.4000739,1990,2,20
21.02.1990,0,6.2999997,-0.45,15.4,1030.7001,84.255005,1.36,119,1.3179728,1990,2,21
22.02.1990,0,6.45,2.05,15.559999,1040.5,79.895004,1.62,122,1.3511568,1990,2,22
23.02.1990,0,3.28,-0.93,5.74,1036.7001,92.285,1.4499999,111,1.1064528,1990,2,23
24.02.1990,0,6.6499996,1.56,15.2,1029.8,81.965004,1.23,126,1.4117203,1990,2,24
25.02.1990,0,8.98,0.02,17.66,1017.10004,66.935,2.56,115,1.3903807,1990,2,25
26.02.1990,7.9,7.6099997,4.3199997,12.7699995,1002.5,67.385,8.25,51,0.5963965,1990,2,26
27.02.1990,26.5,2.8,0.84,6.12,993.4,82.54,7.8399997,57,0.5719135,1990,2,27
28.02.1990,19.6,4.96,1.4499999,6.3199997,1002.60004,80.255005,7.58,62,0.66680783,1990,2,28
01.03.1990,1.2,2.3999999,-0.17,7.68,1003.3,63.725002,9.08,103,1.0130258,1990,3,1
02.03.1990,1.9,0.07,-0.5,1.67,1020.9,84.43,4.45,90,0.8018728,1990,3,2
03.03.1990,1,0.74,-1.8,1.5699999,1040,83.795,4.2799997,75,0.6785254,1990,3,3
04.03.1990,0,2.36,-1.9,5.16,1041.9,75.185,3.6699998,111,1.0669812,1990,3,4
05.03.1990,0,2.74,0.53,8.38,1033.1,76.35,2.8999999,132,1.2929006,1990,3,5
06.03.1990,0,8.01,0.06,10.849999,1022.10004,50.115,4.91,92,1.0786833,1990,3,6
07.03.1990,0,5.0899997,2.71,10.37,1024.9,74.85,3.24,97,1.03572,1990,3,7
08.03.1990,0,4.88,-1.81,14.5199995,1022.4,72.805,1.4399999,148,1.5712351,1990,3,8
09.03.1990,0,8.599999,-0.089999996,13.65,1021.7,58.025,5.79,120,1.4319444,1990,3,9
10.03.1990,4.2000003,8.54,4.91,9.91,1030.2001,79.51,5.8399997,43,0.5102044,1990,3,10
11.03.1990,0,10.21,7.6099997,17.15,1028.9,72.74,3.7099998,164,2.0416214,1990,3,11
12.03.1990,0,9.639999,3.4499998,16.67,1023,70.61,2.07,127,1.5602772,1990,3,12
13.03.1990,0,5.24,-1.4499999,13.42,1026.8,66.415,1.61,167,1.7903228,1990,3,13
14.03.1990,0,6.22,-0.099999994,11.759999,1029.6,82.085,1.4699999,62,0.6852923,1990,3,14
15.03.1990,0,5.58,-0.84,14.549999,1036.3,76.545,1.31,160,1.726322,1990,3,15
16.03.1990,0,5.77,-0.98999995,15.17,1036.7001,70.01,1.56,175,1.8995886,1990,3,16
17.03.1990,0,7.04,-1.5799999,17.369999,1034.2001,64.085,1.9399999,188,2.1277206,1990,3,17
18.03.1990,0,7.22,-1.5899999,17.68,1034,70.705,1.18,196,2.2309022,1990,3,18
19.03.1990,0,8.53,-1.04,19.65,1033.2001,69.285,0.91999996,192,2.2743006,1990,3,19
20.03.1990,0,8.48,1.26,13.37,1028.7001,84.130005,3.35,66,0.78226817,1990,3,20
21.03.1990,0,12.48,7.54,19.23,1021.4,67.705,3.31,166,2.200218,1990,3,21
22.03.1990,1.5,14.71,4.2799997,22.16,1018.10004,62.175,2.58,164,2.295494,1990,3,22
23.03.1990,0,5.75,3.56,14.92,1024.4,74.06,2.56,152,1.6590759,1990,3,23
24.03.1990,1,6.37,-1.91,14.839999,1020.3,72.865,1.79,208,2.3207488,1990,3,24
25.03.1990,0.90000004,2.08,0.47,6.95,1019.2,78.235,4.44,135,1.3005809,1990,3,25
26.03.1990,0,2.9299998,-1.01,5.8599997,1020.2,72.61,1.64,82,0.8144391,1990,3,26
27.03.1990,3.7,5.62,-2.36,9.139999,1019.9,58.57,3.52,118,1.2854459,1990,3,27
28.03.1990,2.7,2.6399999,0.71999997,6.2799997,1016.2,92.552635,2.04,52,0.51221603,1990,3,28
29.03.1990,0,5.58,2.3799999,6.19,1026.1,89.28,2.06,53,0.5747976,1990,3,29
30.03.1990,0,6.99,5.46,11.57,1032.3,82.595,1.4499999,97,1.0971117,1990,3,30
31.03.1990,0,6.95,-0.82,15.54,1034.2001,77.655,1.23,201,2.268473,1990,3,31
01.04.1990,0,8.91,0.11,17.89,1024.2001,74.135,1.6899999,231,2.7781868,1990,4,1
02.04.1990,0,9.67,1.28,18.33,1010,71.015,1.01,212,2.6219866,1990,4,2
03.04.1990,1.3000001,7.96,4.3399997,16.449999,1002.5,69.805,3.31,131,1.5479836,1990,4,3
04.04.1990,0,3.9499998,0.04,8.32,1015.10004,67.65,2.9299998,172,1.7758518,1990,4,4
05.04.1990,4,3.3,0.48999998,6.12,1017.9,87.67,1.6899999,81,0.81623626,1990,4,5
06.04.1990,0,5.2799997,2.47,6.6299996,1011.4,85.335,3.04,73,0.7898466,1990,4,6
07.04.1990,4,4.1,3.79,5.29,1007.5,84.985,3.26,51,0.53144115,1990,4,7
08.04.1990,2.2,3.55,1.49,4.8399997,1015.8,80.615,3.9099998,80,0.8142307,1990,4,8
09.04.1990,0,4.3199997,-1.04,7.56,1012.9,51.215,4.11,150,1.5703604,1990,4,9
10.04.1990,3.2,4.91,-0.82,10.679999,1010.3,53.475002,2.1299999,249,2.6628277,1990,4,10
11.04.1990,11,3.31,1.04,7.71,1008.5,91.600006,3.56,101,1.0233585,1990,4,11
12.04.1990,0,3.07,0.51,8.0199995,1016.9,75.565,1.68,145,1.4500333,1990,4,12
13.04.1990,0,4.5699997,-2.3899999,10.86,1016.10004,82.645004,1.9,167,1.7602843,1990,4,13
14.04.1990,4.4,6.18,1.28,14.15,1012.2,80.020004,3.02,151,1.6814066,1990,4,14
15.04.1990,7.5,3.77,0.049999997,7.29,1009.2,88.22,3.6999998,116,1.1939845,1990,4,15
16.04.1990,1.3000001,5.19,0.84999996,9.55,1018.10004,75.725,3.1,195,2.0963647,1990,4,16
17.04.1990,1.4,5.5299997,0.55,10.53,1018.10004,76.825005,2.25,188,2.0438552,1990,4,17
18.04.1990,4.8,4.6,1.35,5.18,1017.60004,91.135,1.81,117,1.2335364,1990,4,18
19.04.1990,4.3,6.0899997,4.21,8.139999,1012.2,86.725,1.63,116,1.2879751,1990,4,19
20.04.1990,0,9.88,4.27,15.389999,1006,62.690002,2.86,210,2.6170676,1990,4,20
21.04.1990,0,11.66,6.6299996,16.35,1005.3,57.41,2.8799999,215,2.8098893,1990,4,21
22.04.1990,0,9.969999,7.0899997,13.71,1007.5,72.135,1.8399999,170,2.1224,1990,4,22
23.04.1990,2.4,9.13,7.33,10.86,1005.5,79.365005,1.81,75,0.9155095,1990,4,23
24.04.1990,2.2,8.05,6.81,11.139999,1009.5,83.895004,2.48,103,1.2163124,1990,4,24
25.04.1990,2.4,8.849999,6.43,12.53,1014.4,82.700005,2.72,133,1.604003,1990,4,25
26.04.1990,7.5,8.37,5.25,13.38,1018.2,81.325005,2.1699998,188,2.2319605,1990,4,26
27.04.1990,2.2,7.8799996,2.76,10.71,1018.9,81.86,4.04,84,0.98255086,1990,4,27
28.04.1990,0,5.5299997,3.46,10.099999,1027.4,61.555,2.44,241,2.6077006,1990,4,28
29.04.1990,0,8.62,2.57,14.929999,1028.1,66.445,1.42,275,3.273761,1990,4,29
30.04.1990,0,11.809999,1.2099999,18.32,1027.5,68.775,1.06,255,3.314538,1990,4,30
01.05.1990,0,14.63,4.2,21.779999,1028.7001,62.88,2.06,298,4.146796,1990,5,1
02.05.1990,0,17.42,7.66,22.99,1030.7001,51.100002,3.31,293,4.328682,1990,5,2
03.05.1990,0,15.58,8.059999,20.779999,1029.5,44.135002,3.1499999,305,4.3347683,1990,5,3
04.05.1990,0,16.47,5.8599997,23.189999,1024.6,49.72,2.74,307,4.4560046,1990,5,4
05.05.1990,0,16.43,7.2599998,24.83,1019.60004,58.315002,2.6599998,302,4.3875027,1990,5,5
06.05.1990,0,13.509999,7.0099998,23.31,1017.3,74.17,1.62,274,3.7304204,1990,5,6
07.05.1990,0,13.92,5.7799997,21.689999,1015.2,69.305,1.5999999,256,3.5222762,1990,5,7
08.05.1990,0,12.74,7.27,18.43,1016.60004,77.3,1.0699999,214,2.8603697,1990,5,8
09.05.1990,0,14.37,8.05,21.63,1015.2,71.32,1.25,261,3.6288614,1990,5,9
10.05.1990,2.1000001,15.2699995,7.99,23.359999,1014.10004,61.99,1.76,290,4.1166887,1990,5,10
11.05.1990,3.8,12.23,11.2699995,15.03,1012.7,88.265,1.75,162,2.1414251,1990,5,11
12.05.1990,0,13.09,9.679999,18.529999,1011.10004,65.485,1.38,274,3.7020183,1990,5,12
13.05.1990,0,13.349999,6.29,20.17,1011.9,70.825005,1.81,277,3.7648852,1990,5,13
14.05.1990,0,14.23,9.7,19.859999,1015.10004,61.055,1.37,270,3.74201,1990,5,14
15.05.1990,0,15.23,7.33,22.39,1017.7,58.895,0.96,286,4.050874,1990,5,15
16.05.1990,0,16.619999,8.38,23.22,1017.7,68.36,1.8,281,4.1015854,1990,5,16
17.05.1990,0,15.65,11.679999,21.699999,1015.9,66.885,2.35,280,4.00548,1990,5,17
18.05.1990,0,14.44,6.98,20,1017.60004,56.11,2.18,285,3.965299,1990,5,18
19.05.1990,0,14.589999,7.3999996,20.48,1019.7,51.24,3.08,299,4.1710963,1990,5,19
20.05.1990,0,14.34,6.66,20.449999,1018.2,48.63,3.25,318,4.413232,1990,5,20
21.05.1990,0,15.719999,6.7,20.55,1012.8,63.795002,1.41,244,3.4997942,1990,5,21
22.05.1990,0,15.66,10.55,21.35,1013,66.085,1.35,262,3.7527905,1990,5,22
23.05.1990,1.9,16.6,8.349999,24.109999,1013.9,69.125,1.5899999,226,3.3018415,1990,5,23
24.05.1990,0,16.32,9.0199995,21.029999,1011.8,73.795,1.93,157,2.2819564,1990,5,24
25.05.1990,0,11.23,10.09,14.75,1016.5,57.605,3.29,186,2.3925567,1990,5,25
26.05.1990,0,10.83,4.39,15.92,1023.3,50.49,2.1299999,297,3.769138,1990,5,26
27.05.1990,0,12.009999,2.95,18.06,1022.9,44.955,1.73,331,4.3327737,1990,5,27
28.05.1990,0,9.23,3.53,15.259999,1024,58.13,2.47,282,3.4231148,1990,5,28
29.05.1990,0,8.25,0.87,15.139999,1025.5,58.845,1.37,297,3.5016096,1990,5,29
30.05.1990,0,11.969999,0.03,18.77,1021.10004,44.635002,1.09,325,4.25307,1990,5,30
31.05.1990,0,13.599999,2.31,21.32,1020.3,48.835003,1.06,305,4.156497,1990,5,31
01.06.1990,0,16.42,4.64,24.439999,1017.5,49.155003,1.66,297,4.317177,1990,6,1
02.06.1990,14,12.15,8.83,18.76,1010,76.590004,3.6799998,160,2.1130962,1990,6,2
03.06.1990,1.5,12.23,6.8199997,16.05,1011,73.455,2.83,187,2.473628,1990,6,3
04.06.1990,0,12.99,10.53,16.56,1007.3,64,4.4,212,2.8617654,1990,6,4
05.06.1990,0,14.849999,5.5699997,19.27,1011.7,51.305,1.6999999,253,3.5610747,1990,6,5
06.06.1990,0,12.53,10.969999,15.49,1012.5,83.645004,1.1999999,90,1.1987243,1990,6,6
07.06.1990,0,14.53,9.11,18.68,1010.8,78.340004,2.37,106,1.481703,1990,6,7
08.06.1990,11.2,10.7,8.75,14.429999,1006.10004,87.61,2.8,144,1.8347515,1990,6,8
09.06.1990,5.9,10.54,4.18,16.26,1010.10004,75.44,2.83,237,3.0015588,1990,6,9
10.06.1990,16,10.33,6.06,14.28,1012,82.94,3.9499998,140,1.7615875,1990,6,10
11.06.1990,0,12.34,9.42,15.29,1016.10004,82.405,2.85,130,1.7207657,1990,6,11
12.06.1990,19.5,13.63,8.44,17.44,1013.8,81.43,1.5,117,1.5996821,1990,6,12
13.06.1990,5.6,12.99,11.5199995,15.66,1015.60004,88.645004,1.8,95,1.2781168,1990,6,13
14.06.1990,0,14.679999,10.5199995,17.84,1016.4,76.425,1.3399999,144,2.0154772,1990,6,14
15.06.1990,1.8000001,13.929999,11.63,18.57,1016.3,80.01,1.64,120,1.650748,1990,6,15
16.06.1990,1.5,13,11.759999,15.44,1017.10004,86.22,1.0699999,169,2.2728877,1990,6,16
17.06.1990,0,14.7699995,8.16,21.15,1014.3,71.37,0.91999996,284,3.9862719,1990,6,17
18.06.1990,0,16.119999,7.87,20.369999,1013,77.835,1.8499999,211,3.0524762,1990,6,18
19.06.1990,0,17.99,10.59,25.49,1014.2,69.075005,1.63,329,4.9442844,1990,6,19
20.06.1990,11.8,18,13.61,25.58,1012.3,69.42,2.06,203,3.0532897,1990,6,20
21.06.1990,0,15.78,13.08,20.21,1011.7,71.965004,2.58,272,3.9080703,1990,6,21
22.06.1990,4.5,12.46,10.96,15.96,1010.7,88.655,2.6799998,116,1.5434752,1990,6,22
23.06.1990,6.2000003,11.5199995,9.61,15.67,1017.3,89.19,2.51,183,2.3710237,1990,6,23
24.06.1990,0,16.16,8.28,18.74,1022.2,82.455,1.5899999,221,3.1893058,1990,6,24
25.06.1990,0,18.19,7.95,24.369999,1023.2,69.555,1.22,313,4.7082214,1990,6,25
26.06.1990,0,20.359999,11.08,27.16,1018.9,65.42,2.05,340,5.3349915,1990,6,26
27.06.1990,4.5,21.689999,13.2699995,28.519999,1013.10004,64.885,2.12,279,4.488221,1990,6,27
28.06.1990,0,19.08,16.65,21.24,1015.60004,79.770004,2.01,158,2.4239483,1990,6,28
29.06.1990,16.7,19.98,13.219999,27.859999,1016,70.48,1.75,300,4.679347,1990,6,29
30.06.1990,34.8,20.76,14.179999,27.619999,1013.3,76.8,1.61,293,4.6382446,1990,6,30
01.07.1990,0,15.059999,12.98,20.01,1014.3,67.67,3.24,246,3.4755228,1990,7,1
02.07.1990,0,13.53,7.66,19.189999,1014.3,79.21,1.42,210,2.863836,1990,7,2
03.07.1990,9.2,14.11,8.84,19.72,1010.60004,82.65,2.21,145,2.007497,1990,7,3
04.07.1990,0,13.849999,10.889999,17.8,1014.5,75.555,2.35,213,2.9266243,1990,7,4
05.07.1990,12.2,13.86,11.07,16.51,1007.7,85.105,3.1899998,85,1.1712853,1990,7,5
06.07.1990,1,11.5199995,9.91,15.179999,1015.9,77.91,4.54,177,2.2946405,1990,7,6
07.07.1990,6.2000003,12.33,7.08,15.95,1022.2,77.335,2.4299998,173,2.283644,1990,7,7
08.07.1990,1.9,15.61,11.55,17.109999,1018.2,93.64445,2.59,78,1.1138954,1990,7,8
09.07.1990,0,17.91,15.28,22.529999,1014.60004,84.7,2.77,157,2.3553731,1990,7,9
10.07.1990,4.1,12.889999,10.21,17.46,1019.7,71.25,3.47,241,3.2291236,1990,7,10
11.07.1990,0,13.63,6.48,18.21,1028,69.415,1.0699999,281,3.820622,1990,7,11
12.07.1990,0,16.93,5.81,23.699999,1023.8,63.34,1.75,337,4.9403768,1990,7,12
13.07.1990,0,20.85,9.51,26.699999,1017.10004,60.2,1.4599999,325,5.1469975,1990,7,13
14.07.1990,0,16.039999,11.98,21.55,1017.4,54.525,2.54,315,4.541974,1990,7,14
15.07.1990,0,15.12,7.72,23.109999,1019.3,61.495,1.5999999,306,4.320943,1990,7,15
16.07.1990,0,18.609999,7.5899997,26.539999,1019.2,59.11,1.76,285,4.328095,1990,7,16
17.07.1990,0,17.619999,12.99,21.96,1018.7,68.64,2.55,222,3.3066447,1990,7,17
18.07.1990,0,15,9.19,17.14,1022.7,67.665,1.78,187,2.6301222,1990,7,18
19.07.1990,0,14.299999,12.009999,19.02,1020.8,70.875,1.41,207,2.867245,1990,7,19
20.07.1990,0,16.029999,7.24,24.59,1020.9,68.095,1.16,318,4.578451,1990,7,20
21.07.1990,0,18.88,8.91,26.029999,1020.60004,64.365,1.2099999,314,4.79113,1990,7,21
22.07.1990,0,19.59,11.0199995,26.16,1019.60004,58.99,1.65,315,4.8726864,1990,7,22
23.07.1990,0,18.109999,11.2,23.73,1018.8,46.99,2.1499999,309,4.6475554,1990,7,23
24.07.1990,0,15.65,6.7799997,22.869999,1019.4,54.785,1.4499999,319,4.557539,1990,7,24
25.07.1990,0,16.57,6.3999996,23.189999,1017.4,57.3,1.48,312,4.54977,1990,7,25
26.07.1990,0,18.19,9.809999,25.1,1015.3,59.755,2.19,293,4.419033,1990,7,26
27.07.1990,0,18.51,9.7,26.74,1015.7,59.665,1.61,295,4.476463,1990,7,27
28.07.1990,0,20.199999,10.179999,29.039999,1017,53.125,2.01,311,4.868784,1990,7,28
29.07.1990,0,22.519999,10.38,30.46,1017.4,58.065002,1.6899999,266,4.333088,1990,7,29
30.07.1990,0,21.49,17.25,26.109999,1020,66.3,1.9499999,211,3.3759165,1990,7,30
31.07.1990,2.5,21.8,16.32,25.869999,1021.2,69.14,1.39,177,2.8458877,1990,7,31
01.08.1990,0,20.85,16.63,27.74,1022.8,70.17,1.36,270,4.2685847,1990,8,1
02.08.1990,0,21.64,14.16,29.75,1022.2,51.055,2.4299998,303,4.85715,1990,8,2
03.08.1990,0,21.43,12.33,28.859999,1022.60004,50.855,2.7,311,4.9669337,1990,8,3
04.08.1990,0,20.22,11.75,29.039999,1021.3,52.010002,1.5899999,306,4.7858443,1990,8,4
05.08.1990,3.8,22.76,10.57,31.8,1015,52.850002,2.12,280,4.582078,1990,8,5
06.08.1990,1.4,15.86,14.69,21.43,1013.5,88.005,1.8399999,123,1.7691561,1990,8,6
07.08.1990,0,14.45,10.62,18.42,1019.5,61.945,1.8399999,195,2.7117558,1990,8,7
08.08.1990,0,13.78,5.81,21.55,1022.9,60.565,1.27,263,3.5958457,1990,8,8
09.08.1990,0,15.7699995,5.7999997,23.91,1022.8,55.46,1.0799999,280,4.0058875,1990,8,9
10.08.1990,0,18.98,7.91,26.73,1021,54.515,1.8,244,3.729675,1990,8,10
11.08.1990,0,19.65,10.559999,27.189999,1019.4,58.205,0.94,266,4.1195507,1990,8,11
12.08.1990,0,21.31,12.24,30.26,1015.7,54.08,1.8499999,281,4.4877644,1990,8,12
13.08.1990,0,21.42,12.15,30.01,1014.2,53.920002,2.25,238,3.8098998,1990,8,13
14.08.1990,1.1,19.119999,14.71,25.15,1014.2,74.73,1.61,159,2.442241,1990,8,14
15.08.1990,0,18.69,16.41,23.26,1014.60004,73.355,2.01,186,2.833296,1990,8,15
16.08.1990,2.7,19.529999,11.41,26.109999,1013.60004,68.18,2.6699998,205,3.1736429,1990,8,16
17.08.1990,2.6000001,13.259999,10.38,17.859999,1020.7,74.005,2.5,184,2.4867308,1990,8,17
18.08.1990,0,14.929999,4.89,20.039999,1021,61.260002,1.79,218,3.0632412,1990,8,18
19.08.1990,0,17.41,13.34,21.84,1018.8,66.445,2.26,235,3.485304,1990,8,19
20.08.1990,0,18.65,11.559999,25.119999,1012.60004,64.28,4.2999997,204,3.1071424,1990,8,20
21.08.1990,2.4,14.45,11.259999,17.72,1016.9,63.73,4.56,106,1.4755468,1990,8,21
22.08.1990,0,14.549999,12.08,17.77,1023.7,68.725,2.3799999,106,1.4751173,1990,8,22
23.08.1990,0,15.88,6.31,23.73,1025.7001,67.91,1.16,230,3.2949827,1990,8,23
24.08.1990,0,18.73,8.41,26.96,1021,64.515,1.67,260,3.955254,1990,8,24
25.08.1990,8,21.84,11.69,30.05,1014.9,55.895,1.99,232,3.7396033,1990,8,25
26.08.1990,0,18.01,15.88,22.769999,1016.2,82.64,1.36,141,2.1183903,1990,8,26
27.08.1990,0,19.65,13.98,26.72,1015.8,73.835,2.18,224,3.473058,1990,8,27
28.08.1990,0,19.38,12.45,27.539999,1017.10004,73.45,1.03,227,3.5005145,1990,8,28
29.08.1990,0,19.85,13.38,28.92,1016.4,66.24,1.1999999,224,3.4851916,1990,8,29
30.08.1990,0,19.689999,12.36,28.47,1013.60004,64.130005,1.6999999,213,3.30725,1990,8,30
31.08.1990,0,15.299999,12.33,24.5,1012.2,78.995,2.82,134,1.9048039,1990,8,31
01.09.1990,0,13.04,11.01,16.449999,1017.9,73.085,2.25,102,1.3727003,1990,9,1
02.09.1990,1.9,14.009999,11.01,18.68,1020.7,78.31,1.75,138,1.8986831,1990,9,2
03.09.1990,4.7000003,13.679999,12.21,14.49,1017.5,92.98334,2.09,49,0.66977376,1990,9,3
04.09.1990,5.1,15.639999,12.969999,21.97,1011.3,79.98,2.25,146,2.0916424,1990,9,4
05.09.1990,0,10.51,8.179999,14.929999,1012.60004,75.92,2.84,175,2.212135,1990,9,5
06.09.1990,1.1,12.309999,3.73,18.67,1013.9,73.18,1.86,175,2.3167694,1990,9,6
07.09.1990,14.6,9.9,8.72,12.71,1012.4,87.55,3.09,94,1.1687486,1990,9,7
08.09.1990,1.6,10.49,8.25,14.86,1018.10004,87.35,2.8799999,119,1.4998331,1990,9,8
09.09.1990,0,10.74,7.7799997,15.42,1024.9,75.535,2.21,151,1.9103628,1990,9,9
10.09.1990,8.3,10.26,5.2599998,12.86,1022.5,86.855,2.51,83,1.0375844,1990,9,10
11.09.1990,0.90000004,11.12,8.07,13.21,1021.4,87.65,2.32,89,1.1391345,1990,9,11
12.09.1990,0,10.49,7.68,16.68,1024.8,75.85,1.42,159,1.9981369,1990,9,12
13.09.1990,0,11.509999,4.35,18.39,1023.7,74.385,1.0699999,170,2.1960864,1990,9,13
14.09.1990,0,11.36,4.7799997,20.01,1023.8,77.665,0.88,197,2.5348263,1990,9,14
15.09.1990,0,11.23,4.58,18.31,1023.60004,75.185,1.49,171,2.1929724,1990,9,15
16.09.1990,0,9.25,6.0299997,15.9,1024.2001,69.715004,1.62,173,2.101002,1990,9,16
17.09.1990,1.5,11.53,0.88,18.4,1018,74.325,1.8399999,188,2.4357178,1990,9,17
18.09.1990,1.3000001,10.13,8.21,14.62,1019.9,75.635,3.73,146,1.8207446,1990,9,18
19.09.1990,0,15.4,7.1299996,20.64,1013.3,63.47,3.1699998,160,2.2784946,1990,9,19
20.09.1990,0,11.969999,7.6,16.96,1011.10004,66.225,3.02,136,1.787164,1990,9,20
21.09.1990,6.5,8.559999,7.0099998,14.9,1002.60004,81.075005,4.83,82,0.9860823,1990,9,21
22.09.1990,21.6,11.58,4.41,16.699999,1004.2,93.90588,3.58,59,0.76986384,1990,9,22
23.09.1990,2.6000001,13.61,9.469999,18.21,1006.60004,83.72,2.28,113,1.5486493,1990,9,23
24.09.1990,0,8.139999,4.94,13,1008.7,77.425,3.99,133,1.5753564,1990,9,24
25.09.1990,0,9.51,2.49,15.009999,1013.5,76.28,3.87,119,1.4629093,1990,9,25
26.09.1990,0,9.69,3.23,14.38,1021.2,78.475006,1.04,100,1.2312753,1990,9,26
27.09.1990,0,7.8399997,4.12,13.57,1026.3,81.1,1.41,121,1.4086987,1990,9,27
28.09.1990,0,7.56,1.4,14.92,1028,76.525,1.06,168,1.9378097,1990,9,28
29.09.1990,0,10.3,2.6399999,19.31,1020.3,76.43,1.35,160,2.0042808,1990,9,29
30.09.1990,1.9,14.41,7.0499997,20.32,1012.2,89.21,2.04,104,1.4489799,1990,9,30
01.10.1990,23.4,15.719999,14.17,19.189999,1013.10004,88.895004,3.1499999,68,0.9752454,1990,10,1
02.10.1990,0,9.23,7.29,14.0199995,1021.8,91.365,1.3199999,105,1.2758363,1990,10,2
03.10.1990,0,11.29,5.9,15.99,1015.7,91.125,1.67,126,1.6238647,1990,10,3
04.10.1990,3.3,9.5199995,8.42,14.21,1016.9,92.32,2.1499999,48,0.58934236,1990,10,4
05.10.1990,0,7.5899997,3.78,14.059999,1026.3,79.505005,1.52,134,1.5482986,1990,10,5
06.10.1990,0,11.969999,5.62,18.08,1016.3,77.475,2.54,119,1.5603865,1990,10,6
07.10.1990,4.7000003,11.95,8.24,16.18,1008.8,81.100006,1.5999999,83,1.0911888,1990,10,7
08.10.1990,0,6.1,4.65,10.7699995,1021.4,77.805,2.62,98,1.0834594,1990,10,8
09.10.1990,0,4.61,-0.90999997,12.3,1027.5,80.64,1.02,138,1.4479337,1990,10,9
10.10.1990,0,6.74,-0.17999999,16.34,1024.9,78.745,0.66999996,144,1.6218528,1990,10,10
11.10.1990,0,8.32,1.9,17.22,1023,84.62,1.13,137,1.6204554,1990,10,11
12.10.1990,0,11.65,3.6599998,21.119999,1021.3,74.94,2.76,137,1.7780159,1990,10,12
13.10.1990,0,12.969999,7.7799997,22.31,1019.8,79.765,1.62,119,1.5975293,1990,10,13
14.10.1990,0,13.23,7.58,21.82,1022.60004,85.08,0.9,125,1.6868532,1990,10,14
15.10.1990,0,12.86,6.46,21.029999,1015,79.945,2.53,122,1.6365559,1990,10,15
16.10.1990,0,12.969999,7.96,19.779999,1016.4,85,1.12,82,1.1023235,1990,10,16
17.10.1990,0,11.65,8.47,14.929999,1011.60004,93.142105,1.25,54,0.70368683,1990,10,17
18.10.1990,0,12.23,8.63,17.05,1011.8,86.985,1.1899999,78,1.0314398,1990,10,18
19.10.1990,0,11.24,9.09,13,1012.10004,89.015,1.73,72,0.9281336,1990,10,19
20.10.1990,0,11.08,9.15,13.5,1013.8,79.56,2.55,51,0.65419805,1990,10,20
21.10.1990,0,5.89,3.08,10.61,1021.4,67.3,5.25,76,0.8345723,1990,10,21
22.10.1990,0,4.94,0.29,9.37,1025.6,53.97,4.22,126,1.3381537,1990,10,22
23.10.1990,0,3.07,-1.92,12.71,1018.10004,63.88,2.97,123,1.2292217,1990,10,23
24.10.1990,0,3.8,-4.16,12.0199995,1016.4,80.135,0.72999996,110,1.1290348,1990,10,24
25.10.1990,0,5.45,-0.48999998,13.2699995,1013.2,80.175,1.7199999,103,1.1196415,1990,10,25
26.10.1990,1.2,5.62,1.86,10.48,1008.60004,87.625,1.8199999,82,0.89842665,1990,10,26
27.10.1990,0,5.6099997,3.85,9.2,1010,90.73,1.81,34,0.3721316,1990,10,27
28.10.1990,8.5,7.85,1.88,12.469999,1000.2,79.495,3.48,75,0.88433546,1990,10,28
29.10.1990,11.6,7.23,6.0299997,9.38,988.60004,84.475,4.0099998,50,0.58196837,1990,10,29
30.10.1990,3,5.45,2.56,8.9,995.60004,80.22,5.7999997,82,0.89946467,1990,10,30
31.10.1990,4.1,7.6,2.27,8.88,1002.8,88.03,3.3,24,0.28053242,1990,10,31
01.11.1990,1.3000001,5.9,4.5499997,10.53,1005.10004,85.275,4.2599998,59,0.65345645,1990,11,1
02.11.1990,0,6.0499997,2.3999999,8.94,1004.60004,79.125,3.3899999,47,0.52318454,1990,11,2
03.11.1990,1,2.6599998,-1.39,4.97,1005.8,93.85556,1.55,30,0.2974349,1990,11,3
04.11.1990,2.7,3.4399998,2.59,5.23,1009.4,84.745,3.97,48,0.48834264,1990,11,4
05.11.1990,0,1.67,1.17,3.6999998,1017.9,87.135,2.36,42,0.39877358,1990,11,5
06.11.1990,0,0.089999996,-1.78,4.08,1029,89.04,0.88,47,0.4170934,1990,11,6
07.11.1990,0,0.5,-3.04,1.88,1031.9,91.670006,0.95,31,0.2791317,1990,11,7
08.11.1990,0,1.9,-0.45,4.25,1029.2001,81.75,1.3199999,38,0.36160892,1990,11,8
09.11.1990,0,1.3299999,-1.4499999,7.81,1027.2001,81.96,1.91,75,0.6992768,1990,11,9
10.11.1990,0,1.38,-4.36,2.49,1024.6,91.235,1.11,57,0.53325367,1990,11,10
11.11.1990,6.7000003,6.8999996,2.12,8.15,1023,93.55334,1.81,20,0.22659655,1990,11,11
12.11.1990,0,5.8599997,4.12,8.69,1027.2001,92.310005,1.3299999,29,0.3172203,1990,11,12
13.11.1990,0,5.7799997,2.9299998,7.43,1026.1,89.76,1.54,46,0.5021488,1990,11,13
14.11.1990,5.8,7.6499996,4.8399997,8.45,1018.10004,94.25883,2.28,19,0.22079624,1990,11,14
15.11.1990,2.8,6.5499997,5.58,8.8,1018.8,90.57,2.8999999,30,0.33688328,1990,11,15
16.11.1990,0,7.18,2.83,8.57,1026.9,86.035,2.77,45,0.5133157,1990,11,16
17.11.1990,3.9,10.98,7.5699997,12.38,1015.8,80.94,6.7599998,26,0.33234793,1990,11,17
18.11.1990,14.8,7.6299996,6.2599998,11.04,1010.7,84.645004,7.7999997,34,0.3962718,1990,11,18
19.11.1990,6.3,4.37,3.6299999,6.31,1009.10004,86.705,5.13,22,0.23117629,1990,11,19
20.11.1990,11.900001,6.6499996,2.97,9.8,998.2,94.03334,3.82,24,0.27312455,1990,11,20
21.11.1990,4.5,3.8799999,3.73,9.76,1006.9,87.87,3.1699998,17,0.17586637,1990,11,21
22.11.1990,9.3,2.53,2.04,3.56,1011.5,91.245,2.73,17,0.16722308,1990,11,22
23.11.1990,0,1.01,-0.099999994,3.29,1007.10004,90.64,2.98,25,0.23293792,1990,11,23
24.11.1990,0,-0.59999996,-2.49,3.3,1004.3,94.27143,1.6999999,45,0.39421797,1990,11,24
25.11.1990,0,3.24,-1.4699999,5.0499997,994.3,81.62,4.44,18,0.18335298,1990,11,25
26.11.1990,0,1.89,-0.87,8.12,1003.7,85.865,2.36,56,0.5404256,1990,11,26
27.11.1990,4.8,2.29,-3.9299998,5.48,1008.2,83.520004,1.8499999,31,0.3028352,1990,11,27
28.11.1990,0,1.49,0.31,3.07,1014.7,89.495,2.49,17,0.16061004,1990,11,28
29.11.1990,2.8,1.37,0.88,2.22,1017.2,89.93,1.63,18,0.16904494,1990,11,29
30.11.1990,0,-1.0799999,-2.61,1.76,1018.10004,80.575,2.6299999,36,0.30667132,1990,11,30
01.12.1990,0,-4.04,-5.72,-2.1299999,1030.7001,78.805,1.7199999,38,0.28246462,1990,12,1
02.12.1990,0,-1.0699999,-4.6,-0.39999998,1032.1,88.075005,2,21,0.17745225,1990,12,2
03.12.1990,0,-1.16,-1.4,-0.25,1029.7001,92.96842,1.23,17,0.14332448,1990,12,3
04.12.1990,6.6,1.3299999,-1.8199999,2.19,1023.7,91.16,3.62,18,0.16816185,1990,12,4
05.12.1990,0,-0.17,-1.55,2.1699998,1025.3,78.925,3.73,31,0.27285475,1990,12,5
06.12.1990,0,-4.5,-6.5899997,0.16,1032.7001,74.95,1.3199999,55,0.39977887,1990,12,6
07.12.1990,0,-6.98,-10.389999,-3.79,1022.9,87.535,1.27,46,0.29891056,1990,12,7
08.12.1990,0,-6.79,-9.11,-4.06,1008.8,86.885,2,42,0.2781994,1990,12,8
09.12.1990,0,-0.32,-8.17,1.5799999,1001.60004,79.815,4.52,22,0.19522795,1990,12,9
10.12.1990,1.9,-0.29999998,-1.22,2.18,991.9,90.315,2.34,16,0.14293407,1990,12,10
11.12.1990,0,-1.8199999,-6.6099997,1.3199999,1006.60004,83.995,1.5799999,35,0.29115936,1990,12,11
12.12.1990,5.2000003,-0.25,-2.08,0.42,1003.10004,87.520004,3.81,16,0.1422527,1990,12,12
13.12.1990,0,-3.07,-5.93,0.93,1011.8,89.405,2.3,30,0.23573387,1990,12,13
14.12.1990,1,-1.31,-6.8199997,0.97999996,1023.3,88.645004,1.39,18,0.15140013,1990,12,14
15.12.1990,0,-4.25,-5.79,-0.45,1023.60004,86.575005,1.8199999,23,0.17012031,1990,12,15
16.12.1990,0,-1.49,-6.35,-0.66999996,1029.8,85.32,2.02,19,0.15798461,1990,12,16
17.12.1990,0,-3,-4.42,-0.59,1027.5,81.39,2.79,34,0.26531827,1990,12,17
18.12.1990,0,-2.8899999,-4.6,-1.74,1023.3,86.9,2.12,24,0.18869214,1990,12,18
19.12.1990,1.3000001,-2.5,-5.7799997,-0.97999996,1022,86.725,2.21,21,0.16807,1990,12,19
20.12.1990,1.3000001,-1.54,-4.94,-0.59,1025.6,84.44,3.6,21,0.17469703,1990,12,20
21.12.1990,1.9,0.88,-2.08,1.55,1019.3,87.51,4.35,15,0.13808475,1990,12,21
22.12.1990,2,1.9499999,0.88,3.1799998,1024.8,91.355,2.01,15,0.1433608,1990,12,22
23.12.1990,0,2.24,0.65,3.29,1026,95.200005,1.93,16,0.1544704,1990,12,23
24.12.1990,0,0.11,-0.42,2.26,1021.10004,94.03334,1.89,24,0.21414743,1990,12,24
25.12.1990,0,-0.93,-1.16,0.29999998,1017.9,94.057144,2.3799999,22,0.1885933,1990,12,25
26.12.1990,5.8,0.17999999,-4.63,1.9,1011.8,89.515,3.3,27,0.24291633,1990,12,26
27.12.1990,3,3.3999999,-0.07,5.47,1007,88.245,4.64,38,0.3865654,1990,12,27
28.12.1990,1.1,0.13,-2.26,4.89,1020.3,80.455,3.22,50,0.44670537,1990,12,28
29.12.1990,1.3000001,6.64,-2.28,9.639999,1014.4,84.725,3.9499998,16,0.18057138,1990,12,29
30.12.1990,12.400001,6.14,4.81,10.67,1021,88.97,2.85,17,0.18822572,1990,12,30
31.12.1990,4.7000003,4.92,3.55,6.23,1022.9,92.8,3.03,20,0.21255916,1990,12,31
01.01.1991,1.3000001,2.55,1.8399999,5.1099997,1019.7,88.875,3.1599998,28,0.274375,1991,1,1
02.01.1991,5.7000003,4.69,0.57,6.2,1015.10004,82.865,4.38,15,0.15883455,1991,1,2
03.01.1991,0,7.6299996,5.04,10.96,1013.10004,83.285,3.6899998,23,0.26775804,1991,1,3
04.01.1991,1.7,4.41,-0.06,8.94,1013.7,83.93,2.75,32,0.335897,1991,1,4
05.01.1991,4.3,3,0.76,5.43,1018,74.91,3.35,51,0.50842893,1991,1,5
06.01.1991,3.4,2.04,0.85999995,5.38,1010,82.405,5,42,0.40612385,1991,1,6
07.01.1991,4.9,5.08,0.14999999,7.37,1007.8,91.73158,3.22,16,0.17229822,1991,1,7
08.01.1991,0,3.33,-0.68,9.12,1014.9,83.700005,2.84,51,0.5153122,1991,1,8
09.01.1991,0,4.65,-1.73,8.44,1014.4,79.05,3.04,22,0.23272866,1991,1,9
10.01.1991,1.3000001,11.12,2.76,15.299999,1013,62.715,3.4299998,46,0.5908848,1991,1,10
11.01.1991,3.4,6.94,6.21,11.75,1017.7,93.770004,2.05,18,0.20471923,1991,1,11
12.01.1991,2.9,4.12,3.1699998,6.5099998,1023.5,88.98,1.93,19,0.19644709,1991,1,12
13.01.1991,1.1,1.43,0.26999998,2.79,1028.8,84.635,2.47,18,0.16831402,1991,1,13
14.01.1991,0,0.53,-1.53,2.7,1031.4,55.760002,5.79,58,0.52301437,1991,1,14
15.01.1991,0,-0.45999998,-2.25,4.77,1030.5,29.29,4.0499997,73,0.63309336,1991,1,15
16.01.1991,0,-2.04,-5.19,2.11,1030.2001,47.455,2.78,71,0.5766279,1991,1,16
17.01.1991,0,-5.42,-8.54,1.66,1032.8,69.325,1.06,66,0.45947745,1991,1,17
18.01.1991,0,-6.52,-11.7,0.98999995,1035.9,74.575,0.84,61,0.40187,1991,1,18
19.01.1991,0,-6.06,-11.0199995,-2.75,1033.6,90.285,0.84,57,0.38462824,1991,1,19
20.01.1991,0,-0.58,-7.16,0.59,1038.1,88.9,0.53,26,0.22337355,1991,1,20
21.01.1991,2.3,0.11,-0.98999995,0.62,1033.8,91.36,1.55,19,0.16827202,1991,1,21
22.01.1991,0,-1.48,-3.6,1.39,1035.8,86.215004,1.68,31,0.25693095,1991,1,22
23.01.1991,0,0.31,-4.37,1.26,1038.1,75.725,1.06,19,0.16919091,1991,1,23
24.01.1991,0,-1.5799999,-3.74,1.9399999,1035.9,78.615005,0.88,37,0.305352,1991,1,24
25.01.1991,0,-2.4099998,-7.77,-0.25,1036,87.325005,1.17,35,0.27875832,1991,1,25
26.01.1991,0,-2.52,-3.02,-1.12,1033,86.935,1.0699999,26,0.20647763,1991,1,26
27.01.1991,0,-2.6299999,-4.39,-1.88,1034.2001,82.41,1.73,20,0.15795185,1991,1,27
28.01.1991,0,-3.97,-6.5299997,-0.03,1032.9,74.445,1.91,52,0.3872115,1991,1,28
29.01.1991,0,-3.4299998,-11.78,-0.53,1029.9,83.395004,0.71999997,33,0.25226662,1991,1,29
30.01.1991,0,-2.6799998,-4.21,1.09,1027.6,70.6,1.91,62,0.49061298,1991,1,30
31.01.1991,0,-7.3799996,-10.51,-0.74,1029.2001,63.63,2.1399999,81,0.51369745,1991,1,31
01.02.1991,0,-9.099999,-14.28,-2.1,1030.1,62.945004,1.68,84,0.48732394,1991,2,1
02.02.1991,0,-9.01,-14.719999,-2.4299998,1031.3,71.875,1.1,89,0.5183347,1991,2,2
03.02.1991,0,-5.2999997,-13.75,-1.06,1031,63.11,1.52,57,0.3995624,1991,2,3
04.02.1991,0,-5.06,-9.7,0.32,1032.9,60.33,2.06,88,0.623098,1991,2,4
05.02.1991,1.2,-7.69,-8.58,-5.14,1030,77.32,2.9399998,38,0.23712441,1991,2,5
06.02.1991,1.2,-12.32,-14.969999,-9.19,1026.6,71.725,3.75,78,0.380156,1991,2,6
07.02.1991,0,-8.67,-12.69,-6.35,1017.7,84.055,2.48,66,0.3951016,1991,2,7
08.02.1991,1.8000001,-4.87,-9.29,-3.36,1009.9,83.055,2.56,42,0.30466142,1991,2,8
09.02.1991,2.5,-3.6299999,-6.69,-1.7099999,1010.2,89.08,2.72,57,0.4373816,1991,2,9
10.02.1991,5.3,-1.62,-4.72,4.35,1008.8,84.18,3.34,48,0.40211803,1991,2,10
11.02.1991,0,-7.1499996,-8.95,-2.03,1018.2,80.655,2.54,78,0.50423527,1991,2,11
12.02.1991,0,-5.93,-13.71,-0.37,1016,81.555,1.13,75,0.5153841,1991,2,12
13.02.1991,2.2,-4.74,-7.64,-2.96,1017.7,77.745,2.49,44,0.3194333,1991,2,13
14.02.1991,1.3000001,-5.35,-5.98,-4.22,1019.5,76.29,3.84,69,0.4862642,1991,2,14
15.02.1991,6,-3.48,-9.08,-1.15,1012.60004,81.520004,3.84,53,0.4087778,1991,2,15
16.02.1991,1.8000001,-1.27,-3.23,1.54,997.8,87.76,5.08,51,0.43647242,1991,2,16
17.02.1991,0,-5.4,-8.889999,2.07,1011.3,81.875,1.3399999,106,0.7493835,1991,2,17
18.02.1991,0,-4.17,-15.13,1.09,1016.8,76.985,0.83,65,0.48468474,1991,2,18
19.02.1991,0,-0.71,-2.62,3.6699998,1019,79.78,1.5699999,72,0.62237865,1991,2,19
20.02.1991,0,-0.82,-7.06,7.12,1016.10004,80.975,0.79999995,114,0.9827408,1991,2,20
21.02.1991,0,-2.57,-6.6099997,1.74,1014.60004,88.325005,0.74,93,0.7455332,1991,2,21
22.02.1991,0,-1.02,-6.35,6.16,1021.3,83.535,1.3,85,0.7244672,1991,2,22
23.02.1991,0,2.09,-5.96,6.3199997,1029.8,83.97,1.65,37,0.35448015,1991,2,23
24.02.1991,0,3,-2.54,12.28,1030.5,78.37,1.0699999,132,1.30699,1991,2,24
25.02.1991,0,3.87,-2.98,13.309999,1026,78.48,1.12,113,1.1567163,1991,2,25
26.02.1991,0,2.4099998,-2.46,11.25,1024.8,82.69,1.04,118,1.1471403,1991,2,26
27.02.1991,0,0.41,-4.0099998,7.58,1020.2,80.87,2.57,104,0.9395258,1991,2,27
28.02.1991,0,-0.29999998,-3.21,3.56,1014.10004,74.565,2.49,84,0.74042684,1991,2,28
01.03.1991,0,0.47,-4.63,6.74,1012.7,77.76,2.32,102,0.9277006,1991,3,1
02.03.1991,7.1,0.39,-3.73,2.21,1017.60004,93.32106,1.63,62,0.5605164,1991,3,2
03.03.1991,0,4.46,-0.04,8.11,1026.4,94.08236,1.0799999,44,0.45957088,1991,3,3
04.03.1991,0,2.1499999,0.84,4.15,1029.4,93.35834,1.51,62,0.5954525,1991,3,4
05.03.1991,0,3.01,1.0799999,4.38,1017.2,92.045006,1.5999999,63,0.6285597,1991,3,5
06.03.1991,0,4.75,-0.01,10.46,1007.10004,82.85,1.8199999,101,1.0761392,1991,3,6
07.03.1991,0,6.21,1.27,11.05,1002.3,77.935,2.44,111,1.2433413,1991,3,7
08.03.1991,0,9.639999,0.48999998,18.06,997.10004,74.01,3.06,109,1.3548405,1991,3,8
09.03.1991,3.9,7.5899997,5.0099998,9.51,999.2,89.225,2.58,41,0.47993177,1991,3,9
10.03.1991,0,7.2999997,5.54,10.679999,1013.7,88.165,1.64,64,0.7374312,1991,3,10
11.03.1991,0,7.5099998,2.86,12.79,1016.60004,82.76,0.84,97,1.123264,1991,3,11
12.03.1991,0,5.29,1.09,12.45,1015.9,83.145004,1.31,140,1.5117724,1991,3,12
13.03.1991,0,3.9599998,-1.56,11.24,1016.3,84.08,1.12,134,1.3831055,1991,3,13
14.03.1991,0,2.2,-1.3,6.43,1018.60004,92.07895,1.04,140,1.3552047,1991,3,14
15.03.1991,0,7.14,-0.29,16.57,1015.60004,79.665,1.0799999,132,1.5121204,1991,3,15
16.03.1991,0,7.62,0.62,16.46,1011,72.41,1.61,177,2.0620265,1991,3,16
17.03.1991,0,9.36,0.17,16.4,1004.7,72.2,1.77,161,1.9788017,1991,3,17
18.03.1991,0,9.75,6.08,13.809999,1016.7,69.91,2.6,113,1.3964773,1991,3,18
19.03.1991,14.8,7.6299996,1.42,12.04,1021,80.525,3.04,66,0.76545256,1991,3,19
20.03.1991,0,11.15,7.75,15.29,1017.2,78.71,4.16,126,1.61688,1991,3,20
21.03.1991,0,11.19,8.059999,17.91,1007.60004,79.725,2.56,120,1.547845,1991,3,21
22.03.1991,4.2000003,6.24,6.0099998,12.95,1004.10004,88.130005,2.75,55,0.6160976,1991,3,22
23.03.1991,0,6.94,4.21,8.559999,1011,85.47,1.8299999,71,0.8101536,1991,3,23
24.03.1991,0,8.94,5.21,14.28,1011.2,77.535,2.9299998,103,1.2472463,1991,3,24
25.03.1991,0,7.49,5.42,8.0199995,1014.3,77.065,6.6299996,48,0.5561191,1991,3,25
26.03.1991,0,3.3899999,3.08,7.1499996,1016.8,81.71,5.35,49,0.4956444,1991,3,26
27.03.1991,0,2.6,0.47,7.41,1019.10004,68.51,3.28,123,1.2078881,1991,3,27
28.03.1991,0,0.08,-4.37,4.97,1024.3,74.205,2.6,137,1.2186661,1991,3,28
29.03.1991,0,0.28,-3,3.85,1030.3,64.745,2.72,118,1.054299,1991,3,29
30.03.1991,0,3.1999998,-1.0699999,4.7799997,1028,76.17,1.04,83,0.8288653,1991,3,30
31.03.1991,0,4.4,-3.1799998,10.41,1024.8,71.765,1.37,157,1.6378455,1991,3,31
01.04.1991,0,7.33,-1.78,13.9,1018.4,67.125,1.43,187,2.1517673,1991,4,1
02.04.1991,0,11.179999,2.27,16.33,1010.60004,72.305,1.9599999,166,2.1378775,1991,4,2
03.04.1991,8.2,12.099999,2.07,18.4,1006.2,61.355,1.53,194,2.5629463,1991,4,3
04.04.1991,3.9,7.2599998,6.23,12.66,1006.9,86.155,1.65,88,1.0160761,1991,4,4
05.04.1991,3.3,7.3599997,5.75,9.059999,1003.4,87.275,1.48,73,0.84688526,1991,4,5
06.04.1991,0,8.48,5.7599998,11.32,1017.3,70.61,1.81,141,1.6800791,1991,4,6
07.04.1991,0,8.29,4.6,11.71,1019.4,72.165,2.98,120,1.4205097,1991,4,7
08.04.1991,1.7,6.67,3.6599998,10,1023.5,86.635,3.49,100,1.124586,1991,4,8
09.04.1991,0,6.19,2.04,11.92,1027.2001,82.630005,2.32,145,1.6030688,1991,4,9
10.04.1991,0,7.52,-0.44,15.82,1029,70.895004,1.51,246,2.832699,1991,4,10
11.04.1991,0,7.74,-0.37,14.66,1028.3,63.81,3.31,256,2.9685986,1991,4,11
12.04.1991,0,10.79,1.38,17.789999,1020.4,62.12,3.6799998,255,3.2367148,1991,4,12
13.04.1991,0,10.79,3.29,17.55,1017.8,61.625,2.87,244,3.1005719,1991,4,13
14.04.1991,0,9.929999,1.93,17.289999,1021.4,64.445,2.1499999,219,2.7143052,1991,4,14
15.04.1991,0,9.86,1.22,17.66,1025.7001,67.39,1.86,246,3.037228,1991,4,15
16.04.1991,0,8.0199995,1.3,15.86,1015.7,59.355,3.9499998,242,2.8468385,1991,4,16
17.04.1991,0,2.44,-1.2099999,5.72,1013,77.11,2.21,158,1.5478091,1991,4,17
18.04.1991,0,2.11,0.39,5.98,1008.10004,61.735,3,138,1.3392947,1991,4,18
19.04.1991,2.8,1.87,-2.37,5.7799997,1007.5,76.675,1.5999999,152,1.4626181,1991,4,19
20.04.1991,0,0.81,-2.77,5.16,1011.8,66.385,2.1,180,1.6597598,1991,4,20
21.04.1991,0,0.19,-4.36,5.23,1018.8,68.62,1.78,218,1.953997,1991,4,21
22.04.1991,0,4.61,-6.0499997,8.96,1017.60004,54.755,2.58,201,2.1198695,1991,4,22
23.04.1991,0,2.3999999,1.31,7.02,1018.3,83.555,2.6399999,158,1.5409912,1991,4,23
24.04.1991,0,2.82,-2.1599998,8.58,1020.8,71.645004,0.96999997,158,1.5625588,1991,4,24
25.04.1991,0,6.6,-1.93,11.73,1012.7,57.965,2.6399999,235,2.6510456,1991,4,25
26.04.1991,0,7.7999997,-1.31,13.969999,1011,59.925,2.73,230,2.6939855,1991,4,26
27.04.1991,0,9.849999,0.7,16.039999,1011.4,54.585,1.5999999,233,2.8943017,1991,4,27
28.04.1991,0,10.54,0.62,16.35,1013.2,55.305,1.54,191,2.415704,1991,4,28
29.04.1991,1.8000001,8.61,7.0499997,12.48,1018.8,75.2,2.1,169,2.0199535,1991,4,29
30.04.1991,4.6,8.15,4.75,9.059999,1012.9,90.51,2.31,76,0.8986861,1991,4,30
01.05.1991,6.7000003,9.099999,7.2999997,13.24,1005.7,84.47,3.06,115,1.4024597,1991,5,1
02.05.1991,0,7.5099998,5.06,10.099999,1013.4,69.090004,2.2,109,1.2641662,1991,5,2
03.05.1991,0,5.69,3.4499998,9.389999,1013.4,76.305,1.93,116,1.2707261,1991,5,3
04.05.1991,1.9,5.97,1.4499999,8.46,1009.4,67.43,1.79,153,1.6946726,1991,5,4
05.05.1991,0,4.79,3.1799998,8.679999,1010.2,83.42,1.4399999,157,1.6723388,1991,5,5
06.05.1991,0,7.27,-1.31,12.13,1010.10004,69.3,1.6999999,193,2.2256584,1991,5,6
07.05.1991,0,8.389999,-0.07,12.69,1009.10004,67.700005,1.55,178,2.1234984,1991,5,7
08.05.1991,0,8.12,0.25,14.96,1011,61.875,1.5999999,273,3.228209,1991,5,8
09.05.1991,0,10,0.17999999,16.279999,1013.5,54.66,2.1,266,3.3148046,1991,5,9
10.05.1991,0.7,13.32,5.18,18.85,1008.5,58.495003,3.56,225,3.0600598,1991,5,10
11.05.1991,23.7,11,9.7,11.34,1007.9,91.865005,2.2,71,0.91113806,1991,5,11
12.05.1991,11.5,7.93,7.04,10.82,1017.4,93.47223,2.9099998,75,0.8792146,1991,5,12
13.05.1991,0,9.24,5.72,15.04,1023.4,78.44,1.23,248,3.012075,1991,5,13
14.05.1991,4.8,9.5199995,1.8,15.21,1020.9,87.9,2.54,134,1.6422877,1991,5,14
15.05.1991,3,5.3599997,3.9599998,9.53,1021.5,71.805,2.87,214,2.3095577,1991,5,15
16.05.1991,0,5.42,3.09,8.72,1016.60004,70.195,3.04,174,1.8862916,1991,5,16
17.05.1991,3.4,7.5299997,2.4299998,11.92,1018.60004,69.125,2.28,198,2.2920396,1991,5,17
18.05.1991,0,7.41,3.3,12.07,1021.2,68.560005,2.8999999,259,2.983522,1991,5,18
19.05.1991,1,9.969999,-0.14999999,13.95,1023,56.105,2.01,253,3.13695,1991,5,19
20.05.1991,0,11.08,6.64,16.43,1024.6,65.28,1.8,255,3.2559114,1991,5,20
21.05.1991,0,14.53,7.41,19.13,1028.4,74.76,3.3,197,2.7353451,1991,5,21
22.05.1991,0,15.63,7.56,20.76,1028.1,57.615,3.86,272,3.8720095,1991,5,22
23.05.1991,0,8.76,7.14,15.849999,1026.3,59.99,3.86,265,3.170235,1991,5,23
24.05.1991,0,7.0099998,2.1299999,10.63,1026.4,62.81,2.29,256,2.9055672,1991,5,24
25.05.1991,3,8.03,0.11,11.719999,1025.8,73.88,2.1599998,150,1.7567103,1991,5,25
26.05.1991,1.4,7.74,6.6299996,11.05,1025.8,85.21,2.6599998,144,1.6718174,1991,5,26
27.05.1991,0,9.38,2.07,16.43,1026.8,69.785,1.14,284,3.4577427,1991,5,27
28.05.1991,0,11.46,1.9499999,16.84,1022.3,62.350002,1.8399999,249,3.2143316,1991,5,28
29.05.1991,0,11.44,3.36,17.71,1019.2,67.72,2.3,273,3.5269268,1991,5,29
30.05.1991,0,14,3.57,19.75,1019,55.690002,2.07,304,4.1843796,1991,5,30
31.05.1991,0,15.549999,4.8199997,22.32,1016.5,61.145,1.26,325,4.638018,1991,5,31
01.06.1991,0,15.469999,6.49,21.609999,1012.8,53.675,2.73,318,4.536333,1991,6,1
02.06.1991,3.6000001,14.69,5.2999997,20.68,1013.4,54.685,1.9399999,337,4.72322,1991,6,2
03.06.1991,4.5,12.969999,9.54,18.359999,1007.8,69.215004,3.9199998,220,2.967715,1991,6,3
04.06.1991,0,9.42,3.09,13.94,1012.9,57.66,2.3799999,219,2.6861815,1991,6,4
05.06.1991,0,9.87,5.0899997,15.13,1015.10004,57.75,2,268,3.3254128,1991,6,5
06.06.1991,2.1000001,10.66,4.18,15.53,1010,86.880005,3,120,1.5247366,1991,6,6
07.06.1991,2.2,13.849999,7.18,18.58,1003.7,74.48,1.74,174,2.4008877,1991,6,7
08.06.1991,0,13.21,10.559999,16.72,1005.8,82.66,2.36,148,2.009697,1991,6,8
09.06.1991,3,15.48,9.9,20.43,1012.10004,73.585,2.1499999,160,2.2835236,1991,6,9
10.06.1991,0,15.12,12.95,19.119999,1014.3,61.365,3.98,282,3.9894845,1991,6,10
11.06.1991,0,13.21,8.03,18.41,1020.2,62.04,3.4199998,242,3.2672827,1991,6,11
12.06.1991,0,18.34,9.17,23.93,1016.60004,56.12,1.81,269,4.067234,1991,6,12
13.06.1991,3.3,16,12.3,22.689999,1012,61.315002,3.28,206,2.9735577,1991,6,13
14.06.1991,0.90000004,13.46,9.15,17.44,1015.3,79.450005,2.6,183,2.4904745,1991,6,14
15.06.1991,2.2,18.42,10.929999,24.119999,1012.3,65.01,2.05,298,4.5191913,1991,6,15
16.06.1991,33.9,13.45,12.09,17.48,1010,88.835,1.73,114,1.5543319,1991,6,16
17.06.1991,38.7,9.24,7.8399997,12.009999,1011.8,93.14211,2.3899999,68,0.8302566,1991,6,17
18.06.1991,3,9.78,7.5,14.37,1014.3,84.840004,2.48,185,2.290631,1991,6,18
19.06.1991,0,10.57,3.6999998,16.42,1016.4,78.01,1.99,261,3.299099,1991,6,19
20.06.1991,10.400001,10.9,6.6,15.929999,1012,83.845,1.39,156,1.9931277,1991,6,20
21.06.1991,0,14.429999,10.17,19.63,1016.10004,74.865,2.32,258,3.5908723,1991,6,21
22.06.1991,15.3,19.99,8.71,26.5,1018.5,68.41,1.9599999,322,5.019481,1991,6,22
23.06.1991,2.8,19.21,14.009999,24.32,1021.60004,77.245,1.4699999,296,4.5434246,1991,6,23
24.06.1991,5.2000003,18.91,14.95,23.15,1017.8,75.715004,3.31,220,3.3618336,1991,6,24
25.06.1991,0,18.77,14.839999,23.21,1017.7,83.725,2,194,2.9566922,1991,6,25
26.06.1991,14.3,17.619999,13.559999,25.8,1014,88.625,1.89,260,3.87887,1991,6,26
27.06.1991,3.4,12.75,10.9,17.22,1010.3,83.05,2.9399998,158,2.1177866,1991,6,27
28.06.1991,4.8,10.95,8.809999,14.469999,1011.60004,83.395004,5.25,166,2.1240673,1991,6,28
29.06.1991,0,11.48,6.85,15.759999,1020.4,75,3.59,195,2.5205786,1991,6,29
30.06.1991,0,14.679999,5.92,20.74,1025.3,71.29,1.63,314,4.3800807,1991,6,30
01.07.1991,0,17.94,7.91,24.519999,1022.8,61.95,1.25,328,4.9101067,1991,7,1
02.07.1991,0,20.57,10.24,26.269999,1018.2,55.100002,2.85,346,5.450712,1991,7,2
03.07.1991,0,20.3,12.259999,25.43,1017.7,62.285,2.97,292,4.578581,1991,7,3
04.07.1991,0,21.39,15.24,26.099998,1018.8,71.305,3.04,249,3.978496,1991,7,4
05.07.1991,0,23.42,16.66,28.019999,1017.5,68.46,3.09,296,4.891686,1991,7,5
06.07.1991,0,22.26,15.889999,28.01,1018,59.815002,2.6799998,334,5.41667,1991,7,6
07.07.1991,0,23.5,13.2,29.32,1016.7,58.395,2.6599998,331,5.478169,1991,7,7
08.07.1991,0,23.06,14.87,29.15,1016.9,65.61,2.29,305,5.0126023,1991,7,8
09.07.1991,2.9,20.16,16.869999,24.34,1020.3,78.965004,1.43,164,2.5629747,1991,7,9
10.07.1991,0,21.82,15.48,28.55,1020.8,68.740005,1.65,311,5.002676,1991,7,10
11.07.1991,0,23.48,15.42,30.359999,1018.2,68.175,1.1899999,323,5.3418884,1991,7,11
12.07.1991,4.4,25.75,16.49,32.12,1016.7,62.735,1.92,295,5.048979,1991,7,12
13.07.1991,2.7,20.939999,18.98,26.019999,1017,78.275,2.06,255,4.0449076,1991,7,13
14.07.1991,5.6,16.5,15.28,19.51,1011.60004,86.055,2.52,107,1.561255,1991,7,14
15.07.1991,0,18.31,12.09,23.3,1016.2,71.545,2.26,279,4.216522,1991,7,15
16.07.1991,0,18.939999,11.7699995,23.269999,1014.7,62.88,2.21,286,4.3773003,1991,7,16
17.07.1991,4.1,16.539999,12.41,21.58,1015.4,73.465004,1.35,198,2.8875794,1991,7,17
18.07.1991,4.7000003,17.43,10.58,20.89,1015.5,69.91,1.35,220,3.2678711,1991,7,18
19.07.1991,1,17.43,14.139999,22.07,1012.3,84.33,2.58,219,3.2566028,1991,7,19
20.07.1991,0,16.52,11.349999,22.47,1015.2,69.725,2.09,241,3.5134487,1991,7,20
21.07.1991,0,16.46,8.36,22.15,1018,69.020004,1.5799999,228,3.3164139,1991,7,21
22.07.1991,0,17.74,10.74,23.9,1018.8,61.58,1.0799999,306,4.5686646,1991,7,22
23.07.1991,0,19.51,8.96,26.84,1015,62.4,1.7199999,320,4.9499307,1991,7,23
24.07.1991,21.5,16.539999,15.219999,24.279999,1010.3,88.145004,2.22,171,2.4983447,1991,7,24
25.07.1991,19.7,13.179999,11.059999,19.84,1011.60004,89.945,1.89,176,2.382645,1991,7,25
26.07.1991,5.1,13.299999,9.78,16.789999,1012.9,87.94,1.67,151,2.0490592,1991,7,26
27.07.1991,0,14.08,11.4,19.32,1017,81.545006,2.01,177,2.4427576,1991,7,27
28.07.1991,0,17.58,10.059999,22.72,1016.10004,64.630005,1.91,269,4.007029,1991,7,28
29.07.1991,0,18.949999,10.809999,25.46,1011.9,63.545002,2.8799999,303,4.642605,1991,7,29
30.07.1991,0,20.119999,11.86,26.74,1009.4,65.175,2.6499999,305,4.7792754,1991,7,30
31.07.1991,36.8,18.82,13.639999,20.77,1009.3,75.99,2.23,131,2.0039468,1991,7,31
01.08.1991,26.7,15.049999,14.71,17.92,1010.2,92.847374,4.31,57,0.80636203,1991,8,1
02.08.1991,2.2,16.69,14.91,18.69,1017.4,83.435,3.09,77,1.1256934,1991,8,2
03.08.1991,0,18.16,15.389999,21.01,1020,84.985,1.63,113,1.7005856,1991,8,3
04.08.1991,0,18.27,13.41,24.93,1020.9,77.96,1.3,234,3.528138,1991,8,4
05.08.1991,0,18.76,11.84,26.039999,1019.9,72.93,0.7,278,4.2330456,1991,8,5
06.08.1991,0,20.18,12.3,28.18,1016.10004,69.565,1.52,288,4.5083485,1991,8,6
07.08.1991,0,22.64,12.7,31.429998,1012.4,68.12,1.48,293,4.789049,1991,8,7
08.08.1991,1.3000001,22.5,15.48,30.15,1010.8,70.775,2.53,240,3.915647,1991,8,8
09.08.1991,0,20.16,16.55,24.81,1019.7,76.54,1.77,145,2.2664676,1991,8,9
10.08.1991,0,19.609999,14.059999,26.06,1022.60004,65.37,1.27,242,3.7412865,1991,8,10
11.08.1991,0,21.25,14.37,28.449999,1018.3,69.42,1.93,285,4.5434155,1991,8,11
12.08.1991,0,20.84,14.79,26.84,1014.8,65.895004,2.22,218,3.4542527,1991,8,12
13.08.1991,0,20.109999,14.389999,25.66,1016.10004,56.515,1.5999999,257,4.0179863,1991,8,13
14.08.1991,0,19.119999,10.7,26.41,1016.7,62.9,1.1,245,3.7601583,1991,8,14
15.08.1991,0,18.01,13.03,24.869999,1017,67.96,1.03,246,3.6949189,1991,8,15
16.08.1991,0,19.66,11.05,27.68,1015.9,67.255005,1.4699999,251,3.892281,1991,8,16
17.08.1991,0,19.15,11.46,25.369999,1015,65.67,2.85,243,3.7336264,1991,8,17
18.08.1991,0,15.5,13.179999,20.74,1015.5,61.195,2.69,231,3.294153,1991,8,18
19.08.1991,0,13.32,7.87,19.189999,1019.5,63.18,2.1299999,249,3.371684,1991,8,19
20.08.1991,0,15.03,5.85,20.449999,1021.3,67.965004,1.06,159,2.238991,1991,8,20
21.08.1991,0,17.67,10.66,25.51,1018.2,66.335,1.03,259,3.8622973,1991,8,21
22.08.1991,0,18.14,10.5199995,27.41,1014.9,64.91,2.62,268,4.0385523,1991,8,22
23.08.1991,0.8,16.09,11.849999,23.039999,1019.4,86.395004,1.88,127,1.8318573,1991,8,23
24.08.1991,1.3000001,17.369999,13.349999,21.869999,1021.8,86.715004,1.14,120,1.7764455,1991,8,24
25.08.1991,0,16.07,10.78,22.56,1021.3,71.105,0.83,183,2.636663,1991,8,25
26.08.1991,0,15.86,8.26,23.8,1019.9,65.48,1.1999999,246,3.5300856,1991,8,26
27.08.1991,0,15.37,10.42,22.26,1023.2,60.165,1.43,246,3.488072,1991,8,27
28.08.1991,0,17.279999,8.44,22.68,1022.7,58.465,1.15,199,2.9396086,1991,8,28
29.08.1991,0,14.88,12.55,20.689999,1021.7,55.505,2.71,214,3.0028458,1991,8,29
30.08.1991,0,13.469999,6.2799997,21.3,1024.5,64.895,1.87,243,3.295824,1991,8,30
31.08.1991,0,15.07,6.2,23.58,1023.3,64.06,2.12,248,3.4927979,1991,8,31
01.09.1991,0,17.41,8.599999,25.529999,1020.10004,57.47,2.85,240,3.557869,1991,9,1
02.09.1991,0,16.33,7.8399997,25.68,1023.10004,59.495,1.5799999,230,3.3302171,1991,9,2
03.09.1991,0,16.08,8.44,25.24,1026.5,65.545,1.5799999,231,3.3227386,1991,9,3
04.09.1991,0,16.14,7.58,26.359999,1024.5,63.155003,1.38,229,3.3006074,1991,9,4
05.09.1991,0,19.359999,7.77,27.31,1020.7,53.79,1.62,220,3.387391,1991,9,5
06.09.1991,0,12.66,9.63,19.02,1022.60004,72.445,2.08,163,2.169104,1991,9,6
07.09.1991,0,10.559999,3.6,14.09,1024.1,72.175,2.29,139,1.7506454,1991,9,7
08.09.1991,0,11.58,6.46,18.09,1021.8,79.16,1.3399999,160,2.072321,1991,9,8
09.09.1991,0,12.59,4.24,21.55,1021,69.555,1.25,207,2.7516289,1991,9,9
10.09.1991,0,15.95,5.56,26.22,1018.10004,59.93,1.6899999,213,3.0645056,1991,9,10
11.09.1991,11.3,15.99,11.2,20.529999,1014.7,85.6,2.03,101,1.45617,1991,9,11
12.09.1991,0,14.429999,13.24,15.849999,1017.3,82.435,2.19,93,1.2937903,1991,9,12
13.09.1991,0,14.24,9.94,19.81,1020.2,76.3,2.19,144,1.9922884,1991,9,13
14.09.1991,0,14.29,8.5199995,20.88,1021.5,78.35,1.5899999,132,1.8274735,1991,9,14
15.09.1991,0,14.0199995,10.28,19.52,1020.10004,81.725,0.65999997,115,1.5829744,1991,9,15
16.09.1991,3.8,16.43,9.32,23.359999,1020.10004,77.03,1.4399999,160,2.3240912,1991,9,16
17.09.1991,2.3,15.2699995,12.49,21.05,1017.5,75.855,3.53,148,2.0982795,1991,9,17
18.09.1991,0,13.53,10.03,19.85,1021,73.11,1.66,181,2.461842,1991,9,18
19.09.1991,0,13.46,7.4199996,21.22,1017.2,79.015,0.88,171,2.3254168,1991,9,19
20.09.1991,0,13.46,8.07,20.359999,1015.5,82.055,0.75,107,1.4560637,1991,9,20
21.09.1991,0,12.5199995,7.5499997,18.26,1017.10004,87.81,1.8299999,160,2.1265366,1991,9,21
22.09.1991,24.9,15.17,9.69,20.24,1011.3,91.36,2.35,116,1.6447362,1991,9,22
23.09.1991,0,11.38,9.71,15.2,1015.60004,77.85,3.4399998,97,1.2531098,1991,9,23
24.09.1991,0,14.179999,9.41,19.949999,1015.8,79.04,2.24,129,1.7852939,1991,9,24
25.09.1991,0,15.4,8.92,23.699999,1009,80.520004,1.3,177,2.5246024,1991,9,25
26.09.1991,6.2000003,14.49,9.46,18.65,1000.9,87.225,2.25,72,1.0093417,1991,9,26
27.09.1991,1.9,11.01,9.059999,13.679999,1007,84.03,3.28,76,0.9759379,1991,9,27
28.09.1991,0,9.929999,3.9299998,15.21,1007,80.28,2.6399999,102,1.2723265,1991,9,28
29.09.1991,0,12.139999,7.0899997,20.22,999.7,80.175,2.22,78,1.0342917,1991,9,29
30.09.1991,4.3,10.54,9.2699995,12.83,1004.9,93.40588,2.06,47,0.5966022,1991,9,30
01.10.1991,0,12.889999,8.05,15.83,1012.3,72.645004,2.9299998,149,2.0023954,1991,10,1
02.10.1991,0,10.429999,9.9,13.21,1021.2,68.385,6.04,105,1.3194478,1991,10,2
03.10.1991,0,8.4,3.3799999,16.07,1030,79.825005,1.1,158,1.8671701,1991,10,3
04.10.1991,0,8.73,2.3999999,18.88,1026.7001,76.13,1.2099999,164,1.9598862,1991,10,4
05.10.1991,0,10.309999,3.11,19.3,1016.8,83.08,0.91999996,152,1.9075135,1991,10,5
06.10.1991,0,11.059999,4.96,13.74,1014.4,90.955,1.4,53,0.6793198,1991,10,6
07.10.1991,0,11.259999,8.62,16.42,1013.60004,82.740005,1.73,99,1.2760342,1991,10,7
08.10.1991,0,11.5,5.98,18.82,1010.4,84.075005,1.24,100,1.2987534,1991,10,8
09.10.1991,0,10.5199995,6.39,18.17,1015,84.895004,0.64,119,1.5030801,1991,10,9
10.10.1991,0,10.29,5.43,15.5,1021.2,89.53,1.55,123,1.5397629,1991,10,10
11.10.1991,0,11.61,4.02,16.949999,1012.4,77.005005,3.29,99,1.2883309,1991,10,11
12.10.1991,0,10.98,8.55,12.45,1006.60004,88.42,1.51,48,0.6160016,1991,10,12
13.10.1991,1.4,12.07,10.28,14.5,1006.3,89.44,1.0799999,45,0.5940243,1991,10,13
14.10.1991,0,10.86,8.28,15.92,1009.5,87.835,1.1,109,1.3926626,1991,10,14
15.10.1991,0,11.639999,8.79,16.91,1012.2,86.04,0.91999996,95,1.2373366,1991,10,15
16.10.1991,0.90000004,9.33,6.1299996,15.83,1015.60004,87.880005,1.66,109,1.3319405,1991,10,16
17.10.1991,4.1,10.42,6.0299997,13.33,1007.3,84.98,4.3399997,36,0.45502192,1991,10,17
18.10.1991,1.2,7.98,4.48,10.96,1008.4,68.455,5.02,86,1.0139862,1991,10,18
19.10.1991,1.2,4.47,2.8,7.79,1012.5,80.22,3.04,58,0.61044145,1991,10,19
20.10.1991,2.4,3.76,1.89,6.1,1017.3,86.41,3.01,67,0.68639576,1991,10,20
21.10.1991,0,2.81,1.28,5.7,1022.10004,73.195,1.75,73,0.72116584,1991,10,21
22.10.1991,0,0.37,-2.73,6.66,1027.2001,79.485,1.2099999,97,0.8713341,1991,10,22
23.10.1991,1.5,4.5499997,-2.52,5.81,1028.1,86.630005,2.77,36,0.37683386,1991,10,23
24.10.1991,0,6.3199997,4.44,8.309999,1025.9,87.075005,1.89,45,0.49989778,1991,10,24
25.10.1991,0,5.91,4.31,10.49,1025.6,84.685005,2.1299999,28,0.30702466,1991,10,25
26.10.1991,0,0.78,-1.3399999,7.62,1023.2,68.22,3.07,105,0.9606838,1991,10,26
27.10.1991,0,1.04,-2.18,9.17,1020.7,66.915,2.8799999,101,0.9347656,1991,10,27
28.10.1991,0,-0.57,-5.15,7.1299996,1023.10004,77.025,1.89,98,0.84986776,1991,10,28
29.10.1991,0,-0.39999998,-6.45,7.8599997,1026.8,76.785,2.08,97,0.84514207,1991,10,29
30.10.1991,0,-1.26,-5.92,5.3399997,1022.5,82.310005,1.75,79,0.66618705,1991,10,30
31.10.1991,0,-2.27,-4.5699997,1.04,1025.1,89.340004,1.5899999,62,0.50017875,1991,10,31
01.11.1991,0,-2.45,-7.18,1.5699999,1026.7001,90.825005,1.54,72,0.5757865,1991,11,1
02.11.1991,2.1000001,3.07,-4.37,5.25,1019.9,86.82001,1.5799999,29,0.28953177,1991,11,2
03.11.1991,10.1,8.29,4.06,16.39,1008.10004,82.815,3.82,76,0.9044379,1991,11,3
04.11.1991,1,7.25,4.91,10.9,999.5,86.51,3.48,34,0.39387208,1991,11,4
05.11.1991,1.1,4.63,1.89,6.54,1005.5,84.475,4.5099998,32,0.3398702,1991,11,5
06.11.1991,0,2.1,-0.22999999,6.21,1021.8,80.340004,3,61,0.5872493,1991,11,6
07.11.1991,9.1,4.0299997,-0.95,4.95,1023.3,87.130005,5.25,21,0.21647395,1991,11,7
08.11.1991,1.2,8.099999,4.81,9.059999,1019.4,79.035,5.5899997,30,0.35313687,1991,11,8
09.11.1991,3.7,3.6999998,0.79999995,8.08,1013.9,92.92106,4.27,30,0.30725905,1991,11,9
10.11.1991,0,0.7,-1.8399999,4.3199997,1024.2001,85.46,3.22,51,0.4648987,1991,11,10
11.11.1991,3.7,2.02,-4.22,5.41,1022.2,80.435,2.4299998,35,0.33587164,1991,11,11
12.11.1991,0,4.62,2.54,7.17,1018.60004,93.13334,2.29,27,0.284706,1991,11,12
13.11.1991,5.2000003,5.4,1.26,7.48,1005.4,88.94,2.44,20,0.21792127,1991,11,13
14.11.1991,1.8000001,2.4099998,0.78999996,5.2799997,1006.10004,92.32632,2.73,20,0.19646703,1991,11,14
15.11.1991,0,4.7599998,0,7.6499996,1004.7,80.65,2.34,49,0.52291954,1991,11,15
16.11.1991,11.2,3.84,2.6299999,5.96,1006.60004,83.635,2.6499999,32,0.33063805,1991,11,16
17.11.1991,0.90000004,1.61,0.63,2.31,1012.8,89.93,2.6799998,21,0.19951582,1991,11,17
18.11.1991,3.8,1.43,-0.31,2.08,1012.4,93.3125,1.91,29,0.2737214,1991,11,18
19.11.1991,0,4.7,1.73,8.26,1007.10004,93.69286,2.25,44,0.46802798,1991,11,19
20.11.1991,5.8,3.1999998,2.73,4.25,1009.7,90.805,3.1,19,0.19163914,1991,11,20
21.11.1991,0,1.9499999,1.14,2.77,1020.3,86.32,3.1999998,18,0.17246857,1991,11,21
22.11.1991,0,1.74,0.71999997,2.3999999,1022.4,82.91,1.68,24,0.22788897,1991,11,22
23.11.1991,0,-0.35,-2.76,3.98,1024.1,86.225,0.51,35,0.30605698,1991,11,23
24.11.1991,0,0.07,-5.48,1.4399999,1019,90.84211,2.27,27,0.24083224,1991,11,24
25.11.1991,0,1.1,0.41,2.4299998,1017,92.100006,1.3399999,21,0.19522123,1991,11,25
26.11.1991,0,0.88,0.14999999,1.3,1025,94.200005,1.5699999,33,0.30278683,1991,11,26
27.11.1991,0,0.03,-1.0699999,1.39,1030.2001,94.700005,1.38,32,0.28309998,1991,11,27
28.11.1991,0,0.39,-0.63,1.4499999,1029.6,94.27144,0.96,33,0.2962519,1991,11,28
29.11.1991,0,0.39,-1.3299999,1.8,1028.8,93.842865,1.65,27,0.24250102,1991,11,29
30.11.1991,0,1.42,-1.04,5.27,1024.2001,90.9,2.01,39,0.36549646,1991,11,30
01.12.1991,0,0.41,0.049999997,1.4,1027.3,85.92,2.71,24,0.21591532,1991,12,1
02.12.1991,0,-0.98999995,-3.3999999,3.78,1028.4,89.07,1.49,36,0.3058949,1991,12,2
03.12.1991,0,-0.72999996,-3.07,-0.11,1031.7001,86.05,0.9,17,0.14571367,1991,12,3
04.12.1991,0,-2.04,-3.1899998,-0.93,1030.4,91.225,1.3399999,17,0.13804874,1991,12,4
05.12.1991,1.3000001,-0.64,-2.24,1.66,1027.5,88.545006,2.22,18,0.15524395,1991,12,5
06.12.1991,1.1,-2.03,-5.67,-0.69,1035.7001,78.18,2.03,31,0.2510204,1991,12,6
07.12.1991,0,-0.08,-2.73,0.44,1036,88.125,2.8,17,0.1492259,1991,12,7
08.12.1991,0,0.53999996,-0.13,1.29,1032.2001,88.175,1.4699999,12,0.10820216,1991,12,8
09.12.1991,0,-5.0899997,-7.8999996,0.94,1036.8,71.095,2.87,52,0.366729,1991,12,9
10.12.1991,0,-7.97,-12.599999,-2.8,1041.4,65.535,2.47,52,0.3173568,1991,12,10
11.12.1991,0,-7.45,-10.21,-0.84999996,1040.4,84.450005,1.2099999,56,0.35116363,1991,12,11
12.12.1991,0,-8.13,-12.29,-6.66,1043,93.05556,0.79999995,38,0.22976163,1991,12,12
13.12.1991,0,-9.469999,-10.38,-7.44,1043.4,89.86,0.7,37,0.2084895,1991,12,13
14.12.1991,0,-8.0199995,-11.2,-3.1299999,1039.7001,91.08501,0.57,42,0.2559747,1991,12,14
15.12.1991,0,-9.599999,-11.87,-4.52,1034.6,89.020004,1.1899999,46,0.25904423,1991,12,15
16.12.1991,0,-7.5099998,-12.96,-3.51,1030.3,87.275,0.91999996,44,0.277015,1991,12,16
17.12.1991,6.3,-0.32999998,-8.34,2.45,1026.7001,94.700005,1.4499999,17,0.14854611,1991,12,17
18.12.1991,2.6000001,3.1599998,1.67,5.08,1013.7,84.755005,5.7999997,25,0.2512487,1991,12,18
19.12.1991,10.3,4.58,0.97999996,6.8599997,1012.7,89.68,5.31,15,0.15844518,1991,12,19
20.12.1991,2.3,1.3399999,-0.13,7.7599998,1004.9,82.905,5.9,29,0.2739707,1991,12,20
21.12.1991,15.8,1.73,-0.89,2.8,1007.4,91.98,4.91,16,0.15316778,1991,12,21
22.12.1991,18.6,9.42,2.44,10.639999,1007.10004,94.25883,5.23,16,0.19676746,1991,12,22
23.12.1991,4,8.62,7.22,10.78,1020.5,78.14,6.0699997,17,0.20308982,1991,12,23
24.12.1991,1.6,2.61,2.22,8.41,1029.6,80.515,6.16,32,0.31254688,1991,12,24
25.12.1991,1.2,0.84,0.66999996,1.9799999,1039.6,91.805,3.6399999,20,0.18168998,1991,12,25
26.12.1991,5.2000003,1.27,-0.78,1.9399999,1029.8,86.495,4.8199997,15,0.13932844,1991,12,26
27.12.1991,2.7,2.6,1.28,3.9399998,1020.3,82.18,6.1299996,19,0.18646058,1991,12,27
28.12.1991,0,-1.9699999,-3.86,2.1,1036.5,88.380005,1.52,54,0.43816876,1991,12,28
29.12.1991,0,-1.9799999,-7.2999997,2.5,1039.8,88.225,0.55,38,0.30758435,1991,12,29
30.12.1991,0,0.90999997,-1.06,2.02,1042.1,92.245,0.85999995,16,0.14554068,1991,12,30
31.12.1991,0,-0.71,-1.13,1.11,1038.8,81.66,1.3199999,17,0.14521578,1991,12,31
01.01.1992,0,-1.38,-3.1899998,-0.26,1037.2001,91.195,2.02,29,0.241161,1992,1,1
02.01.1992,0,-2.19,-4.92,3.8,1037.4,84.490005,1.62,48,0.3856116,1992,1,2
03.01.1992,0,-3.6,-8.67,4.71,1033.9,81.72,1.81,59,0.4464567,1992,1,3
04.01.1992,2.7,2.9099998,-5.49,5,1029.7001,79.155,3.1799998,38,0.3751976,1992,1,4
05.01.1992,2,6.29,4.22,7.91,1029.3,85.255005,4.2,19,0.21051121,1992,1,5
06.01.1992,0,3.5,1.03,8.01,1030.2001,86.16,2.6799998,20,0.20163082,1992,1,6
07.01.1992,0,-0.84999996,-2.54,3.6999998,1026.2001,92.36,1.24,41,0.35085937,1992,1,7
08.01.1992,3,0.26999998,-2.73,3.3999999,1020.2,89.015,1.18,32,0.287496,1992,1,8
09.01.1992,1.6,2.87,-0.28,3.8999999,1010.5,91.3575,2.06,19,0.18931177,1992,1,9
10.01.1992,12.7,3.79,1.54,5.1,1016.5,93.700005,2.75,18,0.18467695,1992,1,10
11.01.1992,0,1.39,1.3399999,3.11,1028.3,92.81053,1.5999999,18,0.16810565,1992,1,11
12.01.1992,1,2.02,0.7,2.48,1033.7001,87.255005,2.1599998,20,0.19069633,1992,1,12
13.01.1992,0,0.82,0.26,1.91,1034.7001,81.08,1.43,20,0.18205975,1992,1,13
14.01.1992,0,0.37,-1.4699999,1.2099999,1036,84.04,2.6399999,23,0.20554827,1992,1,14
15.01.1992,0,2.73,0.59,3.6799998,1033.9,88.745,3.1499999,18,0.17616332,1992,1,15
16.01.1992,0,1.68,1.11,2.6599998,1030.5,81.130005,3.48,17,0.16032258,1992,1,16
17.01.1992,0,1.7199999,0.66999996,3.9499998,1031.3,77.91,4.0099998,24,0.2265775,1992,1,17
18.01.1992,0,1.14,-2.1599998,2.61,1029.6,79.545,2.27,26,0.24032861,1992,1,18
19.01.1992,6.8,0.93,0.14,2.44,1023.8,91.200005,2.84,21,0.19318932,1992,1,19
20.01.1992,0.90000004,-3.46,-6.74,1,1021.8,87.71,3.33,23,0.17650142,1992,1,20
21.01.1992,0,-7.17,-10.34,-5.12,1034,67.345,4.48,74,0.47269034,1992,1,21
22.01.1992,0,-4.47,-9.22,-0.61,1031.3,78.55,2.74,55,0.40069923,1992,1,22
23.01.1992,0,-3.97,-9.26,1.92,1032.3,86.695,1.2099999,60,0.44695577,1992,1,23
24.01.1992,0,-4.64,-9.719999,-3.1699998,1035.4,93.623535,0.72999996,46,0.33161438,1992,1,24
25.01.1992,0,-3.4399998,-4.7999997,-3.1899998,1037.5,92.815796,0.59999996,27,0.20530999,1992,1,25
26.01.1992,0,-3.37,-5.0499997,-2.56,1038.6,87.9,1.12,27,0.20580988,1992,1,26
27.01.1992,0,-1.11,-3.09,0.099999994,1038.9,82.425,2.23,23,0.19323605,1992,1,27
28.01.1992,0,-2.09,-2.54,-0.71999997,1040.7001,79.89,2.69,29,0.23350166,1992,1,28
29.01.1992,0,-1.63,-6.7799997,6.18,1038.9,76.885,1.13,82,0.67406374,1992,1,29
30.01.1992,0,-1.54,-5.56,1.42,1037.1,89.89,1.06,57,0.4708568,1992,1,30
31.01.1992,0,-0.42,-5.0899997,8.5199995,1035.3,80.025,0.65999997,70,0.60633045,1992,1,31
01.02.1992,0,-3.26,-7.21,-0.91999996,1033.6,93.5077,0.64,44,0.3381146,1992,2,1
02.02.1992,0,-2.1299999,-5.0699997,1.7199999,1030.3,91.840004,0.83,43,0.3478613,1992,2,2
03.02.1992,1.6,-0.17,-6.25,3.1999998,1021.10004,88.555,4.14,24,0.21176982,1992,2,3
04.02.1992,3.3,0.82,0.14,1.18,1015.8,85.585,4.19,26,0.23927793,1992,2,4
05.02.1992,5.6,3.1299999,-1.38,5.17,1019.2,93.19412,4.29,24,0.24021886,1992,2,5
06.02.1992,0,4.29,3.4099998,5.5299997,1029.2001,87.78,3.82,28,0.290329,1992,2,6
07.02.1992,0,2.6699998,-1.0799999,7.16,1033.2001,89.6,0.77,51,0.49822894,1992,2,7
08.02.1992,0,1.3199999,-1.8299999,5.0499997,1031.1,92.155556,0.77,69,0.6416631,1992,2,8
09.02.1992,0,0.14999999,-1.54,1.74,1023.4,93.4,1.36,72,0.642591,1992,2,9
10.02.1992,0,1.05,-1.66,7.3599997,1021.4,81.965004,3.47,73,0.67561007,1992,2,10
11.02.1992,8.6,1.6899999,-2.1499999,5.23,1019.8,91.365005,2.6399999,29,0.27525383,1992,2,11
12.02.1992,0,7.2799997,1.06,9.37,1015.9,92.925,1.8199999,33,0.3796015,1992,2,12
13.02.1992,1.9,5.68,3.85,10.349999,1011.10004,90.19,2.57,49,0.53722596,1992,2,13
14.02.1992,0,3.31,1.6899999,6.15,1022.5,80.065,3.3,66,0.6636605,1992,2,14
15.02.1992,2.5,4.5699997,-2.8799999,7.12,1019.60004,86.575005,3.8999999,33,0.34720364,1992,2,15
16.02.1992,4.6,1.4699999,0,6.08,1017.8,71.405,6,84,0.79160017,1992,2,16
17.02.1992,1.8000001,-2.31,-3.4399998,0.099999994,1019.3,83.295,4.24,44,0.35564443,1992,2,17
18.02.1992,0,-4.15,-9.23,-1.7199999,1031.5,75.19,2.23,78,0.5765964,1992,2,18
19.02.1992,0,-3.9399998,-7.06,-2.1399999,1035.9,76.275,1.8499999,90,0.66979057,1992,2,19
20.02.1992,0,-2.25,-5.16,-0.03,1031.4,82.26,1.54,56,0.4503921,1992,2,20
21.02.1992,1.1,0.06,-3.74,0.9,1034.6,89.69,2.71,40,0.3533849,1992,2,21
22.02.1992,0,0.7,-0.32999998,3.62,1034.1,87.98,1.8199999,73,0.6616425,1992,2,22
23.02.1992,0,4.14,-0.97999996,6.3199997,1031.2001,68.295,4.02,52,0.53583497,1992,2,23
24.02.1992,0,2.4299998,-0.17999999,8.86,1031.3,81.67,1.53,116,1.1244763,1992,2,24
25.02.1992,0,-0.11,-3.6699998,3.1699998,1025.7001,91.19,0.7,53,0.4675063,1992,2,25
26.02.1992,0,4.46,-1.13,10.58,1028.9,80.58,0.90999997,58,0.60500693,1992,2,26
27.02.1992,0,3.4499998,-2.1399999,12.009999,1032.6,80.07,0.83,121,1.2161392,1992,2,27
28.02.1992,0,2.3,-2.72,9.5199995,1034.3,87.025,0.71999997,118,1.1365043,1992,2,28
29.02.1992,0,2.6799998,-1.5699999,10.5,1033.2001,82.42,0.53999996,123,1.2020496,1992,2,29
01.03.1992,0,3.07,-1.36,11.38,1027.9,80.4,1.02,139,1.3817226,1992,3,1
02.03.1992,2.3,2.55,-2.8899999,11.09,1027.2001,85.705,3.05,88,0.8587549,1992,3,2
03.03.1992,0,6.24,-0.79999995,8.929999,1032.5,61.93,3.74,83,0.9166777,1992,3,3
04.03.1992,0,4.73,0.29,11.66,1032.4,80.815,1.1899999,114,1.1979505,1992,3,4
05.03.1992,0,5.73,-2.6399999,15.179999,1027.6,72.74,1.76,136,1.4810795,1992,3,5
06.03.1992,0.7,6.93,1.26,11.179999,1028.4,78.99,2.48,73,0.82567847,1992,3,6
07.03.1992,0,4.35,-1.62,11.28,1031.8,79.16,1.68,132,1.3696531,1992,3,7
08.03.1992,0,1.4699999,0.07,5.96,1030.3,88.785,1.4499999,129,1.20706,1992,3,8
09.03.1992,0,3.5,-2.06,12.179999,1034.3,77,1.02,152,1.529032,1992,3,9
10.03.1992,0,3.6399999,-3.77,12.78,1031,76.665,1.0799999,159,1.6102227,1992,3,10
11.03.1992,0,3.01,-0.06,7.94,1025.3,57.455,4.61,157,1.5594943,1992,3,11
12.03.1992,1.8000001,5.48,-1.63,7.64,1017.4,66.105,5.6,59,0.6406024,1992,3,12
13.03.1992,19.4,6.58,5.0899997,7.81,1000.5,88.325005,8.82,46,0.52175206,1992,3,13
14.03.1992,5.5,2.49,1.35,7.5299997,1009.4,81.795,5.56,73,0.717871,1992,3,14
15.03.1992,3.1000001,1.9599999,1.11,3.99,1013,88.450005,4.36,59,0.56785595,1992,3,15
16.03.1992,0,1.88,-1.5699999,3.1999998,1026.8,78.46,3.47,89,0.84743255,1992,3,16
17.03.1992,0,2.75,-1.6899999,5.8599997,1032.3,73.625,0.72999996,68,0.66657376,1992,3,17
18.03.1992,0,3.51,-1.5999999,10.4,1026.6,78.810005,1.49,154,1.5561109,1992,3,18
19.03.1992,0,6.8399997,-1.8499999,13.53,1022.60004,72.64,2.48,130,1.4704126,1992,3,19
20.03.1992,4.5,8.34,5.8199997,10.71,1022.2,81.47,2.75,53,0.62749535,1992,3,20
21.03.1992,2.3,8.16,5.5099998,13.58,1017.4,75.815,4.49,75,0.8852462,1992,3,21
22.03.1992,23,4.8399997,1.8299999,6.79,1011.3,89.445,5.66,49,0.5225143,1992,3,22
23.03.1992,7.9,3.3999999,1.9599999,6.2999997,999.60004,92.72,2.54,58,0.59240836,1992,3,23
24.03.1992,11,1.76,0.59,4.06,996.2,94.200005,1.48,49,0.4726173,1992,3,24
25.03.1992,0,1.86,0.65,3.97,1004.4,84.635,3.1499999,85,0.81905013,1992,3,25
26.03.1992,1.4,2.87,-0.099999994,4.6,996.8,72.305,2.24,103,1.0340849,1992,3,26
27.03.1992,4.2000003,1.9699999,0.48,5.38,995.4,81.850006,2.06,82,0.7974416,1992,3,27
28.03.1992,4.1,1.09,-0.13,4.02,1002,81.15,4.54,135,1.2654613,1992,3,28
29.03.1992,0,1.31,-1.22,3.6999998,1005.7,77.315,3.5,121,1.1412951,1992,3,29
30.03.1992,0,5.33,-1.38,11.7,999.7,71.505005,3.03,177,1.9298624,1992,3,30
31.03.1992,0,8.2,-1.3199999,13.759999,988.60004,67.685005,4.43,135,1.6172029,1992,3,31
01.04.1992,2.3,3.1,1.49,9.16,990.7,86.315,3.05,99,1.0054748,1992,4,1
02.04.1992,0,4.42,-1.1899999,11.5199995,998.7,73.245,2.01,199,2.106223,1992,4,2
03.04.1992,4,6.37,2.23,10.179999,1004.5,75.24,2.53,112,1.2595053,1992,4,3
04.04.1992,11,5,3.99,7.8999996,1006.5,93,0.64,74,0.7953063,1992,4,4
05.04.1992,5,2.9299998,2.52,4.4,1009.10004,90.425,2.74,74,0.7394785,1992,4,5
06.04.1992,0,2.54,-2.07,7.12,1011.60004,78.735,1.11,181,1.7809821,1992,4,6
07.04.1992,0,4.43,-3.24,10.849999,1005.60004,72.185,2.34,187,1.9726535,1992,4,7
08.04.1992,0,6.23,-1.24,11.059999,1009.2,56.760002,4.0899997,218,2.434978,1992,4,8
09.04.1992,0,6.44,1.88,12.639999,1021.60004,56.08,3.4299998,246,2.7490568,1992,4,9
10.04.1992,0,7,0.9,13.71,1021.9,60.615,2.25,240,2.7290823,1992,4,10
11.04.1992,0,6.17,-1.04,14.24,1018.4,63.88,1.4399999,243,2.6966012,1992,4,11
12.04.1992,0,10.29,-0.68,17.31,1014.4,57.53,1.6899999,206,2.5865047,1992,4,12
13.04.1992,0.8,8.5,6.7799997,12.28,1016.10004,56.185,4.4,175,2.0875883,1992,4,13
14.04.1992,0,7,2.09,13.059999,1017.3,63.395,4.19,187,2.1311774,1992,4,14
15.04.1992,1.5,6.93,1.48,12.059999,1003.60004,67.92,4.62,100,1.1448593,1992,4,15
16.04.1992,0,3.53,1.06,7.0699997,1014.10004,76.98,4.9,140,1.4252112,1992,4,16
17.04.1992,1.2,2.59,-1.03,5.17,1026.2001,66.770004,3.04,162,1.5840751,1992,4,17
18.04.1992,1.2,5.12,0.42999998,6.5299997,1023.7,91.115005,2.59,72,0.77002543,1992,4,18
19.04.1992,1.4,9.599999,6.24,13.309999,1020.4,77.89,4.5899997,109,1.3391947,1992,4,19
20.04.1992,0,4.63,1.15,9.38,1025,62.065002,2.8799999,244,2.5651896,1992,4,20
21.04.1992,0,6.75,-2.96,13.799999,1022.2,55.61,2.07,266,3.000826,1992,4,21
22.04.1992,0,11.21,-1.0699999,16.85,1011,62.31,3.03,177,2.280944,1992,4,22
23.04.1992,4.5,7.68,4.58,12.009999,1010.2,84.94,3.02,89,1.0391096,1992,4,23
24.04.1992,0,10.179999,2.76,17.47,1012.4,76.62,1.52,238,2.9819837,1992,4,24
25.04.1992,0,17.27,4.64,25.73,1014.4,56.015,2.07,257,3.8065064,1992,4,25
26.04.1992,1.8000001,15.24,8.61,22.359999,1019,64.685005,1.9499999,244,3.4550912,1992,4,26
27.04.1992,8.1,9.809999,6.77,17.77,1017,88.810005,3.06,150,1.8565735,1992,4,27
28.04.1992,11.900001,12.15,3.37,19.66,1011,77.16,2.69,161,2.125422,1992,4,28
29.04.1992,0,6.0699997,4.9,10.33,1017.10004,81.450005,2.96,87,0.96299267,1992,4,29
30.04.1992,0,8.099999,0.35,13.41,1022.5,73.03,1.25,168,1.9746852,1992,4,30
01.05.1992,4.1,11.63,5.1099997,17.96,1013.5,75.75,2.18,218,2.8370776,1992,5,1
02.05.1992,1.4,10.84,8.87,15.639999,1012.2,77.195,2.33,111,1.4158092,1992,5,2
03.05.1992,0,9.5199995,7.0299997,11.61,1023.4,72.585,2.75,86,1.052822,1992,5,3
04.05.1992,0,10.63,7.37,13.349999,1024.9,63.18,2.97,168,2.119155,1992,5,4
05.05.1992,0,11.65,6.44,16.789999,1023.10004,60.21,1.74,192,2.4899378,1992,5,5
06.05.1992,0,11.38,2.82,18.59,1025.7001,63.615,1.2099999,280,3.6017914,1992,5,6
07.05.1992,0,12.74,2.95,19.77,1020.8,63.31,1.63,226,3.0156326,1992,5,7
08.05.1992,0,15.03,9.38,19.619999,1011,59.89,4.29,214,3.0251327,1992,5,8
09.05.1992,0,11.33,8.09,14.46,1009.9,69.96,3.11,127,1.642511,1992,5,9
10.05.1992,1,11.259999,7.3399997,15.349999,1012.5,76.415,3.9499998,196,2.5274749,1992,5,10
11.05.1992,2.1000001,10.3,7.14,15.99,1015.2,71.11,4.7,185,2.3226461,1992,5,11
12.05.1992,0,11.509999,1.51,17.02,1026.8,64.445,1.53,287,3.7026784,1992,5,12
13.05.1992,0,15.75,4.67,23.83,1027.3,57.875,1.12,317,4.5258346,1992,5,13
14.05.1992,0,18.44,8.2,26.64,1025.4,54.43,2.9199998,322,4.86389,1992,5,14
15.05.1992,0,19.08,9.42,26.99,1026.1,56.7,2.1399999,319,4.8773265,1992,5,15
16.05.1992,0,18.699999,9.599999,26.34,1026.1,56.91,1.49,307,4.6597476,1992,5,16
17.05.1992,0,14.429999,11.719999,20.34,1026.2001,52.9,2.9099998,306,4.2425528,1992,5,17
18.05.1992,0,15.2,7.5299997,19.9,1023.3,48.245,3.12,321,4.5341234,1992,5,18
19.05.1992,0,15.0199995,5.7599998,19.689999,1023.2,50.91,3.6399999,314,4.417521,1992,5,19
20.05.1992,0,15.79,10.04,20.35,1020.2,49.135002,5.66,322,4.613146,1992,5,20
21.05.1992,3.5,14.21,7.68,21.869999,1017.5,64.8,3.04,287,3.9720984,1992,5,21
22.05.1992,0,15.299999,6.46,22.76,1015.7,57.56,2.24,329,4.6706457,1992,5,22
23.05.1992,0,18.65,8.51,24.58,1012.3,49.550003,3.8799999,301,4.5850115,1992,5,23
24.05.1992,4.8,17.23,12.679999,24.689999,1012.2,63.365,2.84,278,4.117321,1992,5,24
25.05.1992,0,17.34,9.29,24.859999,1016,63.72,1.13,317,4.6992903,1992,5,25
26.05.1992,0,17.8,9.059999,24.76,1013.9,43.89,2.82,281,4.207445,1992,5,26
27.05.1992,0,18.14,10.559999,23.939999,1013.3,42.405003,3.53,304,4.583504,1992,5,27
28.05.1992,0,17.619999,8.95,21.9,1014.5,46.635002,3.1599998,324,4.8328424,1992,5,28
29.05.1992,0,17.369999,7.04,23.16,1011,51.09,2.59,269,3.9970505,1992,5,29
30.05.1992,0,16.72,11.24,23.019999,1014.10004,50.46,2.69,287,4.2032948,1992,5,30
31.05.1992,0,17.89,9.07,24.46,1011.7,46.65,2.8899999,299,4.488334,1992,5,31
01.06.1992,0,19.88,13.19,26.519999,1008.7,58.315,1.61,235,3.6672304,1992,6,1
02.06.1992,8.5,19.74,14.03,28.92,1005.9,66.835,2.46,239,3.7234373,1992,6,2
03.06.1992,10.8,15.65,13.46,19.97,1009.9,82.465004,2.1699998,118,1.6917436,1992,6,3
04.06.1992,0,15.2699995,13.09,19.88,1011.60004,76.2,2.9099998,171,2.4296846,1992,6,4
05.06.1992,13.8,15.46,12.03,22.08,1009.9,74.865,2.56,175,2.4985373,1992,6,5
06.06.1992,0,14.639999,10.04,18.97,1012,75.96,1.68,207,2.899452,1992,6,6
07.06.1992,0,15.58,11.61,20.33,1011,68.275,1.8199999,241,3.448502,1992,6,7
08.06.1992,2.5,13.37,10.29,17.949999,1005.3,86.26,1.3199999,145,1.9769183,1992,6,8
09.06.1992,1.2,13.259999,10.2699995,18.289999,1008.5,80.935,1.52,163,2.2136526,1992,6,9
10.06.1992,8.1,13.219999,9,19.58,1010,82.805,1.4499999,186,2.522066,1992,6,10
11.06.1992,0,13.15,7.14,18.02,1010.8,67.770004,1.9499999,239,3.2342143,1992,6,11
12.06.1992,0,15.04,7.37,18.08,1012.8,73.9,2.1599998,133,1.8792577,1992,6,12
13.06.1992,0,16.58,13,22.16,1015.3,72.01,2.54,203,2.963096,1992,6,13
14.06.1992,0,16.84,9.429999,22.949999,1021.8,70.705,1.18,246,3.6020887,1992,6,14
15.06.1992,0,18.93,9.86,25.73,1020.4,61.265,1.54,312,4.7654753,1992,6,15
16.06.1992,0,20.699999,10.5199995,25.32,1016.2,59.170002,2.51,267,4.218462,1992,6,16
17.06.1992,0,16.789999,15.599999,20.09,1018.60004,69.15,3.22,182,2.6651733,1992,6,17
18.06.1992,0,17.039999,9.79,22.699999,1013.9,58.56,1.36,252,3.7155356,1992,6,18
19.06.1992,3.2,11.969999,10.45,15.48,1011.7,90.055,2.46,83,1.0904229,1992,6,19
20.06.1992,0,16.92,11.67,23.97,1012.4,79.130005,2.08,206,3.0313787,1992,6,20
21.06.1992,0,17.49,14.28,21.779999,1016.10004,67.95,2.6299999,232,3.449599,1992,6,21
22.06.1992,0,20.199999,10.16,24.769999,1012.60004,53.445,1.54,265,4.154324,1992,6,22
23.06.1992,2.1000001,19.039999,13.62,22.85,1005.7,76.155,1.93,164,2.5221963,1992,6,23
24.06.1992,1.7,16.01,14.86,19.02,1010.60004,86.735,2.2,179,2.5856867,1992,6,24
25.06.1992,2.4,16.58,15.04,19.22,1013.9,83.31,1.49,112,1.6356237,1992,6,25
26.06.1992,0,17.529999,13.49,22.63,1017.2,73.19,1.4399999,235,3.4957154,1992,6,26
27.06.1992,0,17.9,12.11,23.75,1019.60004,53.96,2.04,321,4.8066735,1992,6,27
28.06.1992,0,17.66,8.2699995,24.65,1020.60004,56.11,2.23,337,5.020342,1992,6,28
29.06.1992,0,19.72,8.73,26.63,1017.5,43.495,2.23,336,5.213509,1992,6,29
30.06.1992,0,20.65,9.679999,28.8,1013.3,51.56,1.38,330,5.2138476,1992,6,30
01.07.1992,4.7000003,20.43,12.15,24.41,1011.8,59.43,2.25,241,3.7946115,1992,7,1
02.07.1992,1.5,18.48,15.2,22.96,1014.4,75.045,1.4499999,220,3.3378744,1992,7,2
03.07.1992,2.5,18.49,13.139999,26.109999,1015.10004,75.475,1.04,242,3.671522,1992,7,3
04.07.1992,5.9,15.62,13.58,19.939999,1010.60004,83.515,2.2,135,1.9337063,1992,7,4
05.07.1992,7.7000003,14.809999,12.139999,17.42,1008.8,87.950005,0.84999996,93,1.3092661,1992,7,5
06.07.1992,2.6000001,16.16,12.679999,21.029999,1010.10004,77.025,1.31,149,2.1596413,1992,7,6
07.07.1992,0,14,12.23,17.46,1016.4,85.185005,1.5699999,84,1.1573771,1992,7,7
08.07.1992,0,17.4,13.63,22.369999,1018.4,70.695,1.65,212,3.1439822,1992,7,8
09.07.1992,0,19.689999,10.51,26,1013.7,57.36,2.11,305,4.735583,1992,7,9
10.07.1992,1.6,17.18,14.48,21.8,1009.4,79.61,1.67,158,2.3399472,1992,7,10
11.07.1992,9.7,14.03,13.599999,15.5,1011.5,90.545006,1.9399999,93,1.2847227,1992,7,11
12.07.1992,0,14.92,11.889999,19.189999,1011.5,81.845,2.47,182,2.5659554,1992,7,12
13.07.1992,0,16,11.099999,21.15,1019,71.200005,1.87,274,3.945109,1992,7,13
14.07.1992,0,19,10.19,23.34,1018.10004,68.42,2.75,158,2.4183128,1992,7,14
15.07.1992,0,15.99,14.349999,20.109999,1019.5,79.96,2.1599998,186,2.6770043,1992,7,15
16.07.1992,0,18.51,10.71,24.199999,1018.9,69.615,0.77,221,3.3500068,1992,7,16
17.07.1992,4,20.42,11.429999,28.88,1018.60004,69.015,1.3399999,280,4.3986564,1992,7,17
18.07.1992,0,18.55,14.259999,22.67,1021.60004,64.08,2.6299999,138,2.0916193,1992,7,18
19.07.1992,0,20.32,11.2,27.49,1020.4,59.305,1.0799999,315,4.9368734,1992,7,19
20.07.1992,0,23.32,12.55,30.849998,1014.7,54.54,1.81,317,5.2345405,1992,7,20
21.07.1992,24.6,25.609999,14.969999,33.18,1010.7,57.415,2.12,304,5.2005587,1992,7,21
22.07.1992,1.8000001,17.66,16.15,23.57,1021,89.795,1.63,110,1.6384641,1992,7,22
23.07.1992,0,19.34,13.599999,24.74,1022.8,73.675,1.91,274,4.2144227,1992,7,23
24.07.1992,0,20.65,12.79,26.8,1017.7,62.190002,2,299,4.7177095,1992,7,24
25.07.1992,6.4,18.02,16.32,24.269999,1018.2,80.53,1.28,199,2.988364,1992,7,25
26.07.1992,0,19.99,11.41,26.42,1020.5,67.28,0.64,279,4.346456,1992,7,26
27.07.1992,0,22.5,12.7699995,29.07,1018.7,60.125,2.8799999,302,4.9160905,1992,7,27
28.07.1992,0,16.73,12.219999,22.269999,1027.4,54.115,1.68,302,4.403231,1992,7,28
29.07.1992,0,19.26,9.25,25.76,1022.10004,53.885002,1.4,303,4.65451,1992,7,29
30.07.1992,0,22.4,13.32,31.269999,1018.4,62.475002,1.55,293,4.762178,1992,7,30
31.07.1992,1.4,21.15,15.589999,28.8,1018.10004,70.19,1.3399999,215,3.4217691,1992,7,31
01.08.1992,0,20.81,15.7699995,29.31,1014.9,77.12,1.6999999,233,3.6898758,1992,8,1
02.08.1992,0,21.77,14.799999,29.359999,1013.8,71.82,1.86,267,4.3000917,1992,8,2
03.08.1992,10.7,23.539999,16.09,32.54,1011.4,66.62,1.73,262,4.345224,1992,8,3
04.08.1992,0,18.09,15.33,24.029999,1020.10004,73.205,2.08,210,3.1559086,1992,8,4
05.08.1992,0,19.98,10.12,27.57,1024,63.64,1.02,302,4.698759,1992,8,5
06.08.1992,0,22.689999,12.17,30.849998,1022,61.485,1.03,286,4.6657157,1992,8,6
07.08.1992,0,24.55,15.07,32.969997,1019.3,59.38,1.3299999,280,4.70593,1992,8,7
08.08.1992,0,24.91,17.15,33.64,1015.7,58.405003,1.22,282,4.769447,1992,8,8
09.08.1992,0,24.96,16.93,34.46,1011.10004,57.275,1.2099999,288,4.880341,1992,8,9
10.08.1992,8.900001,17.039999,15.11,24.25,1013.5,80.615,3.12,177,2.6100855,1992,8,10
11.08.1992,0,16.96,12.66,23.56,1018.10004,71.585,1.62,237,3.4834864,1992,8,11
12.08.1992,0,17.619999,12.71,23.21,1019.9,65.645004,1.9399999,233,3.4690669,1992,8,12
13.08.1992,0,17.35,9.83,20.68,1016.5,61.145,3.49,122,1.8086162,1992,8,13
14.08.1992,4.1,13.29,11.21,16.68,1012.4,89.995,2.46,87,1.180535,1992,8,14
15.08.1992,0,14.299999,9.19,19.85,1017.7,74.99,0.88,221,3.0648086,1992,8,15
16.08.1992,0,17.17,7.69,23.91,1018.8,63.905003,0.82,235,3.4682446,1992,8,16
17.08.1992,0,20.16,10.15,26.369999,1017.4,64.155,2.01,213,3.331746,1992,8,17
18.08.1992,0,21.57,16.109999,29.55,1016.7,64.590004,1.31,244,3.913052,1992,8,18
19.08.1992,0,23.35,13.759999,31.22,1013.4,54.33,2.21,249,4.1150956,1992,8,19
20.08.1992,2.3,26.09,17.109999,32.44,1011.10004,50.325,1.91,223,3.8403723,1992,8,20
21.08.1992,8.8,21.949999,17.449999,27.24,1013.4,67.525,1.5799999,230,3.715829,1992,8,21
22.08.1992,1.9,19.8,17.01,25.09,1012.4,76.605,1.1,211,3.2840629,1992,8,22
23.08.1992,4.4,17.46,15.23,22.99,1014.5,80.455,2.1399999,152,2.2599516,1992,8,23
24.08.1992,0,17.88,12.03,21.23,1019.7,82.1,1.5899999,97,1.4518555,1992,8,24
25.08.1992,0,20.68,13.91,28.72,1017.7,69.915,2.1399999,259,4.0887475,1992,8,25
26.08.1992,3.6000001,21.58,12.92,30.07,1013.5,64.630005,1.48,201,3.227054,1992,8,26
27.08.1992,0,20.64,14.46,27.15,1014.8,75.13,1.6999999,234,3.6947427,1992,8,27
28.08.1992,0,22.76,15.03,31.73,1009.2,69.91,1.4599999,234,3.835596,1992,8,28
29.08.1992,11.7,20.52,15.58,31.189999,1005.2,72.255005,2.18,186,2.9392784,1992,8,29
30.08.1992,0,16.59,13.82,21.289999,1007.7,79.965004,1.5,169,2.4739997,1992,8,30
31.08.1992,17.300001,15.82,12.75,24.269999,1002.7,81.355,2.48,152,2.193018,1992,8,31
01.09.1992,3.8,10.12,8.67,14.49,1015.4,78.53,5.17,172,2.1486652,1992,9,1
02.09.1992,0,13.09,7.62,19.1,1022.10004,70.675,2.1299999,203,2.7306821,1992,9,2
03.09.1992,0,15.87,11.46,20.539999,1016.7,71.43,4.16,130,1.8680688,1992,9,3
04.09.1992,4.4,10.5,8.49,14.38,1014.8,77.745,4.0099998,109,1.3761494,1992,9,4
05.09.1992,1.4,9.49,7.23,10.62,1020.5,78.92,5.0299997,107,1.3105085,1992,9,5
06.09.1992,0,8.42,6.22,14.54,1022.7,73.23,3,187,2.2186925,1992,9,6
07.09.1992,0,11.75,1.12,19.88,1016.60004,73.05,0.78999996,197,2.5683572,1992,9,7
08.09.1992,0,12.78,10.53,16.66,1018.9,77.075,1.6999999,121,1.6174014,1992,9,8
09.09.1992,0,12.639999,6.39,19.289999,1024.6,69.32,0.9,213,2.8307698,1992,9,9
10.09.1992,0,15.94,9.849999,21.779999,1022.10004,71.845,1.41,160,2.2981462,1992,9,10
11.09.1992,0,15.63,12.61,24.26,1020.5,80.085,1.26,199,2.8407133,1992,9,11
12.09.1992,0,13.88,10.92,19.439999,1025.4,76.67,1.3199999,118,1.6155982,1992,9,12
13.09.1992,6.2000003,15.059999,12.78,22.16,1018.4,76.93,1.52,162,2.2852507,1992,9,13
14.09.1992,6.2000003,12.99,9.94,15.219999,1016.60004,90.605,2.4299998,54,0.7262166,1992,9,14
15.09.1992,0,12.49,9.59,18.3,1023.60004,83.39,1.8199999,136,1.8014227,1992,9,15
16.09.1992,0,14.07,7.12,21.18,1023.9,78.21,1.81,175,2.408159,1992,9,16
17.09.1992,0,13.32,7.43,21.71,1022,78.78,0.97999996,190,2.570221,1992,9,17
18.09.1992,0,12.67,6.0099998,21.43,1021.2,78.175,1.5899999,190,2.5304666,1992,9,18
19.09.1992,0,13.349999,6.3999996,20.14,1020.60004,73.665,1.22,131,1.7743672,1992,9,19
20.09.1992,0,12.9,6.8999996,21.34,1020.60004,77.36,0.59,158,2.1167722,1992,9,20
21.09.1992,0,13.48,6,21.689999,1017.7,76.025,1.54,174,2.3668795,1992,9,21
22.09.1992,0,15.91,7.58,24.38,1013.10004,70.07,2.6599998,184,2.64979,1992,9,22
23.09.1992,0,12.42,9.16,16.4,1018.5,86.955,1.4499999,64,0.84800977,1992,9,23
24.09.1992,0,11.37,9.66,14.549999,1021.2,89.435,0.88,65,0.83750373,1992,9,24
25.09.1992,0,11.309999,7.41,16.109999,1021.2,88.020004,0.56,92,1.1835307,1992,9,25
26.09.1992,0,12.679999,6.58,21.42,1020.60004,83.44,0.52,158,2.1053164,1992,9,26
27.09.1992,0,13.639999,6.48,24.01,1015.7,73.185,1.86,176,2.4051332,1992,9,27
28.09.1992,0,14.62,7.2999997,22.189999,1013.60004,74.54,2.1299999,129,1.8049837,1992,9,28
29.09.1992,9.1,12.559999,10.79,14.23,1016.5,91.53,2.28,52,0.69198155,1992,9,29
30.09.1992,3.9,12.34,11.99,13.639999,1019.60004,93.700005,1.3,56,0.7401887,1992,9,30
01.10.1992,0,11.87,10.44,15.98,1019.5,89.94,0.61,67,0.87513196,1992,10,1
02.10.1992,0,12.67,9.389999,16.119999,1015,86.435,1.02,57,0.76105285,1992,10,2
03.10.1992,0,12.429999,10.32,15.57,1004,79.355,2.6,59,0.786621,1992,10,3
04.10.1992,2.9,12.179999,10.24,16.32,1000.10004,75.425,6.35,60,0.79627305,1992,10,4
05.10.1992,0,14.549999,8.24,19.31,1001.2,77.26,3.6,95,1.3334333,1992,10,5
06.10.1992,3,12.63,8.4,16.82,1002.2,80.325005,1.63,87,1.1665351,1992,10,6
07.10.1992,0,11.09,8.99,12.11,1014.7,88.855,1.4499999,40,0.5130337,1992,10,7
08.10.1992,0,12.059999,9.84,14.34,1024.1,80.94,1.13,74,0.96940964,1992,10,8
09.10.1992,1,11.09,9.889999,14.32,1015.60004,75.845,1.13,70,0.89746284,1992,10,9
10.10.1992,0,8.059999,7.0699997,9.679999,1014.9,78.965004,3.04,47,0.55376494,1992,10,10
11.10.1992,0,6.5299997,4.13,12,1013.7,76.745,1.51,90,1.0125644,1992,10,11
12.10.1992,0,6.56,1.42,10.469999,1018.60004,60.035,2.56,103,1.157111,1992,10,12
13.10.1992,0,2.22,-2.3,10.969999,1024.6,69.335,2.32,137,1.322706,1992,10,13
14.10.1992,0,4.5,-4.1,8.46,1017,86.085,1.29,87,0.9144285,1992,10,14
15.10.1992,1.1,6.66,1.99,11.65,1003.5,74.225,2.8899999,81,0.9196586,1992,10,15
16.10.1992,0,4.6,3.07,7.7999997,1002.9,80.165,1.51,58,0.61623716,1992,10,16
17.10.1992,9.7,2.58,0.71,3.28,1002.5,94.3,1.64,29,0.28721833,1992,10,17
18.10.1992,2.4,1.05,-0.089999996,4.35,1012.10004,93.37222,1.87,57,0.5303718,1992,10,18
19.10.1992,0,2.62,-2.24,8.41,1016.60004,83.94,1.67,106,1.0431437,1992,10,19
20.10.1992,0,4.56,-0.77,7.49,1014.4,86.590004,0.85999995,67,0.7066126,1992,10,20
21.10.1992,1,5.38,2.45,8.4,1009.5,87.585,1.74,40,0.43464032,1992,10,21
22.10.1992,2.4,3.3899999,2.54,4.91,1009.4,90.55,3.4499998,56,0.56873125,1992,10,22
23.10.1992,8.400001,5.35,1.73,7.72,1005.10004,85.18,2.8,32,0.34815812,1992,10,23
24.10.1992,18.2,3.77,3.05,5.67,1008.8,86.695,4.6,61,0.6280064,1992,10,24
25.10.1992,19.4,5.45,0.17,10.69,1003.8,92.240005,3.59,29,0.31676236,1992,10,25
26.10.1992,5.4,4.2999997,3.4299998,7.79,1006.60004,91.13,6.45,46,0.4828582,1992,10,26
27.10.1992,3.4,4.2599998,0.19,5.52,1007.5,95.00001,1.8199999,27,0.28289545,1992,10,27
28.10.1992,16,5.66,4.8199997,10.179999,1000.2,92.96001,2.9399998,30,0.33053446,1992,10,28
29.10.1992,0,6.0499997,3.8899999,10.26,1003.4,76.685,3.8999999,82,0.9133432,1992,10,29
30.10.1992,1.8000001,4.48,0.78999996,8.66,1011,81.085,1.56,55,0.57952094,1992,10,30
31.10.1992,0,2.49,0.53999996,5.96,1019.5,89.445,1.16,42,0.41070765,1992,10,31
01.11.1992,0,2.46,-1.28,3.25,1023.4,93.55295,1.68,37,0.36063647,1992,11,1
02.11.1992,4.4,3.87,2.56,4.89,1019.2,93.04445,1.73,41,0.4212172,1992,11,2
03.11.1992,0,5.45,2.03,8.66,1016.4,89.490005,2.24,39,0.42324898,1992,11,3
04.11.1992,0,3.77,-0.78,7.81,1020.4,95.200005,1.74,25,0.25578213,1992,11,4
05.11.1992,0,7.75,1.4499999,9.44,1031.4,90.815,2.08,27,0.3127297,1992,11,5
06.11.1992,0,7.1099997,3.6999998,12.46,1034,88.255005,1.4,49,0.55582756,1992,11,6
07.11.1992,2,6.12,3.3899999,11.01,1026.5,83.845,2.29,76,0.83863634,1992,11,7
08.11.1992,0.8,5.79,2.6399999,8.389999,1027.1,93.38334,2.18,25,0.2728584,1992,11,8
09.11.1992,0,3.4199998,-0.5,5.66,1025.4,93.668755,2.51,47,0.47371244,1992,11,9
10.11.1992,2.2,5.2999997,2.5,7.56,1016.3,93.950005,2.51,22,0.23759374,1992,11,10
11.11.1992,19.300001,6.6499996,2.61,10.0199995,1006.7,88.35,4.7999997,19,0.21531351,1992,11,11
12.11.1992,2.9,2.69,1.48,7.1299996,1010.2,86.565,5.2999997,46,0.45544687,1992,11,12
13.11.1992,2.8,0.48,-0.29,2.56,1010.4,93.87647,2.55,29,0.26421812,1992,11,13
14.11.1992,3.5,0.01,-1.9499999,4.2,1015.9,86.615005,3.4299998,54,0.48140132,1992,11,14
15.11.1992,16.2,1.37,-2.22,2.03,1009.10004,89.4075,2.45,19,0.17926756,1992,11,15
16.11.1992,4.2000003,4.5299997,1.73,6.35,1002,92.200005,1.93,26,0.27572525,1992,11,16
17.11.1992,2.1000001,2.77,1.4599999,4.48,999.3,84.700005,3.46,24,0.23975746,1992,11,17
18.11.1992,3.5,1.26,-0.17,3.81,1013.2,81.845,4.61,36,0.33745337,1992,11,18
19.11.1992,6.5,4.12,-0.42999998,7.64,1011.9,77.725,5.3199997,39,0.4057228,1992,11,19
20.11.1992,0,1.6899999,-0.35,4.69,1020.3,82.655,3.9199998,43,0.40801933,1992,11,20
21.11.1992,9,2.79,-3.76,5.5099998,1017.9,91.79,1.61,20,0.19789337,1992,11,21
22.11.1992,13.8,10.86,3.3899999,12.34,1014.5,91.915,5.3199997,21,0.26773188,1992,11,22
23.11.1992,0,9.63,7.64,12.259999,1022.7,90.785,3.03,33,0.40536723,1992,11,23
24.11.1992,0,4.75,3.55,7.43,1025.1,92.688896,1.63,48,0.5066547,1992,11,24
25.11.1992,1.5,4.44,1.13,7.68,1020.8,94.19,2.08,21,0.21983506,1992,11,25
26.11.1992,1.3000001,9.28,3.8999999,13.44,1016.60004,73.66,5.92,20,0.24393666,1992,11,26
27.11.1992,3.3,3.11,0.56,6.93,1028.6,86.8,3.36,56,0.5572533,1992,11,27
28.11.1992,6.8,6.7799997,0.16,9.46,1021.4,89.315,2.97,16,0.1807411,1992,11,28
29.11.1992,4.3,4.8399997,3.55,6.0899997,1023.4,93.73334,0.96,19,0.20133738,1992,11,29
30.11.1992,0,6.27,4.7999997,7.8199997,1022.5,94.575005,2.3999999,36,0.39995554,1992,11,30
01.12.1992,0,5.91,3.72,8.86,1022.2,91.755005,1.75,20,0.21967791,1992,12,1
02.12.1992,2.1000001,4.74,3.76,6.52,1011.3,90.725,3.24,36,0.3826038,1992,12,2
03.12.1992,5.7000003,7.0499997,3.99,11.32,1001.3,88.215004,3.61,17,0.1955658,1992,12,3
04.12.1992,14.2,5.29,1.73,7.49,996,84.255,3.9099998,23,0.25092596,1992,12,4
05.12.1992,0,2.4199998,1.68,7.5699997,1000.10004,92.47778,1.53,17,0.167621,1992,12,5
06.12.1992,0,0.79999995,-0.97999996,3.7099998,1013.8,88.355,1.74,27,0.248578,1992,12,6
07.12.1992,9.1,0.39999998,-2.1,0.56,1004.10004,92.12,2.75,17,0.15497857,1992,12,7
08.12.1992,0,1.23,0.37,1.5699999,1009.60004,89.205,1.99,17,0.1595018,1992,12,8
09.12.1992,0,1.3199999,0.62,1.9799999,1016.9,90.335,2.1299999,16,0.15000276,1992,12,9
10.12.1992,0,0.78999996,-0.29999998,1.1,1025.2001,89.31,1.56,17,0.15541963,1992,12,10
11.12.1992,11.6,0.25,-0.96,2.18,1026,89.295,1.3199999,22,0.19682577,1992,12,11
12.12.1992,8.3,2.1299999,-0.47,2.6299999,1014.2,92.58,4.8199997,17,0.16454132,1992,12,12
13.12.1992,0,2.51,1.53,2.98,1020.7,79.86,5.5699997,19,0.18580846,1992,12,13
14.12.1992,0,2.81,1.53,4.58,1022.5,82.41,3.3999999,19,0.18765946,1992,12,14
15.12.1992,0,-0.51,-3.49,5.62,1020.2,90.700005,1.1999999,50,0.4354194,1992,12,15
16.12.1992,0,-1.49,-4.5499997,-0.69,1019.9,94.450005,1.09,28,0.23423626,1992,12,16
17.12.1992,0,-1.3299999,-2.18,-0.59,1026.8,94.39644,1.2099999,25,0.20965448,1992,12,17
18.12.1992,0,-1.1999999,-1.78,-0.41,1025.3,94.342865,1.9799999,24,0.20254509,1992,12,18
19.12.1992,0,-1.24,-2.56,-0.72999996,1026.1,92.762505,1.64,20,0.16842526,1992,12,19
20.12.1992,1.5,0.64,-1.26,0.91999996,1024.8,91.310005,1.3199999,20,0.18182385,1992,12,20
21.12.1992,7,2.6699998,0.59999996,3.4399998,1022.7,94.53334,0.97999996,15,0.14738575,1992,12,21
22.12.1992,0,3.12,2.48,3.83,1027.5,94.3,1.9699999,20,0.1992093,1992,12,22
23.12.1992,0,0.68,0.62,2.72,1030.7001,90.865,2.58,17,0.15426342,1992,12,23
24.12.1992,0,-1.42,-1.93,0.68,1032.4,91.83,2.2,17,0.14154571,1992,12,24
25.12.1992,0,-4.2999997,-5.83,-0.97999996,1035.3,81.225,2.4099998,30,0.21970658,1992,12,25
26.12.1992,0,-5.75,-8.92,-1.23,1036.2001,80.93,1.53,42,0.28717268,1992,12,26
27.12.1992,0,-5.14,-10.67,-1.2099999,1040.4,82.51,2.05,39,0.2737486,1992,12,27
28.12.1992,0,-4.7799997,-6.3999996,-1.04,1042.1,68.65,3.4199998,56,0.39932823,1992,12,28
29.12.1992,0,-7.5099998,-11.559999,-0.17,1036,76.53,1.48,56,0.3511703,1992,12,29
30.12.1992,0,-7.18,-12.57,0.9,1029.4,70.310005,0.48,56,0.3586718,1992,12,30
31.12.1992,0,-7.68,-11.5199995,-2.2,1029.7001,77.445,1.68,51,0.31847388,1992,12,31
01.01.1993,0,-8.25,-11.86,-0.83,1038,81.725,1.5899999,52,0.31357056,1993,1,1
02.01.1993,0,-10.8,-14.549999,-6.04,1039.8,78.945,2.23,54,0.283835,1993,1,2
03.01.1993,0,-9.099999,-14.04,-5.27,1035,67.435005,3.4199998,52,0.30061933,1993,1,3
04.01.1993,0,-8.37,-12.11,-1.4499999,1032.1,72.785,2.3899999,54,0.3249701,1993,1,4
05.01.1993,0,-8.389999,-13.799999,-2.1299999,1039.6,81.755005,1.05,54,0.3229212,1993,1,5
06.01.1993,5.4,-0.45,-10.05,0.81,1034.9,90.19474,0.84999996,18,0.15576057,1993,1,6
07.01.1993,5,4.23,1.12,5.64,1026.7001,92.50987,2.49,17,0.17613882,1993,1,7
08.01.1993,2.4,4.5899997,2.23,7.5,1027.5,94.825005,2.48,16,0.1677623,1993,1,8
09.01.1993,0,2.4099998,-1.36,4.0899997,1030.2001,89.582504,1.38,27,0.26169792,1993,1,9
10.01.1993,0,4.48,2.8799999,8.08,1021.7,84.340004,2.28,31,0.3248077,1993,1,10
11.01.1993,0,10.16,3.03,12,1009.7,70.395004,4.91,22,0.27582446,1993,1,11
12.01.1993,1.9,7.16,4.13,15.099999,1011.4,78.61,5.85,29,0.33309168,1993,1,12
13.01.1993,3.9,2.06,-2.9399998,4.95,1024.8,90.155,1.8399999,37,0.3550751,1993,1,13
14.01.1993,0,5.12,0.96,10.389999,1028.7001,80.255005,4.2799997,51,0.5440368,1993,1,14
15.01.1993,0,1.24,-2.7,4.7599998,1030.8,92.03001,1.74,47,0.43581253,1993,1,15
16.01.1993,0,5.2,0.44,12.03,1032.6,85.495,2.4299998,57,0.60845065,1993,1,16
17.01.1993,0,2.1599998,-1.7099999,10.42,1028.5,84.68,1.2099999,71,0.68248427,1993,1,17
18.01.1993,0,1.3299999,-2.6599998,7.77,1031.2001,90.975,1.8,40,0.37209955,1993,1,18
19.01.1993,0,5.0299997,-0.69,7.56,1028.2001,80.69,2.53,40,0.4255234,1993,1,19
20.01.1993,0,6.8199997,3.81,8.73,1027.3,74.685,3.62,33,0.3721706,1993,1,20
21.01.1993,0,6.1099997,4.8399997,9.2,1030,78.925,3.9199998,34,0.3744059,1993,1,21
22.01.1993,0,10.179999,3.51,10.929999,1022.4,75.855,5.9,22,0.27443278,1993,1,22
23.01.1993,0,9.49,6.7599998,11.21,1024.5,72.395004,5.5299997,34,0.41567478,1993,1,23
24.01.1993,13.900001,8.44,6.2,11.58,1015,76.6,8.2,27,0.32168588,1993,1,24
25.01.1993,2.1000001,2.48,0.9,6.95,1013,69.235,8.51,54,0.5297705,1993,1,25
26.01.1993,5.8,-0.29,-3.07,0.94,1023.9,71.945,5.8199997,54,0.47340187,1993,1,26
27.01.1993,1.7,1.24,-1.81,2.62,1016.8,85.715004,4.9,39,0.36454067,1993,1,27
28.01.1993,1.3000001,2.4099998,-0.53999996,3.82,1017.9,91.96875,1.99,25,0.24397132,1993,1,28
29.01.1993,2.8,2.32,0.08,5.13,1019.3,90.95264,3.4099998,22,0.21382026,1993,1,29
30.01.1993,0,-3.3799999,-4.7999997,-0.049999997,1032,70.37,3.8,61,0.46672642,1993,1,30
31.01.1993,0,-5.15,-9.23,-3.11,1036.6,88.455,2.1699998,47,0.33057484,1993,1,31
01.02.1993,0,-5.33,-9.25,1.41,1041.1,80.865,1.63,72,0.50062704,1993,2,1
02.02.1993,0,-4.27,-10.09,-2.6699998,1043,92.76667,0.83,48,0.35026425,1993,2,2
03.02.1993,0,-4.96,-6.99,-0.35999998,1043.3,88.81,1.05,61,0.43099213,1993,2,3
04.02.1993,0,-3.59,-9.26,-1.02,1038.1,93.81539,0.59,69,0.52096164,1993,2,4
05.02.1993,0,-0.71999997,-3.6999998,4.38,1035.5,89.66,0.82,79,0.67587924,1993,2,5
06.02.1993,1.3000001,1.16,-5.66,5.23,1034.1,74.705,1.39,43,0.39675173,1993,2,6
07.02.1993,0,1.4599999,0.52,4.0499997,1036.1,93.44211,1.24,29,0.2703625,1993,2,7
08.02.1993,0,0.13,-0.42999998,1.65,1036.7001,94.04118,1.73,30,0.26545385,1993,2,8
09.02.1993,0,-0.65,-1.74,0.26999998,1035,89.695,2.12,43,0.3690503,1993,2,9
10.02.1993,0,-0.89,-2.79,3.27,1034.3,84.055,1.81,53,0.45060286,1993,2,10
11.02.1993,0,-2.2,-5.5899997,3.28,1035.8,86.095,0.84999996,71,0.57070315,1993,2,11
12.02.1993,0,-1.8,-5.69,-0.51,1037.8,93.744446,0.87,55,0.44916984,1993,2,12
13.02.1993,0,-2.36,-3.36,-1.1899999,1039.1,93.54616,0.71999997,42,0.33459035,1993,2,13
14.02.1993,0,-3.61,-4.14,-2.37,1037.5,93.600006,1.56,46,0.3471283,1993,2,14
15.02.1993,0,-0.89,-4.49,0.52,1036.4,80.42,1.5899999,36,0.30568448,1993,2,15
16.02.1993,1.9,-1.13,-2.36,-0.75,1032.7001,80.58,1.1899999,28,0.23592927,1993,2,16
17.02.1993,5.9,0.53999996,-1.9399999,1.49,1023.10004,93.17334,4.14,30,0.27194062,1993,2,17
18.02.1993,0,1.0699999,-0.63,4.39,1027,88.765,1.65,51,0.47084653,1993,2,18
19.02.1993,6,1.8299999,-1.27,3.11,1013.7,84.66,5.8799996,49,0.4691473,1993,2,19
20.02.1993,9.1,1.53,-0.12,2.31,1020.3,80.81,5.8799996,60,0.5659062,1993,2,20
21.02.1993,1.6,-0.55,-1.3199999,1.73,1004.60004,81.235,6.52,57,0.50026023,1993,2,21
22.02.1993,0,-7.68,-11.23,-1.75,1016.4,77.58,2.3,110,0.69335157,1993,2,22
23.02.1993,0,-7.91,-14.42,-3.77,1024.5,74.08,1.9399999,80,0.49557525,1993,2,23
24.02.1993,1.2,-5.08,-12.2,-3.1,1029.3,83.04,2.78,59,0.41836306,1993,2,24
25.02.1993,0,-3.05,-6.52,0.21,1024.9,72.215004,2.03,86,0.6707297,1993,2,25
26.02.1993,0,-4.3399997,-6.85,2.01,1016.2,72.72,1.42,118,0.87343854,1993,2,26
27.02.1993,0,-3.98,-12.92,3.98,1014.7,72.07,0.72999996,101,0.76068616,1993,2,27
28.02.1993,0,-2.33,-9.0199995,1.65,1015.5,72.78,1.62,72,0.5828536,1993,2,28
01.03.1993,0,1.4699999,-5.7599998,5.2,1010.10004,69.340004,3.6999998,69,0.6531133,1993,3,1
02.03.1993,0,3.01,0.65999997,7.41,1006.60004,55.420002,5.24,120,1.2042457,1993,3,2
03.03.1993,0,-2.01,-2.84,0.66999996,1013.10004,86.18,3.62,46,0.37806746,1993,3,3
04.03.1993,0,-4.2799997,-6.62,-2.74,1022.8,79.065,2.9399998,63,0.4655867,1993,3,4
05.03.1993,2.2,-3.55,-9.73,-1.4599999,1023.60004,86.26,2.22,81,0.6183827,1993,3,5
06.03.1993,4.3,0.59,-2.72,1.7199999,1016.9,92.56842,4.27,41,0.37372905,1993,3,6
07.03.1993,0,2.73,0.84999996,5.94,1018.7,73.3,2.75,80,0.78950924,1993,3,7
08.03.1993,0,-0.91999996,-3.1599998,2.48,1026.1,66.78,3.26,145,1.2373537,1993,3,8
09.03.1993,0,-1.88,-6.29,4.33,1026.6,76.590004,2.12,166,1.3604181,1993,3,9
10.03.1993,0,0.83,-7.2,9.28,1026.9,74.065,1.29,156,1.4270176,1993,3,10
11.03.1993,0,3.34,0.14,10.71,1027.4,75.085,1.1999999,121,1.2147876,1993,3,11
12.03.1993,0,3.04,-3.34,11.44,1026.4,72.945,1.18,165,1.6397445,1993,3,12
13.03.1993,0,2.84,-3.6499999,12.179999,1024.3,75.99,0.96999997,177,1.7483668,1993,3,13
14.03.1993,0,4.11,-3.3799999,14.299999,1025.6,76.96,0.63,175,1.8067497,1993,3,14
15.03.1993,0,5.19,-2.78,15.65,1029,70.445,0.64,166,1.7746497,1993,3,15
16.03.1993,0,7.73,-1.93,15.23,1027.4,70.065,2.9299998,165,1.9135923,1993,3,16
17.03.1993,7.8,9.44,7.85,10.179999,1026,89.575,4.75,44,0.5368108,1993,3,17
18.03.1993,0,8.41,4.85,16.01,1024.2001,82.385,3.4399998,149,1.7660831,1993,3,18
19.03.1993,0,6.43,4,12.21,1027.7001,71.39,3.8,169,1.8823005,1993,3,19
20.03.1993,0,6.12,-2.52,16.42,1024.2001,75.2,0.97999996,195,2.1542327,1993,3,20
21.03.1993,0,8.16,-0.71999997,16.02,1016.60004,85.270004,1.25,106,1.2516189,1993,3,21
22.03.1993,2.6000001,8.849999,5.41,13.719999,1017.2,89.215004,1.7199999,79,0.951526,1993,3,22
23.03.1993,0,7.54,5.87,10.19,1021.9,72.69,3.8,103,1.1908028,1993,3,23
24.03.1993,0,5.0699997,2.47,7.8599997,1025,65.635,1.73,76,0.81090903,1993,3,24
25.03.1993,0,1.61,-1.04,6.33,1025.1,76.4,2.8999999,144,1.3585794,1993,3,25
26.03.1993,0,0.22999999,-1.3299999,4.41,1024.9,78.905,2.82,151,1.350743,1993,3,26
27.03.1993,0,-1.24,-5.23,1.64,1023.60004,73.975,2.1,149,1.2566806,1993,3,27
28.03.1993,0,-1.31,-4.94,2.4099998,1020.5,67.705,2.71,140,1.1795737,1993,3,28
29.03.1993,0,-1.37,-5.5099998,2.7,1022.4,73.18,2.1699998,163,1.3683413,1993,3,29
30.03.1993,0,-0.32999998,-7.49,7.37,1023.2,63.18,1.89,202,1.7687598,1993,3,30
31.03.1993,0,5.5899997,-5.64,14.9,1021.2,66.29,1.9399999,142,1.5443591,1993,3,31
01.04.1993,0,8.46,-1.1899999,18.14,1012.60004,68.135,2.59,212,2.530139,1993,4,1
02.04.1993,1.3000001,4.5099998,0.96999997,7.99,1012.3,93.54616,1.9799999,60,0.6324145,1993,4,2
03.04.1993,0.8,4.17,2.32,7.62,1012.60004,92.54,1.5699999,91,0.94795996,1993,4,3
04.04.1993,1.9,5.38,0.77,9.719999,1011,78.71,2.1399999,103,1.1183372,1993,4,4
05.04.1993,3.1000001,6.14,2.04,10.09,1014.7,67.53,3.01,173,1.9215175,1993,4,5
06.04.1993,3.9,7.2799997,4.7999997,10.92,1007.60004,73.615,4.64,156,1.801711,1993,4,6
07.04.1993,3.1000001,5.39,3.1899998,7.66,1010.5,88.145004,4.61,90,0.97775906,1993,4,7
08.04.1993,0,3.6399999,1.6899999,7.8399997,1018.2,74.3,2.1299999,129,1.315398,1993,4,8
09.04.1993,0,5.73,-3.07,12.12,1018.8,69.86,2.06,220,2.4065316,1993,4,9
10.04.1993,0,7.94,3.7099998,12.4,1012,72.485,1.81,110,1.2932062,1993,4,10
11.04.1993,6,7.99,3.25,11.92,1006.3,82.5,1.86,103,1.2159978,1993,4,11
12.04.1993,4,5.66,4.85,8.08,1004.2,89,1.15,88,0.96758664,1993,4,12
13.04.1993,0,7.12,1.26,11.7,1003.4,79.56,1.48,150,1.7275048,1993,4,13
14.04.1993,0,6.77,1.77,14.09,1011,78.625,1.39,210,2.383628,1993,4,14
15.04.1993,0,8.0199995,1.1999999,15.389999,1012.4,67.925,1.79,182,2.1443558,1993,4,15
16.04.1993,0,8.28,4.77,13.58,1019.60004,65.81,1.79,196,2.3192644,1993,4,16
17.04.1993,4.1,7.6099997,0.19999999,12.53,1020.60004,81.805,2.4099998,153,1.7737229,1993,4,17
18.04.1993,4.7000003,9.86,7.41,12.46,1018.3,83.695,4.2999997,80,0.9909715,1993,4,18
19.04.1993,0,10.86,9.26,13.49,1017.7,78.44,4.56,97,1.2349597,1993,4,19
20.04.1993,0,12.46,5.94,19.32,1018.3,68.08,1.87,246,3.2630637,1993,4,20
21.04.1993,0,13.799999,5.29,22.529999,1011.2,62.41,1.8499999,260,3.57281,1993,4,21
22.04.1993,2.6000001,14.66,5.6299996,23.01,1011.10004,52.52,1.38,256,3.588654,1993,4,22
23.04.1993,0,14.38,7.74,21.27,1012.2,65.18,1.9699999,259,3.60603,1993,4,23
24.04.1993,0,15.61,6.49,23.269999,1005.2,54.185,2.4099998,260,3.7307715,1993,4,24
25.04.1993,0,15.5199995,6.43,23.55,1004.60004,51.350002,2.6499999,195,2.793213,1993,4,25
26.04.1993,0,16,7.27,23.68,1009.9,53.725002,2.27,237,3.4236412,1993,4,26
27.04.1993,0,19.01,9.55,25.039999,1013,47.46,3.49,280,4.2935405,1993,4,27
28.04.1993,0,18.939999,14.349999,23.13,1009.60004,36.825,5.3399997,278,4.2619395,1993,4,28
29.04.1993,0,17.73,9.15,24.119999,1010.9,44.715,3.6499999,279,4.175927,1993,4,29
30.04.1993,0,17.33,14.11,22.98,1009.9,46.275,3.79,277,4.1141477,1993,4,30
01.05.1993,0,14.389999,7.23,21.91,1009.2,64.845,1.42,250,3.4855351,1993,5,1
02.05.1993,3.6000001,12.29,11.49,17.73,1010.3,87.49,1.88,196,2.597332,1993,5,2
03.05.1993,10.5,12.74,9.57,17.779999,1018.8,82.435,1.5699999,136,1.8161862,1993,5,3
04.05.1993,0,11.719999,7.5899997,14.98,1025.4,66.595,2.95,158,2.0507467,1993,5,4
05.05.1993,0,11.679999,8.29,15.65,1021.3,56.445,4.0099998,129,1.6754878,1993,5,5
06.05.1993,0,11.809999,7.16,15.19,1017.7,76.97,3.07,134,1.7488899,1993,5,6
07.05.1993,0,15.74,6.47,21.83,1016.2,55.23,3.49,242,3.4683032,1993,5,7
08.05.1993,0,17.35,8.83,23.199999,1016.2,51.08,3.52,284,4.2106566,1993,5,8
09.05.1993,0,15.54,8.809999,23.73,1015.2,65.485,2.9099998,269,3.8398454,1993,5,9
10.05.1993,0,16.99,8.15,24.31,1015.5,62.005,1.93,296,4.3573446,1993,5,10
11.05.1993,0,17.97,9.62,25.22,1011.9,50.64,2.96,301,4.525217,1993,5,11
12.05.1993,8.7,14.99,8.63,22.08,1006.8,70.635,1.78,240,3.3949938,1993,5,12
13.05.1993,0,15.78,9.61,21.3,999,69.395004,1.5899999,256,3.6953325,1993,5,13
14.05.1993,0,15.44,9.13,19.99,1001.2,69.145004,1.9699999,233,3.3359027,1993,5,14
15.05.1993,5.7000003,13.86,8.45,19.99,1008.60004,68.66,2.19,223,3.0718193,1993,5,15
16.05.1993,0,12.74,6.2999997,17.699999,1019.9,63.505,1.5999999,265,3.5373173,1993,5,16
17.05.1993,0,15.799999,6.0299997,23.1,1016.5,58.515,2.29,324,4.649071,1993,5,17
18.05.1993,0,18.939999,8.17,25.98,1010.3,55.58,2.12,314,4.812746,1993,5,18
19.05.1993,0,18.859999,13.58,24.619999,1011.8,63.48,1.89,289,4.42067,1993,5,19
20.05.1993,4.5,19.09,11.3,27.41,1010.9,56.605,2.3799999,290,4.4566464,1993,5,20
21.05.1993,13.1,10.23,9.54,15.559999,1018.5,88.87,3.9099998,95,1.188711,1993,5,21
22.05.1993,0,11.15,8.2699995,15.88,1019,73.16,2.18,209,2.6799068,1993,5,22
23.05.1993,0,13.309999,3.56,20.92,1019.5,64.340004,0.97999996,291,3.9394515,1993,5,23
24.05.1993,0,16.699999,6.7,23.33,1017.4,60.475002,1.51,291,4.2551355,1993,5,24
25.05.1993,0,19.65,8.809999,27.199999,1012.9,66.15,1.11,312,4.841929,1993,5,25
26.05.1993,0,21.109999,12.139999,29.119999,1007.9,62.735,1.55,288,4.5944777,1993,5,26
27.05.1993,17.5,17.72,14.099999,23.55,1005,73.65,3.29,243,3.6437023,1993,5,27
28.05.1993,1.3000001,13.7699995,12.19,18.779999,1011,81.28,3.9199998,219,3.0075157,1993,5,28
29.05.1993,0,14.839999,9.23,20.08,1016.3,64.13,2.02,303,4.256488,1993,5,29
30.05.1993,2.1000001,17.52,8.08,24.84,1011.60004,62.245,2.21,289,4.306383,1993,5,30
31.05.1993,0,14.28,11.679999,19.15,1017.4,70.19,3.31,281,3.8955286,1993,5,31
01.06.1993,0,16.88,7.1,22.449999,1017.10004,62.505,1.0699999,283,4.154161,1993,6,1
02.06.1993,17.800001,15.259999,8.95,23.41,1012.10004,75.705,2.5,221,3.1388395,1993,6,2
03.06.1993,0.7,13.74,11.099999,16.71,1014.60004,80.9,2.82,95,1.3018678,1993,6,3
04.06.1993,0,16.68,12.86,20.439999,1016.5,82.86,1.79,171,2.5001876,1993,6,4
05.06.1993,0,19.09,11.58,25.05,1018.8,73.66,1.7199999,302,4.6291947,1993,6,5
06.06.1993,0,20.52,12.32,27.43,1017.4,65.975,0.68,318,5.006388,1993,6,6
07.06.1993,2.8,20.449999,13.19,26.49,1015.4,70.97,1.64,248,3.9018867,1993,6,7
08.06.1993,0,19.83,13.969999,26.599998,1016.10004,62.095,1.1899999,308,4.790836,1993,6,8
09.06.1993,0,20.81,11.13,27.74,1013.2,55.455,2.3999999,323,5.117796,1993,6,9
10.06.1993,1.2,21.279999,16.15,28.97,1010,65.475,1.4399999,276,4.4131513,1993,6,10
11.06.1993,11,16.539999,12.219999,24.93,1011,77.925,3.02,241,3.520182,1993,6,11
12.06.1993,0,11.37,10.04,15.19,1013.10004,78.18,3.54,140,1.8100619,1993,6,12
