time,rr,tg,tn,tx,pp,hu,fg,qq,et,year,month,day
01.01.1990,0,-3.72,-7.41,0.06,1018.7,83.215004,1.78,,0,1990,1,1
02.01.1990,0,-6.77,-8.72,-5.6099997,1025.5,88.34211,1.62,,0,1990,1,2
03.01.1990,0,-9.33,-12.54,-7.3199997,1026.5,85.60526,2.1299999,,0,1990,1,3
04.01.1990,0,-11,-13.11,-9.809999,1015.2,87.865005,2.27,,0,1990,1,4
05.01.1990,0,-7.8199997,-14.549999,-5.1,1009.9,94.36667,2.06,,0,1990,1,5
06.01.1990,0,-4.71,-5.89,-3.4499998,1013.7,92.669235,2.05,,0,1990,1,6
07.01.1990,1.5,-5.6299996,-8.32,-3.09,1005,90.5,2.1499999,,0,1990,1,7
08.01.1990,0,-4,-6.56,-2.9399998,1002.60004,90.74118,2.01,,0,1990,1,8
09.01.1990,3.2,-6.42,-8.22,-3.7099998,998.60004,91.729416,2.12,,0,1990,1,9
10.01.1990,2.6000001,-10.51,-12.13,-6.5899997,1001.60004,86.37,2.48,,0,1990,1,10
11.01.1990,0,-16.67,-18.51,-12.5,1012.7,77.71,2.46,,0,1990,1,11
12.01.1990,0,-18,-18.91,-17.23,1026.2001,73.990005,2.1299999,,0,1990,1,12
13.01.1990,2.7,-17.58,-18.13,-16.21,1021.7,84.275,1.87,,0,1990,1,13
14.01.1990,3.8,-16.52,-19.609999,-13.92,1016.9,81.715004,2.01,,0,1990,1,14
15.01.1990,7.3,-10.95,-13.98,-10.099999,998.3,81.67,3.1399999,2,0.010754127,1990,1,15
16.01.1990,3,-16.39,-19.63,-11.13,994.2,77.13,3.3999999,2.3333333,0.009144796,1990,1,16
17.01.1990,2.4,-21.369999,-25.9,-18.13,992.5,78.505005,3.3799999,2.6666667,0.007532994,1990,1,17
18.01.1990,0,-21.84,-23.6,-17.55,991.9,82.1,2.76,3,0.008205506,1990,1,18
19.01.1990,0,-26.31,-27.59,-22.269999,1004.4,83.845,3.08,5,0.009751954,1990,1,19
20.01.1990,0,-18.17,-27.18,-15.29,999.9,78.5,3.06,2,0.006963028,1990,1,20
21.01.1990,0,-15.96,-18.5,-13.9,1010.3,90.63125,2.73,2,0.007945857,1990,1,21
22.01.1990,10.1,-17.02,-23.199999,-9.75,1018.3,83.0579,2.69,3,0.011077199,1990,1,22
23.01.1990,4.3,-13.15,-15.139999,-9.33,1005.4,87.3,3.1699998,3,0.014168116,1990,1,23
24.01.1990,13.7,-8.49,-12.679999,-5.48,983.9,86.3,4.08,4,0.024769109,1990,1,24
25.01.1990,0,-9.53,-12.9,-3.84,982.60004,77.94,4.3199997,8,0.04698135,1990,1,25
26.01.1990,0,-13.58,-16.73,-10.139999,985.3,84.03889,4.5499997,4,0.018718714,1990,1,26
27.01.1990,0,-13.219999,-15.19,-9.67,986.4,89.45294,3.49,2,0.009549227,1990,1,27
28.01.1990,0,-13.91,-15.929999,-11.92,998.5,87.8,3.7099998,4,0.018166548,1990,1,28
29.01.1990,1,-13.9,-16.26,-11.84,1000,90.64667,3.1,5,0.022694508,1990,1,29
30.01.1990,7.2000003,-13.4,-15.339999,-12.36,1008.2,82.926315,3.3,2,0.009288336,1990,1,30
31.01.1990,10.2,-6.8799996,-14.13,-3.6599998,1006.10004,84.73158,3.84,6,0.03964217,1990,1,31
01.02.1990,13.3,-0.59999996,-3.29,0.099999994,997.60004,86.37,3.1399999,4,0.0351847,1990,2,1
02.02.1990,2.2,-0.12,-0.089999996,0.17999999,1000.4,84.19,3.3999999,13,0.116368555,1990,2,2
03.02.1990,0,-0.78999996,-1.62,-0.06,995.10004,83.05,3.5,4,0.034969125,1990,2,3
04.02.1990,0,-2.1499999,-3.31,-0.61,998.5,81.69,3.52,8,0.065964535,1990,2,4
05.02.1990,2.2,-1.15,-4.47,0.29999998,992.60004,81.415,2.85,8,0.06902667,1990,2,5
06.02.1990,0,5.0499997,0.84,6.2,990.9,82.895004,2.96,8,0.08682533,1990,2,6
07.02.1990,4.7000003,1.99,0.22,5.93,983.8,87.76316,3.3999999,9,0.08817161,1990,2,7
08.02.1990,0,-1.05,-2.72,2.59,967.3,93.138466,3.52,5,0.044006888,1990,2,8
09.02.1990,0,-2.61,-5.95,0.35999998,985.5,89.57647,2.98,13,0.10598798,1990,2,9
10.02.1990,0,-11.24,-14.16,-5.5,985.8,90.073685,3.27,19,0.10151361,1990,2,10
11.02.1990,3.9,-8.61,-12.42,-5.43,991.7,92.314285,3.72,13,0.07954983,1990,2,11
12.02.1990,4.4,-3.09,-8.849999,-1.61,987.5,84.073685,3.98,7,0.055826925,1990,2,12
13.02.1990,0,-2.02,-3.4299998,-1.0799999,995.7,89.6579,3.4199998,7,0.058140118,1990,2,13
14.02.1990,2.8,-3.6399999,-4.58,-1.66,997,90.00715,4.3399997,3,0.023209136,1990,2,14
15.02.1990,4.5,-5.1099997,-5.56,-4.83,990,88.375,3.6699998,7,0.050893888,1990,2,15
16.02.1990,4,-4.27,-5.72,-3.1599998,990.4,89.505264,3.1399999,6,0.045322962,1990,2,16
17.02.1990,0,-6.68,-7.06,-3.59,1006,76.700005,2.56,22,0.14679675,1990,2,17
18.02.1990,12.7,-6.1099997,-7.73,-5.39,1005.4,80.380005,2.6,13,0.089210205,1990,2,18
19.02.1990,16.5,-5.7,-6.46,-5.24,1003.2,73.31,2.85,21,0.14717987,1990,2,19
20.02.1990,0,0.28,-4.81,3.27,979.9,79.15,2.8999999,27,0.24856018,1990,2,20
21.02.1990,0,2.47,2.1499999,3.26,993.3,75.725,2.58,47,0.46604264,1990,2,21
22.02.1990,0,1.06,-1.61,3.59,996.9,84.15,2.6299999,37,0.3474657,1990,2,22
23.02.1990,0,3.72,-0.26,6.96,992.3,87.34211,2.3799999,34,0.35256487,1990,2,23
24.02.1990,0,2.6299999,0.39999998,5.12,984.60004,88.270004,2.56,36,0.36079422,1990,2,24
25.02.1990,0,-6.5899997,-8.28,0.26999998,990.8,89.555,2.84,36,0.24384835,1990,2,25
26.02.1990,1.1,-7.56,-14.15,-5.92,978.9,85.98,5.2799997,18,0.11724048,1990,2,26
27.02.1990,0,-7,-7.54,-6.23,958,81.315,6.35,7,0.047581736,1990,2,27
28.02.1990,0,-5.7599998,-7.95,-2.8899999,959.9,87.210526,5.23,20,0.14404422,1990,2,28
01.03.1990,0,-8.22,-10.679999,-2.9199998,976.8,80.485,5.96,47,0.29660565,1990,3,1
02.03.1990,0,-8.73,-13.969999,-2.81,993.9,84.485,4.62,46,0.279299,1990,3,2
03.03.1990,2.6000001,-10.49,-14.0199995,-6,1008.9,73.835,4.29,55,0.30085006,1990,3,3
04.03.1990,1.2,-6.49,-12.4,-3.58,991.60004,83.990005,4.0699997,44,0.29931644,1990,3,4
05.03.1990,0,-2.69,-6.0299997,0.91999996,972.60004,81.78,3.97,29,0.23760666,1990,3,5
06.03.1990,0,-7.0499997,-8.559999,-2.18,974.10004,78.535,4.75,43,0.28820637,1990,3,6
07.03.1990,0,-9.179999,-12.469999,-3.48,995.8,61.555,3.98,61,0.36130986,1990,3,7
08.03.1990,3.3,-10.929999,-19.72,-7.75,986.8,74.325,3.35,60,0.32582226,1990,3,8
09.03.1990,0,-6.3399997,-8.46,-3.6,982.9,80.13,4.29,43,0.2964427,1990,3,9
10.03.1990,0,-6.81,-9.66,-2.7,988.4,85.64,4.83,69,0.46318197,1990,3,10
11.03.1990,0,-10.9,-14.799999,-5,995.5,83.4,3.54,84,0.45387757,1990,3,11
12.03.1990,0,-12.5199995,-17.18,-7.33,996.9,88.54,3,59,0.2908638,1990,3,12
13.03.1990,0,-9.91,-17.539999,-3.4299998,1017,69.845,2.77,86,0.48247838,1990,3,13
14.03.1990,0,-8.309999,-16.199999,-2.47,1020.9,58.525,2.6499999,101,0.61456084,1990,3,14
15.03.1990,0,1.4699999,-2.58,4.16,1001.7,76.905,2.8899999,41,0.3899596,1990,3,15
16.03.1990,0,2.6399999,1.2099999,4.49,997.2,77.105,2.95,76,0.7565794,1990,3,16
17.03.1990,0,0.98999995,-3.72,5,1010.5,73.905,2.69,84,0.7805288,1990,3,17
18.03.1990,0,5.18,1.8399999,7.41,1008.10004,62.265003,2.84,65,0.70216906,1990,3,18
19.03.1990,11.3,1.14,-0.089999996,4.5,997.60004,69.270004,2.79,72,0.6779316,1990,3,19
20.03.1990,2.9,-0.07,-1.39,2.29,991.3,81.275,2.9399998,74,0.66736573,1990,3,20
21.03.1990,10.900001,-4.5499997,-10.88,0.76,995.9,77.615,3.1599998,91,0.67620665,1990,3,21
22.03.1990,2.7,-1.66,-3.97,0.52,980,82.42,3.1999998,50,0.4257933,1990,3,22
23.03.1990,2.6000001,-1.14,-3.3999999,0.11,982.5,82.405,3.21,79,0.686213,1990,3,23
24.03.1990,0,-6.39,-12.34,-0.72999996,985.5,80.965004,3.5,70,0.4805427,1990,3,24
25.03.1990,0,-3.1699998,-4.68,-1.3399999,996.5,75.87,4.0699997,90,0.7110955,1990,3,25
26.03.1990,0,-4.96,-9.33,2.1299999,1018.8,71.555,2.98,114,0.8186073,1990,3,26
27.03.1990,0,-0.29,-9.3,6.64,1016.3,62.8,3.26,113,0.99513936,1990,3,27
28.03.1990,0,3.28,-1.8199999,6.8599997,1014.5,67.74,3.08,105,1.0592898,1990,3,28
29.03.1990,0,-3.4399998,-9.69,4.16,1011.10004,53.75,3.3,107,0.82753927,1990,3,29
30.03.1990,0,-1.1899999,-2.08,1.18,994.9,69.14,3.11,124,1.0666388,1990,3,30
31.03.1990,0,-0.87,-2.76,1.24,1007.60004,76.68,3.3899999,126,1.0895883,1990,3,31
01.04.1990,0,-5,-8.639999,-1.04,1007.10004,81.26,2.31,135,0.9752037,1990,4,1
02.04.1990,0,-7.14,-11.84,-1.4699999,1004.8,81.725,2.52,117,0.7638667,1990,4,2
03.04.1990,0,-8.9,-16.05,-3.57,996.7,83.325005,3.06,112,0.67269295,1990,4,3
04.04.1990,0,-6.69,-9.91,-3.1899998,993.8,84.365,2.49,117,0.78700197,1990,4,4
05.04.1990,0,-5.73,-10.28,-1.6899999,1007.2,76.340004,2.03,159,1.1097381,1990,4,5
06.04.1990,0,-7.0299997,-14.79,-0.29999998,1014,78.595,2.19,159,1.0370342,1990,4,6
07.04.1990,0,-7.44,-17.69,0.76,1017.10004,74.310005,2.52,176,1.1222758,1990,4,7
08.04.1990,0,-6.7999997,-19.6,0.71,1008.60004,81.005005,3.25,152,1.0064633,1990,4,8
09.04.1990,2,0.04,-4.23,3.58,994.5,78.21,2.98,116,1.0486645,1990,4,9
10.04.1990,0,2.7,0.96999997,4.5,986.9,84.54,2.86,137,1.3746868,1990,4,10
11.04.1990,0,-1.09,-6.93,5.37,997.60004,82.925,2.82,144,1.2416906,1990,4,11
12.04.1990,0,2.1299999,-0.37,5.24,1002.2,85.775,2.54,132,1.2862874,1990,4,12
13.04.1990,0,3.6999998,-0.24,8.4,1005.4,79.425,2.1,171,1.7594225,1990,4,13
14.04.1990,0,1.8299999,-2.1499999,8.389999,1013.5,83.885,2.6799998,154,1.47463,1990,4,14
15.04.1990,0,2.62,-1.6999999,7.75,1013,85.445,3.11,118,1.1635547,1990,4,15
16.04.1990,1.8000001,3.37,-0.02,6.8399997,1010.60004,87.025,2.7,122,1.2373406,1990,4,16
17.04.1990,0,1.75,1.14,5.6099997,1013.8,83.385,2.25,109,1.0404401,1990,4,17
18.04.1990,3.9,0.65,-1.04,2.6399999,1020.7,79.25,2.1599998,120,1.0939742,1990,4,18
19.04.1990,0,3.23,0.17999999,6.27,1024,88.685005,2.32,158,1.5829582,1990,4,19
20.04.1990,0,4.61,-1.4399999,9.25,1034.1,78.840004,2.49,202,2.1121838,1990,4,20
21.04.1990,0,4.27,-3.6699998,9.95,1032,74.29,2.4299998,238,2.462478,1990,4,21
22.04.1990,0,4.88,0.66999996,8.76,1021,79.255,2.12,148,1.5723748,1990,4,22
23.04.1990,0,4.58,-1.41,8.099999,1018.7,83.689476,2.1,148,1.5584173,1990,4,23
24.04.1990,0,3.4399998,-1.16,7.6099997,1023.8,81.97,2.06,199,2.008871,1990,4,24
25.04.1990,0,6.7799997,2.9199998,10.95,1017,64.53,2.31,184,2.0830107,1990,4,25
26.04.1990,2,7.48,2.29,13.099999,1002.7,64.755005,2.58,199,2.317809,1990,4,26
27.04.1990,5.6,2.85,0.83,8.82,999.8,77.845,2.9299998,119,1.1918776,1990,4,27
28.04.1990,0,2.55,-2.3999999,5.96,1007.7,64.2,3.03,228,2.2491422,1990,4,28
29.04.1990,0,6.87,2.05,9.78,1000.4,79.64,2.5,182,2.0830743,1990,4,29
30.04.1990,0,5.98,4.89,8.2,1006.7,81.07,2.3799999,153,1.6975285,1990,4,30
01.05.1990,0,3.6,-2.9399998,8.41,1027.4,58.445,2.98,217,2.198733,1990,5,1
02.05.1990,0,10.15,4.27,16.43,1021,76.86,3.6699998,151,1.8832188,1990,5,2
03.05.1990,0,9.45,8.32,11.57,1018,79.455,3.35,180,2.2045963,1990,5,3
04.05.1990,0,6.2999997,1.91,10.01,1016.9,57.41,2.8,172,1.9180589,1990,5,4
05.05.1990,0,7.69,5.42,11.429999,1010,60.4,2.4099998,192,2.2425625,1990,5,5
06.05.1990,0,6.2999997,0.91999996,11.4,1008.2,66.16,2.19,189,2.1168046,1990,5,6
07.05.1990,0,3.58,0.26,7.8999996,1013.2,78.200005,2.31,219,2.2344387,1990,5,7
08.05.1990,0,1.89,-3.59,7.7599998,1009.60004,60.27,2.12,196,1.8851618,1990,5,8
09.05.1990,0,3.8,-0.96999997,8.36,1014.2,58.395,2.19,213,2.188802,1990,5,9
10.05.1990,0,4.94,2.36,9.9,999.8,72.200005,2.35,208,2.2388227,1990,5,10
11.05.1990,0,3.29,-1.66,7.0299997,1013.4,81.17,2.76,254,2.5649164,1990,5,11
12.05.1990,0,4.85,-2.51,9.76,1021.3,59.65,2.3999999,208,2.2072563,1990,5,12
13.05.1990,0,8.69,1.55,15.179999,1017.4,60.48,2.27,210,2.5174713,1990,5,13
14.05.1990,0,8.599999,3.31,14.599999,1010.4,69.94,2.37,219,2.6270385,1990,5,14
15.05.1990,0,3.79,1.8299999,7.94,1009.60004,71.5,2.32,130,1.338728,1990,5,15
16.05.1990,0,3.82,1.25,6.23,1007.8,82.775,2.46,164,1.6922534,1990,5,16
17.05.1990,0,4.0499997,0.74,7.1099997,1008,77.655,2.6499999,182,1.8927566,1990,5,17
18.05.1990,0,2.59,-1.28,5.93,1012,65.935005,2.9399998,192,1.8922322,1990,5,18
19.05.1990,0,3.04,-2.07,7.2599998,1018.60004,71.545,2.84,168,1.6766769,1990,5,19
20.05.1990,0,4.42,-2.1599998,9.03,1017.2,61.985,2.96,194,2.0333169,1990,5,20
21.05.1990,0,4.89,0.48,7.73,1014.2,70.715004,2.73,141,1.5038055,1990,5,21
22.05.1990,0,4.67,2.18,7.2799997,1015.4,72.685,2.27,170,1.79863,1990,5,22
23.05.1990,0,5.5,2.5,8.679999,1013,55.985,2.19,193,2.1016166,1990,5,23
24.05.1990,0,8.66,2.97,12.67,1008.2,62.115,2.83,162,1.9486592,1990,5,24
25.05.1990,3.5,8.41,2.1399999,13.559999,1004.4,77.985,3.4099998,197,2.3567252,1990,5,25
26.05.1990,0,7.8599997,4.62,12.059999,1008.2,59.755,3.33,200,2.349932,1990,5,26
27.05.1990,0,8.099999,3.1899998,12.639999,1017.7,52.245003,3.1,179,2.1087375,1990,5,27
28.05.1990,4,6.37,1.1899999,11.05,1021.60004,61.955,2.99,264,2.943668,1990,5,28
29.05.1990,0,9.33,0.12,16.199999,1019.4,43.46,2.6799998,261,3.1838388,1990,5,29
30.05.1990,0,12.08,5.02,17.98,1008.8,42.760002,2.31,256,3.3766775,1990,5,30
31.05.1990,0,9.09,6.16,15.25,1013.60004,51.865,2.37,201,2.4417045,1990,5,31
01.06.1990,2.1000001,6.64,3.23,10.679999,1013.9,69.71,2.28,169,1.9077559,1990,6,1
02.06.1990,7.7000003,9.179999,4.99,13.42,1008.2,55.745003,2.95,224,2.7348127,1990,6,2
03.06.1990,9.400001,7.8199997,6.92,11.17,1002.7,76.19,3,106,1.2472533,1990,6,3
04.06.1990,0,6.73,2.61,11.48,1010.8,63.715,3,214,2.4262462,1990,6,4
05.06.1990,0,6.0099998,3.6,9.42,1013.4,60.315002,2.59,208,2.3021786,1990,6,5
06.06.1990,0,10.7699995,4.25,16.25,1013.4,40.265,2.19,299,3.8046813,1990,6,6
07.06.1990,0,12.25,4.21,17.3,1014.2,14.482353,2.23,322,4.2559175,1990,6,7
08.06.1990,0,14.11,7.44,20.65,1009.9,26.155,2.59,314,4.3484488,1990,6,8
09.06.1990,0,12.73,8.2699995,17.3,1015.2,42.535,2.78,290,3.8774464,1990,6,9
10.06.1990,0,13.04,4.67,17.58,1014.9,43.16,2.73,306,4.1230593,1990,6,10
11.06.1990,0,11.04,5.31,16.14,1015.60004,57.425003,2.72,278,3.5595126,1990,6,11
12.06.1990,3.7,11.69,4.65,17.22,1012.8,66.745,2.32,271,3.5333118,1990,6,12
13.06.1990,4,8.849999,7.0499997,14.67,1012.4,68.26,2.1699998,188,2.2694042,1990,6,13
14.06.1990,0,10.929999,6.49,15.44,1016.3,66.43,2.05,192,2.4504857,1990,6,14
15.06.1990,0,11.82,4.69,17,1015.3,57.4,1.89,246,3.2146938,1990,6,15
16.06.1990,2,7.99,5.33,15.799999,1013.7,76.035,2.01,113,1.329381,1990,6,16
17.06.1990,0,5.8799996,4.2799997,8.41,1015.8,70.91,1.93,120,1.3210417,1990,6,17
18.06.1990,2.7,8.76,6.35,13.16,1017.10004,73.36,2.06,147,1.7660499,1990,6,18
19.06.1990,0,10.7699995,7.12,15.089999,1020.60004,65.645004,2.21,236,2.9936872,1990,6,19
20.06.1990,0,12.099999,6.39,17.09,1020.9,57.530003,2.4299998,290,3.8079333,1990,6,20
21.06.1990,0,13.2,6.08,18.07,1018,42.525,2.7,240,3.2423365,1990,6,21
22.06.1990,0,15.91,10.83,21.22,1014.60004,55.455,3.05,245,3.52633,1990,6,22
23.06.1990,0,16.199999,10.11,21.82,1012.8,52.170002,2.6599998,262,3.7970355,1990,6,23
24.06.1990,0,17.859999,12.19,22.619999,1013,49.15,2.71,312,4.6786265,1990,6,24
25.06.1990,0,17.619999,10.849999,22.73,1008.9,63.52,2.54,210,3.1384053,1990,6,25
26.06.1990,2,14.0199995,11.9,19.51,1001.5,74.405,2.3899999,214,2.967085,1990,6,26
27.06.1990,0,11.849999,9.8,15.63,1002.9,57.54,2.45,327,4.2987356,1990,6,27
28.06.1990,0,12.849999,6.91,17.73,1007.10004,59.300003,2.24,213,2.8657103,1990,6,28
29.06.1990,11.5,11.87,9.11,15.71,1000.60004,70.815,2.05,118,1.5535122,1990,6,29
30.06.1990,1.8000001,8.22,6.75,11.179999,1008.60004,89.590004,2.3999999,190,2.2559226,1990,6,30
01.07.1990,0,9.809999,4.06,14.94,1015.8,53.64,2.72,233,2.8854232,1990,7,1
02.07.1990,7.3,10.4,4.19,15.049999,1009,55.375,2.34,210,2.6508825,1990,7,2
03.07.1990,2.6000001,11.84,9.929999,14.54,1003.4,83.270004,2.06,137,1.8001642,1990,7,3
04.07.1990,1.7,13.04,9.82,16.74,1004,85.055,2.51,175,2.36832,1990,7,4
05.07.1990,2.7,13.69,10.23,18.08,1006.4,77.135,3.02,247,3.3917716,1990,7,5
06.07.1990,17.800001,13.42,9.179999,18.97,1005.10004,63.295002,2.98,157,2.1432505,1990,7,6
07.07.1990,1.1,13.67,12.3,14.809999,1003.2,91.71333,2.78,176,2.4187198,1990,7,7
08.07.1990,2.1000001,13.17,10.429999,14.98,1003.2,90.51667,2.34,195,2.648125,1990,7,8
09.07.1990,2.8,13.63,10.62,18.96,998.2,86.225,2.61,122,1.678348,1990,7,9
10.07.1990,1.4,13.65,10.11,16.39,998.8,89.357895,2.6299999,201,2.7657917,1990,7,10
11.07.1990,3.7,12.7699995,10.15,16.16,1002.2,91.28,2.56,180,2.4218142,1990,7,11
12.07.1990,18.800001,10.78,7.5299997,13.54,1001.60004,84.32,2.2,161,2.0597484,1990,7,12
13.07.1990,2.7,8.12,7.6299996,11.63,1003.3,85.62,2.05,127,1.5072482,1990,7,13
14.07.1990,0,8.72,5.79,11.71,1016.9,72.095,2.47,118,1.4161365,1990,7,14
15.07.1990,4.4,12.49,8.25,16.55,1016.9,53.350002,2.01,198,2.6298385,1990,7,15
16.07.1990,0,11.61,8.71,14.62,1020.4,85.825005,2.1499999,92,1.1932125,1990,7,16
17.07.1990,0,12.09,10.36,14.33,1017.4,82.175,2.32,131,1.722191,1990,7,17
18.07.1990,0,13.0199995,9.91,15.2,1013.2,77.65,2.6,100,1.3476691,1990,7,18
19.07.1990,0,17.71,13.61,21.34,1015.60004,84.495,2.05,162,2.4198833,1990,7,19
20.07.1990,0,17.92,13.7,24.16,1017.3,78.245,1.87,209,3.1332593,1990,7,20
21.07.1990,9.900001,16.4,13.58,19.289999,1013.5,81.015,1.9699999,140,2.0370772,1990,7,21
22.07.1990,8.6,16.07,11.78,19.91,1012.60004,90.490005,2.29,182,2.6305032,1990,7,22
23.07.1990,2.3,17.43,14.36,21.64,1015,90.96667,2.28,152,2.2581904,1990,7,23
24.07.1990,0,14.62,10.469999,19.99,1021.8,89.935,2.27,176,2.4549572,1990,7,24
25.07.1990,0,15.11,11.309999,18.81,1022.7,73.445,1.87,229,3.2288268,1990,7,25
26.07.1990,0,15.33,9.91,20.689999,1021.5,73.425,1.9,196,2.7783895,1990,7,26
27.07.1990,0,16.859999,12.37,21.439999,1016.5,83.62,1.78,191,2.8031166,1990,7,27
28.07.1990,0,13.92,11.12,18.01,1018.4,74.23,1.75,179,2.4597766,1990,7,28
29.07.1990,0,13.62,5.3199997,19.57,1017,61.22,1.8399999,216,2.9488432,1990,7,29
30.07.1990,0,13.82,9.48,17.6,1016.10004,74.7,1.62,128,1.7563821,1990,7,30
31.07.1990,0,13.179999,8.36,16.3,1018.7,78.095,1.61,149,2.0114133,1990,7,31
01.08.1990,12.7,14.179999,12.15,18.63,1021.5,81.015,1.75,181,2.4994504,1990,8,1
02.08.1990,0,16.75,10.49,21.699999,1023,74.64,2.04,196,2.8633518,1990,8,2
03.08.1990,4,18.02,15.24,21.76,1014.5,80.18,2.12,139,2.089952,1990,8,3
04.08.1990,2.3,15.45,12.28,19.08,1006.8,69.045,1.9399999,159,2.2722068,1990,8,4
05.08.1990,19.1,10.51,9.389999,16.31,995.10004,84.315,2.19,121,1.5413245,1990,8,5
06.08.1990,1.6,11.059999,8.5199995,13.67,998.3,74.43,2.28,147,1.8972547,1990,8,6
07.08.1990,0,11.53,7.7,15.54,1006.9,82.98,2.02,181,2.3560548,1990,8,7
08.08.1990,4.7000003,10.38,5.87,14.48,1006.8,79.18,2.08,150,1.8942976,1990,8,8
09.08.1990,1.2,12.83,9.74,16.66,1010.4,91.50667,1.87,151,2.0278535,1990,8,9
10.08.1990,0,13.12,6.5,18.14,1013.10004,82.880005,1.87,210,2.8371005,1990,8,10
11.08.1990,0,12.73,7.1299996,17.24,1014.5,63.66,1.81,232,3.102838,1990,8,11
12.08.1990,0,12.5199995,5.43,18.18,1012.60004,69.880005,1.8199999,190,2.529909,1990,8,12
13.08.1990,3.7,13.5,9.46,16.67,1010.4,76.26,1.93,140,1.9108028,1990,8,13
14.08.1990,0,14.96,13.09,17.73,1010.60004,82.090004,1.81,115,1.6233524,1990,8,14
15.08.1990,0,15.75,13.639999,17.66,1011.10004,71.85,1.9799999,134,1.9244686,1990,8,15
16.08.1990,2.9,16.35,13.24,19.289999,1013.8,81.725,2.25,149,2.165505,1990,8,16
17.08.1990,1.5,16.67,13.559999,20.14,1013.60004,80.875,2.52,179,2.619292,1990,8,17
18.08.1990,9,13.41,11.92,17.82,1010.4,84.535,2.05,102,1.3891692,1990,8,18
19.08.1990,0,11.889999,8.34,15.69,1012.7,90.71111,1.81,137,1.7954484,1990,8,19
20.08.1990,4.2000003,12.83,10.09,16.359999,1011.10004,84.11,2.69,134,1.7990422,1990,8,20
21.08.1990,0,11.889999,10.29,14.2,1008.9,91.12667,2.8999999,125,1.6407866,1990,8,21
22.08.1990,0,11.13,9,13.58,1010.5,85.435,2.56,78,1.0032724,1990,8,22
23.08.1990,1.4,9.15,7.75,10.95,1009.4,80.72,2.09,90,1.0972728,1990,8,23
24.08.1990,0,9.62,4.0499997,14.25,1008.5,89.065,1.5799999,125,1.5448773,1990,8,24
25.08.1990,0,8.78,4.2999997,13.82,1007.3,92.5,1.7099999,130,1.5698111,1990,8,25
26.08.1990,0,9.01,3.47,13.5,1009.4,89.575005,1.6899999,130,1.578652,1990,8,26
27.08.1990,0,8.2699995,2.4199998,12.429999,1017,84.075005,1.76,127,1.5041766,1990,8,27
28.08.1990,0,9.2699995,6.33,11.62,1017,91.16843,1.65,92,1.1215873,1990,8,28
29.08.1990,0,11.53,8.87,14.799999,1019,91.03333,1.74,56,0.72522706,1990,8,29
30.08.1990,0,12.33,11.53,13.37,1021.5,89.215004,1.8399999,95,1.2543842,1990,8,30
31.08.1990,0,12.509999,11.09,14.83,1020.7,85.015,2,84,1.1145159,1990,8,31
01.09.1990,0,10.3,7.5099998,14.639999,1021.4,80.1,1.9699999,141,1.765421,1990,9,1
02.09.1990,0,6.95,2.27,11.21,1023,71.525,2.21,126,1.4297806,1990,9,2
03.09.1990,0,7.41,5.8399997,8.88,1026.6,77.66,2.31,100,1.1489582,1990,9,3
04.09.1990,0,7.7599998,6.5899997,8.92,1022.7,65.61,2.45,122,1.4193431,1990,9,4
05.09.1990,2.4,7.7999997,4.68,10.309999,1017,80.545,2.49,101,1.1796352,1990,9,5
06.09.1990,6.2000003,7.33,3.1799998,9.45,1013.5,82.405,2.45,60,0.6920419,1990,9,6
07.09.1990,0,9.73,8.46,11.83,1015.5,77.425,2.55,104,1.2852287,1990,9,7
08.09.1990,1,8.73,8.179999,10.54,1017.5,84.83,2.48,40,0.4800522,1990,9,8
09.09.1990,0,9.23,8.429999,10.75,1019.4,87.395004,2.31,82,0.9974535,1990,9,9
10.09.1990,1.3000001,10.84,7.5899997,14.719999,1023.4,90.836845,2.49,112,1.4216772,1990,9,10
11.09.1990,0,5.7999997,4.74,9.969999,1026.9,75.505,2.52,78,0.85168046,1990,9,11
12.09.1990,3.7,4.0299997,3.28,5.23,1017.2,87.055,2.36,59,0.6101627,1990,9,12
13.09.1990,0,6.3399997,4.29,10.12,1009.7,90.56111,2.04,69,0.77320015,1990,9,13
14.09.1990,6,2.84,-1.5799999,7.6499996,1007.5,86.085,1.93,66,0.6579908,1990,9,14
15.09.1990,0,7.64,4.56,11.74,1014.10004,91.46842,2.1599998,65,0.7565732,1990,9,15
16.09.1990,0,5.6,0.08,11.16,1021.60004,81.68,1.9699999,125,1.3596392,1990,9,16
17.09.1990,0,6.2599998,2.57,10.94,1014.3,73.385,2.1499999,99,1.1040274,1990,9,17
18.09.1990,6.2000003,7.0699997,6.0299997,8.62,1009.8,82.665,2.74,81,0.9285158,1990,9,18
19.09.1990,3.1000001,7.29,6.04,8.63,1001.7,81.735,3.24,55,0.63723695,1990,9,19
20.09.1990,11,7.17,7.08,7.8999996,993.60004,73.82,3.1999998,38,0.44041064,1990,9,20
21.09.1990,1.9,5.5699997,4.67,7.71,1003.2,84.385,3.78,37,0.4058498,1990,9,21
22.09.1990,0,2.28,0.61,4.49,1010.5,74,3.1499999,29,0.2828284,1990,9,22
23.09.1990,0,2.3,0.72999996,4.99,1011.5,89.16843,2.35,62,0.60477215,1990,9,23
24.09.1990,0,2.3,0.32999998,4.0499997,1013.4,92.450005,2.83,55,0.5359211,1990,9,24
25.09.1990,0,1.6899999,-1.38,5.73,1014.10004,92.76667,2.61,55,0.523725,1990,9,25
26.09.1990,0,1.93,-1.78,5.14,1014.5,86.72,1.75,64,0.614772,1990,9,26
27.09.1990,0,0.35,-2.34,4.14,1010.9,86.07,2.09,65,0.5890353,1990,9,27
28.09.1990,2.3,1.13,-2.69,3.8899999,1000.7,81.630005,2.1499999,72,0.67645234,1990,9,28
29.09.1990,0,1.5799999,0.88,2.79,1001.10004,86.96,2.08,33,0.3152766,1990,9,29
30.09.1990,0,1.88,-0.21,5.0499997,1004.2,89.18,2.28,45,0.43398604,1990,9,30
01.10.1990,2.5,1.52,-0.41,3.61,1010.4,89.10526,2.1,45,0.4266735,1990,10,1
02.10.1990,0,2.35,0.75,4.11,1015.8,86.53158,2.05,76,0.7409105,1990,10,2
03.10.1990,1.9,3.03,1.9799999,5.16,1016.2,87.29,2.56,24,0.23975411,1990,10,3
04.10.1990,22.5,3.4499998,2.58,4.11,1007.7,85.415,2.97,37,0.37691125,1990,10,4
05.10.1990,2.4,4.7799997,2.27,6.5,995.10004,80.35,2.61,39,0.4185858,1990,10,5
06.10.1990,0,3.03,1.37,5.33,992.4,90.06842,2.62,18,0.18218972,1990,10,6
07.10.1990,5.4,2.18,1.23,3.23,994.4,91.881256,2.4099998,25,0.2451427,1990,10,7
08.10.1990,0,-0.17999999,-2.04,3.3799999,996.10004,88.13889,2.73,45,0.40289828,1990,10,8
09.10.1990,15.400001,0.29999998,-3.34,2.9399998,981,85.66,2.79,38,0.34986535,1990,10,9
10.10.1990,0,3.11,2.1499999,5.23,975.4,94.325005,2.21,37,0.37913,1990,10,10
11.10.1990,0,1.61,0.42,5.33,994,92.06316,2,59,0.5666189,1990,10,11
12.10.1990,0,-0.85999995,-2.9199998,2.3999999,1018.7,89.99375,2.2,62,0.53275925,1990,10,12
13.10.1990,4.3,1.62,-6.31,4.17,1015.2,87.43158,2.4299998,23,0.21830074,1990,10,13
14.10.1990,3.6000001,6.6299996,3.4499998,8.33,1007.4,86.865005,1.92,43,0.4868156,1990,10,14
15.10.1990,0,5.48,3.4499998,8.74,1011.5,89.78333,2.49,17,0.18513754,1990,10,15
16.10.1990,1.6,6.3799996,5.41,7.6099997,1006.4,92.08236,2.24,11,0.123622954,1990,10,16
17.10.1990,0,9.11,7.1499996,10.5199995,999.7,88.488235,2.33,30,0.366973,1990,10,17
18.10.1990,0,-1.56,-4.56,8.389999,1024,90.86429,1.93,29,0.2412826,1990,10,18
19.10.1990,0,-2.03,-7.3799996,-0.049999997,1022.7,86.34211,1.53,30,0.2448862,1990,10,19
20.10.1990,0,-1.5,-4.99,1.36,1025,87.16111,2.12,29,0.24174233,1990,10,20
21.10.1990,0,-3.1599998,-8.2,-0.7,1027.4,69.085,3.1399999,27,0.2092249,1990,10,21
22.10.1990,0,3.9399998,-2.59,7.21,1015.2,83.41,3.1,28,0.28897664,1990,10,22
23.10.1990,0,5.93,2.74,8.16,1014.60004,93.344444,2.62,33,0.3640923,1990,10,23
24.10.1990,0,3.55,1.22,7.5,1015.4,93.60556,1.8499999,27,0.27486223,1990,10,24
25.10.1990,0,1.03,-1.79,4.68,1014,93.86667,1.88,32,0.29719737,1990,10,25
26.10.1990,0,0.66999996,-2.6799998,6.46,1016.4,92.37858,2.4199998,28,0.25610036,1990,10,26
27.10.1990,0,-3.6299999,-5.2999997,-1.63,1016.9,89.68421,2.52,10,0.07640065,1990,10,27
28.10.1990,0,-0.65999997,-4.4,0.61,1015.10004,82.205,3.6399999,10,0.08682169,1990,10,28
29.10.1990,0,0.45999998,-1.17,1.17,1011.9,71.125,3.9499998,13,0.11824577,1990,10,29
30.10.1990,2.7,-0.14,-0.75,0.65999997,1005.8,78.635,4.27,6,0.053492226,1990,10,30
31.10.1990,0,-0.66999996,-1.4699999,0.98999995,1002,91.67778,3.29,3,0.026243627,1990,10,31
01.11.1990,4.5,-2.3999999,-3.31,-1.5699999,996.60004,86.985,2.98,4,0.032672547,1990,11,1
02.11.1990,1.2,-0.07,-1.7199999,0.32999998,1000.10004,83.8,2.47,5,0.044854015,1990,11,2
03.11.1990,0,-1.4399999,-2.2,0.11,1002.10004,91.05625,2.07,3,0.025427116,1990,11,3
04.11.1990,0,-3.34,-5.29,-0.31,1004.2,85.755,2.11,15,0.11704698,1990,11,4
05.11.1990,0.8,-2.11,-5.6299996,0.089999996,1005.10004,89.62942,1.93,13,0.10692796,1990,11,5
06.11.1990,0,-2.19,-3.62,0.03,1011.4,74.845,1.9399999,14,0.11430785,1990,11,6
07.11.1990,0,-2.8,-5.23,0.26,1008.5,78.265,2.01,13,0.10358151,1990,11,7
08.11.1990,0,0.22,-2.54,2.4199998,1011.60004,80.875,2.11,7,0.06308516,1990,11,8
09.11.1990,0,-3.62,-5.2,0,1013.9,86.66316,1.8299999,8,0.06126687,1990,11,9
10.11.1990,2,-4.23,-6.97,-1.31,1009.60004,89.676926,1.77,4,0.029886644,1990,11,10
11.11.1990,0,-10.15,-11.11,-6.81,1021.60004,89.63334,1.63,12,0.06623388,1990,11,11
12.11.1990,0,-8.05,-11.88,-5.2799997,1014.10004,83.025,1.49,7,0.043373246,1990,11,12
13.11.1990,0,-10.389999,-11.94,-5.7799997,1013.5,83.89,1.7099999,7,0.038366746,1990,11,13
14.11.1990,0,-16.05,-19.189999,-10.04,1021.2,87.525,2.08,9,0.035244398,1990,11,14
15.11.1990,1.5,-9.08,-19.52,-6.1099997,1017.9,75.200005,2.22,7,0.04101212,1990,11,15
16.11.1990,7.5,-2.7,-6.1299996,-1.5699999,997.3,84.745,2.73,4,0.03223994,1990,11,16
17.11.1990,2.3,-5.5699997,-6.81,-1.9699999,982.9,89.03529,3.27,4,0.028603433,1990,11,17
18.11.1990,1.4,-4.99,-7.0699997,-4.42,985.10004,91.31334,3.74,4,0.029342076,1990,11,18
19.11.1990,2.9,-6.8599997,-9.5199995,-3.6499999,996.2,86.46,3.06,3,0.019978892,1990,11,19
20.11.1990,0,-17.699999,-20.71,-9.84,1010.5,80.425,2.61,2,0.007115187,1990,11,20
21.11.1990,0,-18.1,-20.74,-16.43,1009.2,88.275,2.3799999,3,0.010410743,1990,11,21
22.11.1990,0,-18.22,-21.4,-15.38,1004.4,84.78,1.81,4,0.013828309,1990,11,22
23.11.1990,0,-12.98,-15.429999,-11.98,1016.9,86.270004,2.33,5,0.023635235,1990,11,23
24.11.1990,0,-18.76,-21.85,-13.889999,1027.8,79.78,2.34,2,0.006544048,1990,11,24
25.11.1990,3.9,-13.94,-19.73,-10.849999,1023.5,72.44,2.73,3,0.013335179,1990,11,25
26.11.1990,0,-11.889999,-13.32,-10.34,1003.2,83.835,2.28,2.95,0.014998657,1990,11,26
27.11.1990,0,-8.87,-12.59,-7,1003.4,89.63684,1.9499999,2.9,0.017359909,1990,11,27
28.11.1990,4.1,-8.3,-11.58,-6.58,1000.2,86.285,1.86,2.85,0.017609986,1990,11,28
29.11.1990,0,-7.3999996,-10.099999,-5.23,1001.9,89.357895,2.19,2.8,0.018083,1990,11,29
30.11.1990,2.4,-9.13,-11.98,-6.37,1011.7,75.35,2.86,2.75,0.016142188,1990,11,30
01.12.1990,0,-4.92,-8.21,-3.3799999,1007.3,83.3,2.62,2.7,0.019574065,1990,12,1
02.12.1990,5.9,-1.5899999,-5.45,1.79,989.4,86.655,2.36,2.65,0.022498941,1990,12,2
03.12.1990,0,-1.78,-2.37,-0.39,972,87.515,2.1599998,2.6,0.022143612,1990,12,3
04.12.1990,0,-3.27,-6.3399997,-0.85999995,990.8,90.918755,2.4299998,2.55,0.020134231,1990,12,4
05.12.1990,0,-9.74,-12.33,-3.26,1016.60004,79.810005,2.29,2.5,0.014157848,1990,12,5
06.12.1990,0,-1.8499999,-10.09,3.37,991.3,84.840004,2.3799999,2.45,0.020552032,1990,12,6
07.12.1990,0,-8.099999,-10.41,-0.02,994.7,81.130005,2.23,2.4,0.015040914,1990,12,7
08.12.1990,0,-11.84,-12.54,-9.91,1013.5,88.541176,2.28,2.35,0.011887698,1990,12,8
09.12.1990,0,-10.55,-12.95,-8.929999,1021,85.52106,2.58,2.3,0.012427512,1990,12,9
10.12.1990,0,-15.16,-18.47,-8.95,1014.4,77.595,3.1899998,2.25,0.009359679,1990,12,10
11.12.1990,0,-12.679999,-18.9,-8.88,1000.60004,81.725,2.47,2.2,0.01071591,1990,12,11
12.12.1990,3,-4.2799997,-10.7,-3.1,995.7,90.950005,3.05,2.15,0.016176043,1990,12,12
13.12.1990,1.4,-7.77,-9.99,-4.18,1010.10004,83.54,2.56,2.1,0.01323563,1990,12,13
14.12.1990,0,-7.21,-9.99,-3.9499998,1015.60004,89.08889,2.2,2.05,0.013236868,1990,12,14
15.12.1990,0,-3.1799998,-13.66,3.32,1016,85.525,2.06,2,0.015597653,1990,12,15
16.12.1990,0,-5.12,-11.95,3.02,1031.1,85.060005,1.92,1.95,0.013784829,1990,12,16
17.12.1990,0,0.17999999,-6.56,3.1299999,1022.3,90.33125,1.93,1.9,0.016988436,1990,12,17
18.12.1990,0,1.15,-1.8199999,3.87,1019.5,88.275,2.06,1.85,0.017206239,1990,12,18
19.12.1990,0,-3.6299999,-5,-0.96999997,1006.60004,88.450005,2,1.8,0.01384447,1990,12,19
20.12.1990,7.8,-3.6699998,-3.9499998,-3.21,996.5,92.10909,2.58,1.75,0.013525049,1990,12,20
21.12.1990,0,-6.08,-8.99,-3.47,998.7,90.92941,2.25,1.7,0.011736915,1990,12,21
22.12.1990,5.6,-10.389999,-12.23,-9.23,1012.8,86.455,1.88,1.65,0.0090483,1990,12,22
23.12.1990,5.3,-3.3899999,-10.639999,-1.91,1010.3,86.840004,2.12,1.6,0.01240831,1990,12,23
24.12.1990,0,-0.83,-2.1,-0.02,1011.3,88.88333,2.69,1.55,0.013395341,1990,12,24
25.12.1990,0,0.29999998,-0.61,1.36,1003.2,90.16471,3.21,1.5,0.013628485,1990,12,25
26.12.1990,4.2000003,-0.45,-1.1999999,-0.24,993.5,83.15,3.59,1.45,0.012863585,1990,12,26
27.12.1990,10.5,-1.16,-1.73,-0.39999998,982.4,84.835,3.55,1.4,0.012151578,1990,12,27
28.12.1990,4.1,-1.6899999,-2.9099998,-0.84999996,981.10004,85.61,2.82,1.35,0.011474132,1990,12,28
29.12.1990,2.6000001,-6.62,-12.55,-1.9799999,993.9,86.05,2.9299998,1.3,0.008773687,1990,12,29
30.12.1990,1.5,-3.4399998,-4.0899997,-2.26,992.7,80.945,2.55,1.25,0.009784041,1990,12,30
31.12.1990,0,-6.3599997,-7.23,-4.3199997,1001.3,85.8,1.87,1.2,0.008159258,1990,12,31
01.01.1991,1.9,-10.75,-12.96,-7.21,1008.60004,86.075005,3.08,1.15,0.006203329,1991,1,1
02.01.1991,12,-7.2999997,-12.42,-4.79,1000.10004,86.433334,4.0299997,1.1,0.007148585,1991,1,2
03.01.1991,6.4,-8.91,-10.17,-5.14,991.5,78.635,3.73,1.05,0.006327335,1991,1,3
04.01.1991,4.1,-10.3,-11.44,-8.09,998.2,84.315,3.52,1,0.005571041,1991,1,4
05.01.1991,4.6,-13.63,-14.599999,-11.82,997.3,83.845,4.04,1,0.004621567,1991,1,5
06.01.1991,6,-14.009999,-14.92,-13.61,987.8,83.090004,3.9299998,1,0.004553695,1991,1,6
07.01.1991,7.8,-13.91,-14.25,-13.2,986.2,78.5,3.3,1,0.004586559,1991,1,7
08.01.1991,0,-18.77,-21.72,-14.62,992.2,85.79,3.1999998,1,0.003369264,1991,1,8
09.01.1991,1.5,-15.7,-18.23,-13.82,995.9,91.32223,3.4299998,1,0.004085051,1991,1,9
10.01.1991,0,-13.92,-15.139999,-13.45,993.9,85.32778,4,2,0.009111285,1991,1,10
11.01.1991,0,-16.949999,-19.52,-13.84,996.3,85.052635,3.1399999,2,0.007553591,1991,1,11
12.01.1991,0,-19.14,-21.59,-15.87,1007.10004,87.935005,2.29,2,0.006492656,1991,1,12
13.01.1991,0,-13.92,-17.23,-10.84,1020.8,85.545,2.51,3,0.013379248,1991,1,13
14.01.1991,0,-8.389999,-11.139999,-6.29,1029.8,82.465004,3.5,2,0.012043099,1991,1,14
15.01.1991,0,-1.11,-7.99,0.39,1020,78.075005,3.03,1,0.008498265,1991,1,15
16.01.1991,0,-0.71999997,-2.6699998,1.68,1018.8,61.4,2.9399998,2.5,0.021604165,1991,1,16
17.01.1991,0,-2.1399999,-4.49,-0.42999998,1019.4,75.565,2.32,4,0.03256553,1991,1,17
18.01.1991,0,-7.3399997,-13.4,-1.4,1010.60004,77.95789,2.35,4,0.0257515,1991,1,18
19.01.1991,0,-3.6699998,-5,-0.79999995,1016,70.075005,2.36,5,0.03815424,1991,1,19
20.01.1991,0,-2.81,-5.0899997,0.14999999,994.9,80.060005,2.54,6,0.048204955,1991,1,20
21.01.1991,0,-4.6,-7.2999997,-0.28,1015.60004,78.665,2.51,7,0.051219836,1991,1,21
22.01.1991,0,2.3,-7.24,5.44,1004.4,72.55,2.4299998,6,0.058760017,1991,1,22
23.01.1991,0,1.5899999,-0.45,4.7999997,998.2,78.86,2.5,8,0.076586865,1991,1,23
24.01.1991,0,-2.51,-4.75,-1.01,1012,74.89,2.56,8,0.06440413,1991,1,24
25.01.1991,0,1.2099999,-1.91,4.18,995,71.605,2.48,4,0.037820127,1991,1,25
26.01.1991,1.6,-12.03,-14.87,-0.68,1025.3,76.520004,2.22,6,0.029759249,1991,1,26
27.01.1991,0,-7.69,-14.65,-4.74,1016.3,88.82353,2.25,12,0.07560554,1991,1,27
28.01.1991,0,-4.61,-6.33,-2.32,1018.4,79.590004,2.24,4,0.029200828,1991,1,28
29.01.1991,0,-10.69,-13.49,-5.21,1031.2001,80.42,2.35,10,0.053217083,1991,1,29
30.01.1991,1.2,-7.98,-13.16,-5.5299997,1025,88.155,2.49,5,0.030852348,1991,1,30
31.01.1991,1.5,-4.5099998,-6.85,-2.48,1031.4,87.935005,2.4299998,5,0.03635765,1991,1,31
01.02.1991,0,-12.86,-17.93,-5.97,1039.1,84.335,2.06,7,0.032758404,1991,2,1
02.02.1991,0,-7.7999997,-9.76,-5.94,1044,88.53158,1.9,15,0.092176914,1991,2,2
03.02.1991,0,-10.44,-11.969999,-8.54,1045.5,78.045,1.75,19,0.10144043,1991,2,3
04.02.1991,0,-11.509999,-13.559999,-10.03,1047.1,81.94,2.12,19,0.09547833,1991,2,4
05.02.1991,0,-8.92,-12.59,-6.73,1048,89.26316,2.9099998,21,0.121432975,1991,2,5
06.02.1991,0,-12.13,-17.08,-6.5099998,1045.7001,88.055,3.1699998,23,0.11170193,1991,2,6
07.02.1991,0,-15.469999,-23.519999,-9.41,1041.4,87.75,2.8,19,0.07590227,1991,2,7
08.02.1991,0,-15.0199995,-17.48,-11.7699995,1039.9,89.60589,3.12,24,0.09868174,1991,2,8
09.02.1991,0,-18.52,-22.269999,-11.59,1035.1,87.335,2.52,26,0.085913666,1991,2,9
10.02.1991,0,-17.92,-23.119999,-13.32,1028.8,83.48947,2.35,30,0.10363981,1991,2,10
11.02.1991,0,-16.119999,-18.05,-13.19,1025.8,85.88421,2.69,26,0.10099835,1991,2,11
12.02.1991,0,-16.71,-20.22,-11.46,1025.9,90.0875,2.06,26,0.097308315,1991,2,12
13.02.1991,0,-16.619999,-21.359999,-12.2699995,1027.4,82.815,2.33,17,0.063910626,1991,2,13
14.02.1991,0,-17.82,-21.3,-14.57,1016.2,81.435005,2.56,21,0.07378231,1991,2,14
15.02.1991,0,-21.56,-24.019999,-19.18,1001.3,81.270004,2.96,20,0.055326875,1991,2,15
16.02.1991,1.9,-21.47,-26.42,-19.09,994.9,84.67368,2.59,23,0.06438601,1991,2,16
17.02.1991,2.6000001,-17.859999,-20.77,-14.42,998.5,89.545,2.28,22,0.078242116,1991,2,17
18.02.1991,0,-19.02,-21.49,-16.07,1004.3,83.700005,1.89,24,0.07872213,1991,2,18
19.02.1991,0,-18.19,-21.97,-13.29,1000.3,80.93,1.75,42,0.14598402,1991,2,19
20.02.1991,4.9,-15.66,-17.41,-14.429999,995.10004,77.29,1.81,18,0.07376061,1991,2,20
21.02.1991,1,-7.99,-14,-4.23,991,80.200005,2.1499999,35,0.22116241,1991,2,21
22.02.1991,2.1000001,-2.6499999,-5.96,-0.37,1004.10004,75.835,2.73,39,0.31365034,1991,2,22
23.02.1991,4.6,-0.9,-2.47,-0.08,995.5,88.4125,2.8899999,11,0.09571327,1991,2,23
24.02.1991,0,-3.58,-5.91,-0.68,992.2,89.933334,2.09,29,0.22566345,1991,2,24
25.02.1991,2.8,-5.96,-8.62,-4.02,1011.2,84.18125,1.8399999,35,0.24095526,1991,2,25
26.02.1991,0,-9.5,-14.839999,-3.52,1036.6,80.755005,1.9399999,48,0.27136168,1991,2,26
27.02.1991,0,-10.389999,-13.7,-3.3999999,1044.5,69.68,2.4099998,57,0.30537668,1991,2,27
28.02.1991,0,-11.01,-17.66,-3.6599998,1042,75.825005,2.4199998,58,0.30085006,1991,2,28
01.03.1991,0,-15.36,-20.64,-10.599999,1039,78.61,1.93,49,0.19745366,1991,3,1
02.03.1991,0,-11.91,-13.679999,-9.78,1034.8,87.925,1.9799999,51,0.25286365,1991,3,2
03.03.1991,1.1,-8.7699995,-13.13,-5.0899997,1028.3,90.97059,1.99,46,0.2718728,1991,3,3
04.03.1991,0,-4.7,-5.37,-4.22,1020.7,91.66,2.1299999,27,0.19598922,1991,3,4
05.03.1991,1,-6.3999996,-7.35,-5.52,1020.5,92.8,2.1299999,42,0.2812684,1991,3,5
06.03.1991,8.2,-7.83,-8.17,-6.77,1020.10004,88.30769,2.58,31,0.19341667,1991,3,6
07.03.1991,1.9,-2.33,-7.71,-1.25,1010.2,89.84167,2.96,32,0.2599124,1991,3,7
08.03.1991,2.2,-8.849999,-11.259999,-1.99,1018.2,89.12,3.23,46,0.27271023,1991,3,8
09.03.1991,6.8,-9.98,-10.719999,-9.33,1024.5,84.715004,2.9399998,51,0.2834825,1991,3,9
10.03.1991,11.2,-5.98,-9.469999,-4.2999997,1014.7,89.675,2.1699998,32,0.21956493,1991,3,10
11.03.1991,3.8,-2.56,-4.13,-1.29,1002.10004,91.200005,1.6899999,37,0.29910392,1991,3,11
12.03.1991,0,-9.23,-11.5199995,-3.4199998,1011.5,81.535,1.63,71,0.41463947,1991,3,12
13.03.1991,0,-13.32,-17.17,-7.96,1019.10004,78.89,1.4399999,91,0.4210058,1991,3,13
14.03.1991,0,-13.71,-17.08,-9.889999,1009.10004,82.28,1.63,50,0.22785819,1991,3,14
15.03.1991,0,-10.9,-15.719999,-4.5299997,1006.2,85.83,1.68,84,0.45021498,1991,3,15
16.03.1991,0,-9.22,-13.469999,-2.82,1012.5,75.090004,1.99,106,0.6189135,1991,3,16
17.03.1991,0,-9.58,-14.889999,-2.58,1014.5,83.555,2.2,93,0.5319968,1991,3,17
18.03.1991,6.8,-9.33,-14.49,-6.2,1019.7,83.75,2.1,65,0.37535712,1991,3,18
19.03.1991,8.3,-5.47,-7.49,-3.97,1010.8,91.433334,2.77,36,0.25375432,1991,3,19
20.03.1991,16,-1.03,-3.6,-0.06,997.10004,86.4,2.71,30,0.25940114,1991,3,20
21.03.1991,6.9,-1.89,-2.8799999,-0.41,1002.60004,91.66429,2.58,31,0.25776997,1991,3,21
22.03.1991,2.1000001,-5.0699997,-5.37,-2.85,1010.8,84.41,2.6,51,0.3662994,1991,3,22
23.03.1991,0,-9.69,-10.24,-5.5,1015.9,81.355,2.04,93,0.5283496,1991,3,23
24.03.1991,0,-12.05,-18.039999,-5.2,1020,77.335,2.4199998,122,0.60685515,1991,3,24
25.03.1991,0,-3,-13.83,3.75,1022.10004,82.020004,3.25,104,0.81434995,1991,3,25
26.03.1991,0,0.14,-5.77,4.68,1030.2001,83.23684,2.71,84,0.7464027,1991,3,26
27.03.1991,0,-1.24,-6.27,3.8899999,1028.1,77.37,2.1399999,117,0.98409,1991,3,27
28.03.1991,0,0.45,-5.43,4.96,1020,74.805,2.6299999,110,0.9954071,1991,3,28
29.03.1991,0,0.78,-3.58,4.2999997,1015.4,80.65,2.9099998,118,1.084527,1991,3,29
30.03.1991,0,0.22999999,-1.55,3.1899998,981.7,88.836845,2.3799999,79,0.72507006,1991,3,30
31.03.1991,4.8,-3.1499999,-3.9399998,-1.13,996.7,72.425,2.32,138,1.0911598,1991,3,31
01.04.1991,1.4,-8.16,-9.5199995,-3.9399998,996.9,76.385,2.26,131,0.81718487,1991,4,1
02.04.1991,2.4,-10.309999,-19.32,-5.96,986.8,86.16,2.28,37,0.20779632,1991,4,2
03.04.1991,2.5,-1.14,-7.1499996,5.18,981.4,87.83,2.6299999,97,0.8431437,1991,4,3
04.04.1991,0,3.25,0.12,6.3799996,997.60004,76.105,2.62,179,1.8206761,1991,4,4
05.04.1991,0,-0.13,-5.47,4.8199997,1014.8,80.35,2.61,132,1.1709815,1991,4,5
06.04.1991,0,1.61,0.57,2.08,1012.60004,89.240005,2.48,93,0.8836708,1991,4,6
07.04.1991,0,1.49,0.65,4.7599998,1010.8,88.305,2.6,120,1.1362503,1991,4,7
08.04.1991,2,-0.14999999,-0.77,0.58,1010.3,84.052635,2.74,92,0.8176816,1991,4,8
09.04.1991,0,1.41,0.03,3.9399998,1014.8,86.525,2.4199998,93,0.87592703,1991,4,9
10.04.1991,0,-0.19,-2.06,2.08,1022.2,80.16,2.4299998,113,0.9956324,1991,4,10
11.04.1991,0,2.59,-0.93,7.33,1021.60004,85.87,2.55,115,1.1273559,1991,4,11
12.04.1991,0,5.17,1.7199999,8.58,1016,78.880005,2.4199998,133,1.430427,1991,4,12
13.04.1991,0,5.31,3.57,8.19,1020.8,82.87,2.1399999,119,1.282629,1991,4,13
14.04.1991,0,1.7199999,0.03,4.69,1027.3,73.175,2.1299999,126,1.1922151,1991,4,14
15.04.1991,0,2.28,-1.09,6.0099998,996.2,81.885,2.5,108,1.061806,1991,4,15
16.04.1991,1.1,-0.32,-2.27,3.72,997.4,92.44667,3.3899999,122,1.08538,1991,4,16
17.04.1991,0,-4.77,-6.08,-0.96,1011.60004,69.535,3.62,159,1.1574003,1991,4,17
18.04.1991,0,-7.43,-13.099999,-4.02,1013.7,76.415,2.78,160,1.0232038,1991,4,18
19.04.1991,0,-5.5,-7.85,-3.1999998,1017.2,76.22,2.8899999,160,1.1213366,1991,4,19
20.04.1991,0,-6.2799997,-11.0199995,-2.35,1016.4,74.975,2.27,196,1.3239765,1991,4,20
21.04.1991,0,-4.18,-10.25,0.39,1010.3,57.385002,2.23,224,1.6766849,1991,4,21
22.04.1991,0,-2.04,-9.849999,2.01,1009.7,64.935,2.23,210,1.7274368,1991,4,22
23.04.1991,0,0,-4.74,3.86,1016.10004,77.48,2.1399999,191,1.7018555,1991,4,23
24.04.1991,0,0.53999996,-6.14,5.0499997,1023.7,70.555,2.18,235,2.1294568,1991,4,24
25.04.1991,0,1.8499999,-7.19,8.099999,1025.7001,67.745,2.09,215,2.0461352,1991,4,25
26.04.1991,0,1.5699999,-6.46,7.3799996,1030,69.555,2.4199998,203,1.9070292,1991,4,26
27.04.1991,0,3.8899999,-3.4099998,8.96,1029.7001,75.705,2.22,249,2.5456402,1991,4,27
28.04.1991,0,5.74,-1.61,9.929999,1028.3,71.86,1.9699999,197,2.1453302,1991,4,28
29.04.1991,0,3.23,-1.1,7.79,1035.2001,78.340004,2.07,172,1.7128196,1991,4,29
30.04.1991,0,1.54,-4.7999997,5.67,1034.7001,71.76,2.44,178,1.6658434,1991,4,30
01.05.1991,0,2.6499999,-1.3199999,6.2799997,1026,73.305,3.1,216,2.1169603,1991,5,1
02.05.1991,1,1.54,-1.5799999,5.93,1013.2,81.240005,2.8899999,119,1.1273582,1991,5,2
03.05.1991,0,4.0699997,1.29,6.91,1012.9,82.47,3.04,148,1.536203,1991,5,3
04.05.1991,0,2.76,-3.57,7.96,1013.10004,85.58,2.85,169,1.6748171,1991,5,4
05.05.1991,0,0.19,-4.27,5.8599997,1014.9,72.04,2.6599998,189,1.6979675,1991,5,5
06.05.1991,0,0.82,-4.58,4.73,1015.5,72.275,2.3899999,239,2.1999,1991,5,6
07.05.1991,1.3000001,1.8199999,-1.67,5.4,1009.7,83.32,2.3999999,189,1.8130033,1991,5,7
08.05.1991,0,-0.26999998,-2.27,2.1599998,1012.8,71.145004,2.57,195,1.7222574,1991,5,8
09.05.1991,1.1,0.28,-5.49,5.54,1018.4,60.120003,2.6,250,2.2493293,1991,5,9
10.05.1991,0,3.58,-0.45,8.8,1006.4,73.840004,2.96,180,1.8432938,1991,5,10
11.05.1991,0,6.8799996,3.9299998,10.59,999,80.8,2.78,159,1.8216473,1991,5,11
12.05.1991,0,6.81,1.24,10.7699995,1004.9,82.585,2.81,186,2.1202004,1991,5,12
13.05.1991,0,5.9,0.66999996,9.87,1010.10004,78.465004,2.57,200,2.2095058,1991,5,13
14.05.1991,3.3,3.04,-0.04,6.8199997,1007.4,86.490005,2.95,116,1.1648374,1991,5,14
15.05.1991,3.7,0.95,0.24,3.25,1010.4,90.47059,3.6,132,1.2247348,1991,5,15
16.05.1991,2.7,0.76,-0.32999998,2.09,1018.3,84.4,3.32,118,1.0818604,1991,5,16
17.05.1991,0,0.39,-1.63,2.45,1022.2,79.130005,3.09,136,1.2262079,1991,5,17
18.05.1991,0,3.46,-1.9,8.099999,1020.7,62.955,2.9299998,217,2.1957963,1991,5,18
19.05.1991,0,4.04,-1.3299999,9.82,1014.10004,70.840004,2.95,261,2.7045865,1991,5,19
20.05.1991,8.2,3.6399999,2.86,6.3799996,994,89.32,3.22,97,1.0021371,1991,5,20
21.05.1991,7.5,3.99,3.1999998,5.1,995.3,92.93889,3.37,130,1.3584146,1991,5,21
22.05.1991,1.2,4.8199997,3.26,7.3199997,996.9,90.635,3.57,109,1.1703422,1991,5,22
23.05.1991,0,4.02,1.62,6.97,1013.2,78.705,4.0099998,200,2.0720441,1991,5,23
24.05.1991,0,3.76,-1.49,7.12,1016,64.075005,3.28,170,1.7428156,1991,5,24
25.05.1991,2.4,3.56,1.1,6.44,1016.5,77.66,2.77,152,1.5469975,1991,5,25
26.05.1991,2.3,5.2,3.3,7.21,1017.9,81.85,2.77,152,1.6347988,1991,5,26
27.05.1991,0,5.96,-1.2099999,10.12,1022,66.25,2.78,241,2.6516612,1991,5,27
28.05.1991,0,7.45,3.4199998,10.73,1015.10004,83.090004,2.72,204,2.3597298,1991,5,28
29.05.1991,0,7.35,3.53,10.53,1012.8,76.105,2.73,186,2.1473641,1991,5,29
30.05.1991,0,8.84,2.58,14.349999,1006.5,72.23,2.56,210,2.5411608,1991,5,30
31.05.1991,1.7,5.64,1.31,10.84,1003.4,84.825005,2.51,228,2.5063324,1991,5,31
01.06.1991,2.9,5.3199997,2.5,8.61,1008.7,88.880005,2.79,166,1.8009529,1991,6,1
02.06.1991,0,5.8599997,0.96,9.429999,1012.60004,81.19,2.28,204,2.2479534,1991,6,2
03.06.1991,0,5.43,0.64,9.099999,1010.60004,82.29,2.7,192,2.0885127,1991,6,3
04.06.1991,0,5.8799996,-1.1899999,10.5199995,1008.3,83.375,2.6,190,2.0995936,1991,6,4
05.06.1991,2.1000001,5.46,0,9.82,1003.8,81.565,2.25,119,1.3002411,1991,6,5
06.06.1991,2.8,8.059999,5.6,10.86,1008.60004,83.96,2.56,139,1.6426175,1991,6,6
07.06.1991,0,9.26,3.57,14.78,1011.3,74.73,2.36,242,2.957082,1991,6,7
08.06.1991,0,12.41,3.72,17.4,1009.3,61.350002,2.53,231,3.0715888,1991,6,8
09.06.1991,0,12.12,8.05,17.01,1008.7,80.785,2.6399999,185,2.4427397,1991,6,9
10.06.1991,0,9.679999,5.45,13.7,1013,75.43,3.05,200,2.4709268,1991,6,10
11.06.1991,8.1,6.29,4.65,9.99,1012,88.87895,2.61,121,1.3522041,1991,6,11
12.06.1991,2.4,6.85,5.27,8.84,1012.10004,85.285,2.7,200,2.274542,1991,6,12
13.06.1991,7.9,8.61,6.04,11.86,1010.5,83.515,2.98,188,2.2557232,1991,6,13
14.06.1991,14,8.53,7.69,10.7,1003.5,90.80625,2.83,138,1.6573663,1991,6,14
15.06.1991,19.4,8.96,6.77,11.179999,1001.8,93.450005,2.53,76,0.9248226,1991,6,15
16.06.1991,1.4,9.639999,8.59,11.059999,1001.5,89.67143,2.84,139,1.724297,1991,6,16
17.06.1991,2.4,12.67,8.57,15.33,1009,82.055,2.58,204,2.730426,1991,6,17
18.06.1991,0,13.37,6.62,18.15,1012.7,80.72,2.76,230,3.126584,1991,6,18
19.06.1991,9.5,10.559999,7.5099998,17.92,1001,88.155556,2.57,138,1.7556621,1991,6,19
20.06.1991,1.2,10,7.62,13.32,998.3,89.395004,2.55,139,1.7439493,1991,6,20
21.06.1991,1.2,12.05,7.37,17.74,1004.5,90.30556,2.4199998,164,2.1654208,1991,6,21
22.06.1991,3.8,11.559999,8.29,15.11,1006.3,91.52353,2.35,179,2.332414,1991,6,22
23.06.1991,2.2,11.219999,7.74,14.7699995,1009.3,91.240005,2.33,159,2.0510094,1991,6,23
24.06.1991,0,12.57,8.0199995,16.8,1012,88.36,2.3999999,219,2.9203868,1991,6,24
25.06.1991,4.2000003,11.7699995,6.8599997,15.9,1007.7,91.36842,2.3799999,144,1.885366,1991,6,25
26.06.1991,0,13.57,11.8,17.38,996,93.200005,2.6799998,193,2.653657,1991,6,26
27.06.1991,0,13.23,10.83,16.76,992.60004,94.100006,2.87,179,2.444731,1991,6,27
28.06.1991,0,13.99,9.13,17.58,1005,87.32,3.24,206,2.8502812,1991,6,28
29.06.1991,6.6,13.53,9.12,18.16,1011.2,87.75,3.03,168,2.2938762,1991,6,29
30.06.1991,1.5,11.87,10.84,13.969999,1007.5,93.125,2.59,129,1.6934232,1991,6,30
01.07.1991,0,13.349999,9.83,17.66,1012.2,80.94,2.06,214,2.9082649,1991,7,1
02.07.1991,0,12.2,7.8399997,16.15,1020.2,74.48,2.18,239,3.1471257,1991,7,2
03.07.1991,0,13.429999,9.58,17.4,1020.8,66.94,2.28,245,3.324607,1991,7,3
04.07.1991,0,13.62,5.85,19.93,1021.8,70.9,2.4199998,178,2.4254882,1991,7,4
05.07.1991,0,16.43,10.139999,20.55,1017.9,71.805,2.53,214,3.1109087,1991,7,5
06.07.1991,0,14.61,11.94,19.66,1018.7,78.6,2.3,270,3.769697,1991,7,6
07.07.1991,0,17.17,13.42,22.21,1015,70.37,2.07,260,3.842272,1991,7,7
08.07.1991,0,14.17,10.13,18.34,1016.2,58.615,2.04,261,3.61071,1991,7,8
09.07.1991,0,17.13,9.099999,24.85,1006,86.185005,2.02,220,3.2586873,1991,7,9
10.07.1991,0,17.71,10.53,24.84,1000.10004,93.078575,2.1299999,159,2.3876755,1991,7,10
11.07.1991,0,12.79,10.349999,19.31,1011.2,87.19,2.03,138,1.850854,1991,7,11
12.07.1991,0,13.549999,8.71,17.199999,1013.2,70.965004,2.03,251,3.426085,1991,7,12
13.07.1991,0,12.42,9.389999,17.25,1008.2,86.755005,2.22,161,2.1423051,1991,7,13
14.07.1991,5.9,14.24,12.25,17.41,1003.8,88.58889,2.36,177,2.4643893,1991,7,14
15.07.1991,26,13.34,10.9,18.05,1003.2,85.66,2.45,180,2.4544024,1991,7,15
16.07.1991,0,15.42,12.099999,18.84,999.60004,90.17895,2.1,188,2.6920526,1991,7,16
17.07.1991,0,14.57,9.86,19.08,1001.8,82.765,1.92,209,2.9342105,1991,7,17
18.07.1991,1.9,15.46,11.639999,19.13,1005.2,83.200005,2.24,218,3.1178825,1991,7,18
19.07.1991,0,16.49,12.58,20.859999,1004.7,84.91,2.4199998,180,2.6323295,1991,7,19
20.07.1991,0,14.13,9.809999,18.8,1004.10004,75.57,2.05,123,1.708002,1991,7,20
21.07.1991,0,12.25,10.059999,17.27,1003.60004,85.155,1.9699999,78,1.0354623,1991,7,21
22.07.1991,1.2,12.61,10.83,14.33,1004.4,92.66667,1.9799999,88,1.1783024,1991,7,22
23.07.1991,0,12.469999,11.34,15.08,1008.5,92.10715,2,85,1.132297,1991,7,23
24.07.1991,0,12.63,10.57,15.92,1014.10004,81.48,2.26,175,2.335111,1991,7,24
25.07.1991,0,12.219999,7.77,16.41,1014.3,70.845,2.31,165,2.1790931,1991,7,25
26.07.1991,0,14.059999,8.62,18.47,1010.60004,83.665,1.99,170,2.3508816,1991,7,26
27.07.1991,3.3,13.75,7.93,17.69,1010.8,93.10834,2.02,171,2.347411,1991,7,27
28.07.1991,0,16.41,12.12,20.16,1010.7,87.465004,2.3999999,184,2.6805475,1991,7,28
29.07.1991,0,17.02,13.16,20.66,1016.60004,77.73,2.4299998,243,3.5779862,1991,7,29
30.07.1991,0,15.559999,9.79,21.1,1021.10004,71.950005,2.18,231,3.2917187,1991,7,30
31.07.1991,0,14.7,6.49,21.449999,1024.7001,78.93,2.1499999,281,3.9224367,1991,7,31
01.08.1991,0,18.369999,9.36,25.35,1016.60004,74.6,2.11,280,4.2360325,1991,8,1
02.08.1991,0,15.5,10.75,21.359999,1019.9,66.32,2.11,245,3.4881425,1991,8,2
03.08.1991,0,15.38,10.26,20.359999,1019.4,70.585,1.87,219,3.1102865,1991,8,3
04.08.1991,0,17.46,8.58,24.25,1017.4,69.630005,1.77,199,2.9558053,1991,8,4
05.08.1991,0,17.43,11.37,23.359999,1012.2,70.43,1.7199999,171,2.5429142,1991,8,5
06.08.1991,17.800001,15.509999,11.23,19.72,1005.4,78.51,1.8499999,142,2.0329866,1991,8,6
07.08.1991,15.7,14.469999,13.809999,16.609999,1002.4,90.55,1.8299999,115,1.6104811,1991,8,7
08.08.1991,20.9,12.67,11.84,14.139999,1010.5,88.99334,2.05,123,1.6452806,1991,8,8
09.08.1991,1.5,11.66,10,14.12,1010.7,83.935,2.04,113,1.4734668,1991,8,9
10.08.1991,2.9,11.13,5.5899997,15.07,1004,89.1579,2.1299999,129,1.6638948,1991,8,10
11.08.1991,8.3,11.389999,9.69,13.96,991.9,93.24546,2.07,124,1.6186001,1991,8,11
12.08.1991,0,11.099999,5.8599997,15.04,991.8,88.52941,2.01,143,1.8527529,1991,8,12
13.08.1991,0,11.059999,5.98,14.46,1003.2,85.585,1.6899999,179,2.3053832,1991,8,13
14.08.1991,0,11.16,4.54,15.83,1008.7,78.32,1.51,212,2.7310934,1991,8,14
15.08.1991,0,13.389999,9.679999,16.88,1007,82.22,1.6899999,160,2.1809926,1991,8,15
16.08.1991,6.4,12.88,10.139999,16.74,1002.60004,79.335,1.9699999,125,1.6860579,1991,8,16
17.08.1991,14.8,13.009999,12.16,14.28,1000.7,90.38947,2.1,75,1.0156099,1991,8,17
18.08.1991,6.7000003,13.91,12.53,15.889999,1004.5,93.61,2.23,104,1.4365765,1991,8,18
19.08.1991,0,11.139999,10.59,13.99,1007.8,90.725006,2.29,84,1.0819826,1991,8,19
20.08.1991,0,10.2699995,8.91,11.98,1005.3,90.53158,1.9599999,72,0.9071636,1991,8,20
21.08.1991,0,11.28,9.469999,13.71,1009.3,83.665,1.7199999,109,1.4082407,1991,8,21
22.08.1991,0,14.03,9.09,19.68,1011.7,84.305,1.9699999,150,2.0719721,1991,8,22
23.08.1991,0,16.4,12.57,21.58,1013.5,88.025,2.06,130,1.8915715,1991,8,23
24.08.1991,9.900001,16.13,13.62,20.49,1006.5,80.590004,1.8299999,103,1.4938928,1991,8,24
25.08.1991,0,12.62,8.42,17.09,1015.60004,86.965004,1.66,121,1.6131774,1991,8,25
26.08.1991,0,13.349999,9.309999,18.24,1021.3,81.775,1.61,128,1.7332524,1991,8,26
27.08.1991,0,14.41,12.5199995,17.74,1016.4,80.895004,1.99,73,1.0154378,1991,8,27
28.08.1991,0,11.07,8.05,15.92,1017.9,85.245,1.99,109,1.3953658,1991,8,28
29.08.1991,0,9.469999,3.6399999,15.16,1017.10004,63.940002,2.12,134,1.6427902,1991,8,29
30.08.1991,0,10.69,9.44,13,1015.4,63.09,2.1,133,1.687307,1991,8,30
31.08.1991,0,9.09,4.7,12.509999,1017,85.715004,1.8499999,90,1.0916027,1991,8,31
01.09.1991,1,12.19,5.97,17.09,1019.60004,85.855,2.35,140,1.843495,1991,9,1
02.09.1991,0,13.04,10.599999,16.539999,1015.10004,66.950005,2.1399999,118,1.5898104,1991,9,2
03.09.1991,2.6000001,9.179999,6.6499996,12.719999,1000.10004,83.745,2.3799999,63,0.7720255,1991,9,3
04.09.1991,2.5,6.62,4.71,10.51,1003,73.635,2.3,135,1.5312355,1991,9,4
05.09.1991,0,2.84,-0.93,7.1099997,1005.60004,84.355,2.3999999,130,1.2974058,1991,9,5
06.09.1991,1.8000001,2.9299998,-1.8,6.96,1009.3,74.315,3.1699998,131,1.3089325,1991,9,6
07.09.1991,1.4,5.2799997,1.36,8.67,1009,80.395004,3.1499999,80,0.86665577,1991,9,7
08.09.1991,2.4,5.98,5.35,7.5299997,1007.8,84.855,2.35,63,0.698594,1991,9,8
09.09.1991,0,4.98,3.6,8.46,1006.4,79.75,2,113,1.2137115,1991,9,9
10.09.1991,0,3.1799998,-2.4199998,8.809999,1002.8,82.69,1.9799999,78,0.7891504,1991,9,10
11.09.1991,0,3.22,1.37,5.47,1000,80.66,2.58,61,0.6189807,1991,9,11
12.09.1991,0,3.1799998,-0.63,7.18,1004.7,72.725,2.21,117,1.1824915,1991,9,12
13.09.1991,0,3.04,-1.15,8.42,1008.5,83.505005,1.92,146,1.4652019,1991,9,13
14.09.1991,6.4,3.1399999,-2.72,9.05,1012.5,77.41,2.01,80,0.80395097,1991,9,14
15.09.1991,6.2000003,8.599999,6.29,11.44,993,91.62,2.1399999,45,0.5442084,1991,9,15
16.09.1991,0,7.02,4.8399997,10.21,998.2,79.175,2.1399999,101,1.1625917,1991,9,16
17.09.1991,0,1.81,-1.81,7.0699997,1014.60004,76.675,2.36,136,1.3004881,1991,9,17
18.09.1991,3.7,1.12,-5.48,6.8999996,1018.8,66.805,2.4299998,93,0.8643172,1991,9,18
19.09.1991,4.6,4,3.1999998,4.94,1008,77.28,2.03,38,0.3945115,1991,9,19
20.09.1991,0,4.08,3.3799999,5.2599998,1007.2,86.55,1.8499999,36,0.37493768,1991,9,20
21.09.1991,0,3.4299998,1.35,5.5299997,1016.8,83.335,2,71,0.71919405,1991,9,21
22.09.1991,5,3.84,2.24,5.97,1011,69.455,2.73,31,0.31954923,1991,9,22
23.09.1991,26.5,4.2599998,3.52,4.98,991.3,87.325,3.1599998,44,0.46501723,1991,9,23
24.09.1991,4.7000003,3.35,2.4299998,6.0899997,987,90.53,2.9299998,50,0.51334316,1991,9,24
25.09.1991,0,4.81,2.8899999,6.23,985.60004,83.44,2.58,34,0.36712083,1991,9,25
26.09.1991,0,5.73,3.8,9.34,995.4,86.32,2.6399999,68,0.7527496,1991,9,26
27.09.1991,0,2.74,0.28,6.66,997.9,88.92353,2.77,38,0.3795035,1991,9,27
28.09.1991,0,2.78,0.59,6.0099998,995.60004,86.625,2.8899999,55,0.55077535,1991,9,28
29.09.1991,0,1.7099999,-2.06,6.21,1003.9,83.58,2.71,65,0.62302333,1991,9,29
30.09.1991,0,0.69,-3.51,7.12,1007.9,82.920006,2.81,70,0.64394027,1991,9,30
01.10.1991,0,0.97999996,-0.45999998,2.26,988.2,83.700005,2.76,17,0.15997499,1991,10,1
02.10.1991,4.1,1.06,0.03,2.1699998,992.3,93.060005,3.1699998,28,0.26365528,1991,10,2
03.10.1991,0,2.29,0.17999999,7.18,1007.3,86.455,2.36,47,0.45936927,1991,10,3
04.10.1991,9.5,0.91999996,-0.93,3.3999999,1007.5,89.57778,1.88,32,0.29706436,1991,10,4
05.10.1991,3.2,-0.049999997,0.17,0.7,1015.2,87.88947,2.01,35,0.31140506,1991,10,5
06.10.1991,17.7,3.55,-0.19,6.22,1006.5,89.71429,2.1699998,29,0.29664764,1991,10,6
07.10.1991,0,4.0299997,0.39,8.34,1015,83.515,1.99,59,0.6108777,1991,10,7
08.10.1991,0,1.3,0.08,4.98,1020.9,88.121056,2,51,0.47667643,1991,10,8
09.10.1991,0,2.51,-0.63,5.77,1017.8,81.325005,1.74,41,0.40160045,1991,10,9
10.10.1991,0,2.4199998,0.78999996,6.19,1023.7,79.85,1.61,54,0.5254756,1991,10,10
11.10.1991,0,5.64,1.5899999,10.29,1018.8,73.255,2.33,33,0.35992447,1991,10,11
12.10.1991,0,4.17,1.11,8.67,1014.10004,92.4625,2.1499999,38,0.39553618,1991,10,12
13.10.1991,0,2.19,-1.3199999,4.99,1009.3,91.2375,1.92,19,0.1848145,1991,10,13
14.10.1991,1.6,2.6299999,1.75,4.93,1009.60004,93.950005,1.77,27,0.26683682,1991,10,14
15.10.1991,0,0.48999998,-0.01,2.1699998,1003.8,92.96667,1.41,13,0.1189506,1991,10,15
16.10.1991,6.9,-0.13,-0.59999996,0.56,999.7,94.450005,2.05,7,0.062661506,1991,10,16
17.10.1991,31.1,5.87,0.11,7.5099998,985.7,93.41667,2.97,13,0.14527339,1991,10,17
18.10.1991,9.8,4.69,2.6699998,8.099999,981.2,92.04,3.25,39,0.42041847,1991,10,18
19.10.1991,0,-4.5499997,-5.97,2.6399999,1003.2,88.278946,2.8999999,21,0.15528773,1991,10,19
20.10.1991,0,-9.099999,-11.92,-5.21,1015.9,78.995,2.56,33,0.19342025,1991,10,20
21.10.1991,0,-4.43,-9.349999,-1.3,1003.9,82.995,1.9399999,20,0.14863776,1991,10,21
22.10.1991,0,-1.41,-3.97,1.67,1005.2,88.66667,2.04,27,0.22868921,1991,10,22
23.10.1991,0,-4.56,-6.5699997,-0.02,1016.10004,84.73,2.04,28,0.20518915,1991,10,23
24.10.1991,2.1000001,-4.4,-10.53,-1.02,1017.9,84.630005,1.8199999,21,0.15484273,1991,10,24
25.10.1991,0,2.27,-1.79,5.93,1018.7,85.565,1.73,27,0.26202133,1991,10,25
26.10.1991,0,-0.049999997,-2.2,4.18,1021.8,85.63684,1.8399999,17,0.15066254,1991,10,26
27.10.1991,0,0.48,-2.46,5.13,1026.3,89.53333,2.02,20,0.18053067,1991,10,27
28.10.1991,1.9,-2.95,-4.36,-0.85999995,1037.3,84.805,1.67,21,0.16322076,1991,10,28
29.10.1991,0,-1.4499999,-2.6599998,-0.61,1035.7001,91.253845,1.75,8,0.06639246,1991,10,29
30.10.1991,0,-1.17,-1.9499999,-0.42,1031.1,89.99286,1.87,18,0.15156366,1991,10,30
31.10.1991,0,0.45,-0.28,0.89,1024,92.6077,2.23,9,0.08125211,1991,10,31
01.11.1991,0,-3.86,-7.6,-0.19,1015,90.295006,3.06,15,0.11356416,1991,11,1
02.11.1991,16.2,0.29999998,-1.73,1.63,994.5,87.81333,3.05,3,0.027398463,1991,11,2
03.11.1991,6.1,-0.099999994,-0.82,0.95,984.4,94.36667,3.49,7,0.06331836,1991,11,3
04.11.1991,14.2,-0.29999998,-1.41,0.45,976.60004,90.27369,3.86,2,0.018034235,1991,11,4
05.11.1991,4.9,0.45999998,-0.45,1.17,984.2,91.55,3.23,9,0.083218135,1991,11,5
06.11.1991,1.8000001,-2.54,-2.95,-0.28,997,92.5,2.81,8,0.064937904,1991,11,6
07.11.1991,7.1,-2.34,-4.08,-0.71999997,996.3,90.909096,3.22,3,0.024571944,1991,11,7
08.11.1991,6.5,0.29,-1.0699999,1.4399999,986.7,90.88947,3.25,6,0.055031735,1991,11,8
09.11.1991,3.8,-0.71,-1.39,-0.28,984,90.13889,2.6399999,4,0.035322472,1991,11,9
10.11.1991,0,-5.2999997,-7.23,-0.77,995.9,85.39445,2.6599998,7,0.050242923,1991,11,10
11.11.1991,9.2,-9.26,-14.44,-4.0699997,999.8,85.36,2.8999999,7,0.04116693,1991,11,11
12.11.1991,2.7,-1.91,-4.08,-0.26999998,986.3,85.14,2.9099998,8,0.06715233,1991,11,12
13.11.1991,10.6,-5.14,-9.16,-1.73,988.10004,86.335,4.0699997,1,0.007269855,1991,11,13
14.11.1991,0,-1.28,-2.34,-0.35999998,985.60004,90.808334,3.35,7,0.060339656,1991,11,14
15.11.1991,0,-7.8199997,-9.74,-1.12,997.8,93.17143,2.3799999,3,0.019026687,1991,11,15
16.11.1991,0,-8.5,-10.75,-6.18,1000.5,91.66667,2.1599998,8,0.048916873,1991,11,16
17.11.1991,0,-12.33,-15.44,-9.71,1015.10004,90.850006,2.84,8,0.0393118,1991,11,17
18.11.1991,0,-17.63,-18.99,-15.16,1022.3,91.15,2.58,3,0.010617181,1991,11,18
19.11.1991,0,-18.68,-20.52,-16.98,1018.9,87.772224,2.51,5,0.01656903,1991,11,19
20.11.1991,0,-15.45,-19.42,-12.67,1014.5,86.835,2.36,2,0.008172543,1991,11,20
21.11.1991,15.6,-12.5,-20.189999,-5.8399997,1003.60004,85.62,2.95,2,0.009819734,1991,11,21
22.11.1991,0,-7.81,-11.8,-3.58,996.60004,84.925,2.2,5,0.031754438,1991,11,22
23.11.1991,6.8,-9.2,-18.55,-6.04,999.2,84.61,1.6999999,2,0.011804245,1991,11,23
24.11.1991,0,-0.41,-7.02,4.23,996.60004,90.443756,2.5,2,0.01773784,1991,11,24
25.11.1991,0,4.65,3.81,5.2999997,1003.8,91.973335,2.34,3,0.031912792,1991,11,25
26.11.1991,0,0.16,-1.41,5.16,1007.9,89.95334,1.9499999,3,0.027031891,1991,11,26
27.11.1991,0,-0.95,-2.8999999,2.3,1009.3,87.270004,1.8199999,2,0.017220724,1991,11,27
28.11.1991,0,-3.62,-6.18,-1.05,1007.3,84.130005,1.89,2,0.015382584,1991,11,28
29.11.1991,0,0.82,-1.26,1.35,1002.4,79.68421,2.11,1,0.009275245,1991,11,29
30.11.1991,0,-0.39999998,-2.4199998,1.11,1016.3,81.22222,2.11,1,0.008767663,1991,11,30
01.12.1991,0,1.53,-0.82,3.07,1011.7,72.79,1.8399999,1,0.009478154,1991,12,1
02.12.1991,0,0.08,-1.35,1.38,1017.3,67.645004,1.86,1,0.008932238,1991,12,2
03.12.1991,0,-0.88,-3.23,0.79999995,1002.4,86.71579,1.53,1,0.008671508,1991,12,3
04.12.1991,0,-3.35,-4.73,-1.1899999,1013,78.275,2,1,0.007755407,1991,12,4
05.12.1991,0,-6.42,-9.58,-2.71,1022.4,77.565,2.48,1,0.006681636,1991,12,5
06.12.1991,0.8,-8.29,-9.37,-2.71,1027.3,85.715004,2.34,1,0.006063398,1991,12,6
07.12.1991,0,-3.8999999,-9.17,-0.049999997,1021.3,86.86,2.02,1,0.007526378,1991,12,7
08.12.1991,0,-2.83,-4.45,-0.5,1020,86.08,1.8,1,0.007899351,1991,12,8
09.12.1991,0,-2.87,-4.8399997,-1.26,1028.5,88.22,2.11,1,0.007843209,1991,12,9
10.12.1991,0,0.14999999,-2.01,1.65,1026.2001,89.22353,2.1,1,0.008910184,1991,12,10
11.12.1991,0,1.93,-0.07,3.04,1014.9,72.035,1.8199999,1,0.009603643,1991,12,11
12.12.1991,0,0.29,-0.42,1.62,1004.2,80.41,1.79,1,0.009076709,1991,12,12
13.12.1991,0,-1.8399999,-3.47,1.4599999,984,78.560005,1.9699999,1,0.008430941,1991,12,13
14.12.1991,0,-3.76,-5.73,-1.64,999.10004,82.67,2.04,1,0.007684523,1991,12,14
15.12.1991,1.3000001,-12.24,-16.64,-5.7999997,1003.2,80.475,1.64,1,0.00498468,1991,12,15
16.12.1991,0,-8.7,-10.679999,-7.35,1006.2,81.71,1.4399999,1,0.006026904,1991,12,16
17.12.1991,0,-8.75,-10.2,-5.7599998,1001.8,70.770004,2.07,1,0.006030569,1991,12,17
18.12.1991,2.1000001,-1.35,-10.37,0.76,979.5,73.07,3.6999998,1,0.008628141,1991,12,18
19.12.1991,0,-2.84,-5.46,0.19,976.9,70.44,3.58,1,0.008117983,1991,12,19
20.12.1991,7.8,-3.51,-7.74,-0.9,969.60004,85.39,4.06,1,0.007923166,1991,12,20
21.12.1991,0.6,-2.37,-3.3899999,-0.93,972.5,91.08667,3.3799999,1,0.008306148,1991,12,21
22.12.1991,0,-8.2,-10.53,-3.1499999,986.10004,88.41,3.02,1,0.006274352,1991,12,22
23.12.1991,0,-14.21,-20.08,-10.26,990.10004,86.615005,3.55,1,0.004491705,1991,12,23
24.12.1991,0,-14.9,-18.1,-10.32,1004.3,65.5,3.3,1,0.004260551,1991,12,24
25.12.1991,0,-12.759999,-14.429999,-10.2,1008.10004,78.285,2.62,1,0.004820305,1991,12,25
26.12.1991,0,-14.74,-17.119999,-11.099999,1007.3,87.32632,2.73,1,0.004291643,1991,12,26
27.12.1991,1.3000001,-12.389999,-14.95,-10.96,1007.5,84.235,2.82,1,0.004925912,1991,12,27
28.12.1991,0,-3.62,-10.929999,1.56,995.3,83.555,2.29,1,0.007751901,1991,12,28
29.12.1991,0,-0.17,-2.23,2.37,986,81.16,2.1,1,0.009011772,1991,12,29
30.12.1991,0,-3.36,-5.7999997,-1.02,1005.8,77.315,2.1299999,1,0.007788157,1991,12,30
31.12.1991,1.2,-6.17,-12.5,-1.16,1010.10004,75.215004,2.27,1,0.006820438,1991,12,31
01.01.1992,5.9,-3.8899999,-6.68,-0.96999997,975,75.635,4.27,1,0.00776327,1992,1,1
02.01.1992,0,-4.7,-7.56,-1.38,978.7,81.61765,3.9599998,1,0.007466331,1992,1,2
03.01.1992,1.7,-11.32,-15.339999,-7.3799996,974.5,85.22,3.85,1,0.005366071,1992,1,3
04.01.1992,0,-11.33,-16.51,-8.49,974.9,83.49,3.9099998,1,0.005361445,1992,1,4
05.01.1992,0,-9.92,-11.79,-7.6699996,989,82.020004,3.72,1,0.0057251,1992,1,5
06.01.1992,0,-7.29,-12.23,-4.8399997,1002,86.665,3.54,1,0.006493203,1992,1,6
07.01.1992,0,-15.599999,-19.49,-8.73,999,81.96,3.25,1,0.00409988,1992,1,7
08.01.1992,1.9,-12.42,-13.69,-11.83,993.8,82.71111,3.7099998,1,0.004970094,1992,1,8
09.01.1992,0,-14.08,-16.039999,-12,1000.3,88.12778,3.9399998,1,0.004489685,1992,1,9
10.01.1992,8.3,-14.929999,-22.269999,-9.61,1003.8,77.68,3.57,2,0.008509048,1992,1,10
11.01.1992,0,-5.41,-9.9,-2.73,978.4,88.621056,2.86,2,0.014454147,1992,1,11
12.01.1992,0,-5.67,-8.12,-3.52,1005.4,80.515,3.49,2.5,0.017520007,1992,1,12
13.01.1992,6,-13.12,-16.039999,-8.08,1015.9,70.950005,2.9199998,3,0.01407717,1992,1,13
14.01.1992,0,-6.06,-14.309999,-4.49,994.7,81.775,3.55,2,0.013859698,1992,1,14
15.01.1992,2.2,-5.41,-6.5299997,-3.24,994.60004,78.555,3.56,2,0.014294034,1992,1,15
16.01.1992,0,-10.69,-11.889999,-5.16,994.9,78.76,3.86,3,0.016404353,1992,1,16
17.01.1992,0,-6.46,-11.7,-5.37,999.10004,83.91,4.94,3,0.020330742,1992,1,17
18.01.1992,0,-8.57,-12.849999,-4.15,1013.2,89.51667,3.48,3,0.018110877,1992,1,18
19.01.1992,0,-13.759999,-16.93,-11.17,1022,79.41,3.4099998,6,0.026988178,1992,1,19
20.01.1992,0,-6.89,-13.5,-2.55,1017.8,74.2,3.6599998,4,0.02620062,1992,1,20
21.01.1992,0,-1.18,-2.9099998,0.69,1021.10004,64.14,3.99,6,0.050808076,1992,1,21
22.01.1992,0,-1.1899999,-3.6999998,1.01,1021.7,75.145004,3.28,6,0.05076846,1992,1,22
23.01.1992,0,1.35,-1.51,2.77,1022.3,56.575,2.82,4,0.037427682,1992,1,23
24.01.1992,0,0.68,0.14,3.79,1017.3,52.725002,2.1599998,10,0.09145197,1992,1,24
25.01.1992,0,-0.68,-1.99,1.03,1008.9,73.665,2.1699998,11,0.09578512,1992,1,25
26.01.1992,0,-1.42,-4.3399997,0.84999996,1009.9,83.495,2.76,12,0.101302646,1992,1,26
27.01.1992,0,3.6899998,-0.19,5.0699997,1008.4,80.98,2.86,12,0.12322545,1992,1,27
28.01.1992,0,3.4299998,0.34,5.7599998,999.3,81.72,3.33,12,0.12271632,1992,1,28
29.01.1992,0,-2.9399998,-4.35,0.099999994,1016.8,68.995,3.59,7,0.055142265,1992,1,29
30.01.1992,0,2.3999999,-7.19,5.5499997,1017.7,73.225,3.3899999,10,0.09756366,1992,1,30
31.01.1992,0,1.4499999,-0.41,4.83,1017.60004,70.925,3.04,14,0.13184856,1992,1,31
01.02.1992,0,-0.38,-2.52,2.47,1011.3,83.095,1.91,16,0.14081764,1992,2,1
02.02.1992,0,0.5,-0.59,2,995.60004,83.270004,2.09,10,0.09198131,1992,2,2
03.02.1992,5.5,-2.62,-4.13,-0.65,980.8,92.276924,3.4499998,4,0.032696918,1992,2,3
04.02.1992,0,-9.74,-11.17,-3.21,987.4,89.36667,3.53,4,0.023148224,1992,2,4
05.02.1992,0,-17.39,-22.64,-10.83,989.60004,88.450005,2.99,6,0.022158764,1992,2,5
06.02.1992,3.3,-13.759999,-18.609999,-11.559999,1003.9,69.950005,2.98,8,0.03649949,1992,2,6
07.02.1992,2.4,-1.78,-12.87,3.98,991.4,76.5,2.52,10,0.084126584,1992,2,7
08.02.1992,0,-0.03,-2.47,3.8899999,999.10004,77.19,2.1299999,18,0.16182743,1992,2,8
09.02.1992,0,-4.64,-6.16,-2.74,1009.7,82.67368,2.3899999,20,0.14664643,1992,2,9
10.02.1992,1.1,-0.089999996,-3.47,0.5,993.4,87.31053,2.85,8,0.07199938,1992,2,10
11.02.1992,8.1,-1.26,-1.6999999,-0.7,981.60004,90.78125,2.49,10,0.08648621,1992,2,11
12.02.1992,0,-4.38,-6.0499997,-1.2099999,991.5,80.575005,2.3999999,18,0.13519317,1992,2,12
13.02.1992,0,-14.09,-16.42,-6.25,1004.10004,82.82,2.71,16,0.07157547,1992,2,13
14.02.1992,0,-11.7,-17.09,-7.98,1000.9,85.23158,2.96,16,0.08236624,1992,2,14
15.02.1992,0,-8.19,-9.62,-6.85,1006.3,85.935,3.1499999,27,0.16703576,1992,2,15
16.02.1992,0,-7.6499996,-10.63,-5.24,1013.5,78.665,3.8,28,0.17711891,1992,2,16
17.02.1992,0,-4.12,-5.85,-2.24,1017.5,76.285,3.34,25,0.1867557,1992,2,17
18.02.1992,0,-5.37,-7.5,-3.1799998,1017.4,84.185,3.1899998,28,0.1974169,1992,2,18
19.02.1992,0,-10.2699995,-14.049999,-6.37,1017.2,89.11,2.7,21,0.115533926,1992,2,19
20.02.1992,0,-12.4,-17.5,-7.8399997,1019,81.83,2.3799999,37,0.18055104,1992,2,20
21.02.1992,0,-3.87,-7.99,-1.8,1005.60004,87.935005,2.6299999,27,0.20558338,1992,2,21
22.02.1992,0,-2.6699998,-3.82,-1.17,993.60004,82.755005,2.9099998,22,0.17797162,1992,2,22
23.02.1992,0,-3.51,-7,-1.8299999,986.7,85.425,3.35,22,0.17234616,1992,2,23
24.02.1992,0,-4.21,-7.7,-1.9699999,1001.3,73.9,2.73,44,0.33086264,1992,2,24
25.02.1992,0,-1.18,-3.07,0.25,995.5,73.71,2.08,33,0.2838745,1992,2,25
26.02.1992,0,-0.97999996,-1.8399999,1.3199999,1012.7,80.03,1.9399999,43,0.3690243,1992,2,26
27.02.1992,0,-4.71,-9.7699995,-0.77,1013.10004,85.235,1.8299999,43,0.31356353,1992,2,27
28.02.1992,5.4,-4.11,-8.45,-2.45,1008.7,88.19474,1.99,34,0.255575,1992,2,28
29.02.1992,0,-0.63,-4.49,2.1399999,1001,85.235,2.1,40,0.3506945,1992,2,29
01.03.1992,0,3.98,1.1999999,6.17,996.10004,84.829414,2.08,42,0.4385329,1992,3,1
02.03.1992,0,-2.55,-5.7599998,2.87,1001.10004,89.315384,2.35,36,0.29133105,1992,3,2
03.03.1992,0,-4.56,-5.46,-2.11,1000.9,92.058334,3,18,0.1332473,1992,3,3
04.03.1992,0,-7.47,-9.22,-4.8399997,1016.9,90.611115,2.3999999,68,0.43301588,1992,3,4
05.03.1992,0,-3.8999999,-9.059999,-0.88,1019.2,85.86842,2.34,47,0.35422304,1992,3,5
06.03.1992,0,-0.87,-1.62,-0.19,1012.9,90.16154,2.44,31,0.2672095,1992,3,6
07.03.1992,0,2.6499999,-0.21,3.1599998,1014.2,76.45,2.49,37,0.36499768,1992,3,7
08.03.1992,0,0.48999998,-1.89,3.87,1024.5,74.925,2.07,67,0.60565054,1992,3,8
09.03.1992,0,0.29,-1.74,2.7,1020.9,74.405,1.9599999,48,0.4314069,1992,3,9
10.03.1992,0,0.47,-1.3199999,2.1699998,1005.60004,80.745,2.72,48,0.43839428,1992,3,10
11.03.1992,0,1.0699999,0.089999996,2.8899999,987.9,86.69,3.12,40,0.37776652,1992,3,11
12.03.1992,17.300001,-4.18,-7.41,0.78999996,981,80.01,4.1,57,0.43505105,1992,3,12
13.03.1992,2.6000001,-1.11,-1.9699999,-0.099999994,965.10004,86.563156,5.12,24,0.21101302,1992,3,13
14.03.1992,2,-2.4099998,-3.28,-1.28,970.3,88.340004,4.66,41,0.34046093,1992,3,14
15.03.1992,0,-4.4,-6.75,-1.7199999,984.8,89.8,3.49,54,0.40703878,1992,3,15
16.03.1992,0,-3.97,-7.66,0.34,1005.4,79.57,2.97,63,0.47760496,1992,3,16
17.03.1992,5.1,-4.11,-8.98,-1.04,1003,82.29474,2.3999999,66,0.49798456,1992,3,17
18.03.1992,0,3.9099998,-0.7,6.49,997.10004,86.29,2.51,51,0.53093946,1992,3,18
19.03.1992,5.5,1.25,-0.12,4.63,1003.9,90.828575,2.6399999,52,0.4898695,1992,3,19
20.03.1992,0,0.39,-0.66999996,3.56,1000.8,86.695,2.3899999,81,0.7395837,1992,3,20
21.03.1992,0,-2.69,-6.43,2.71,1007.7,89.84167,2.99,84,0.6728404,1992,3,21
22.03.1992,4.4,-4.17,-9.929999,-1.29,1009.3,91.925,3.36,32,0.23979309,1992,3,22
23.03.1992,0,-3.54,-5.1,-1.23,1011.3,88.35556,3.09,76,0.5851017,1992,3,23
24.03.1992,0,-5.8399997,-9.62,-2.44,1014.4,82.39,3.1899998,84,0.5803549,1992,3,24
25.03.1992,0,-4.94,-7.2999997,-1.66,998.60004,72.975,2.79,105,0.7649734,1992,3,25
26.03.1992,0,-4.66,-8.58,-2.1499999,995.4,85.29474,2.9199998,72,0.53251165,1992,3,26
27.03.1992,2.7,-5.31,-9.2699995,-2.28,993.10004,85.340004,3.1599998,94,0.67566484,1992,3,27
28.03.1992,0,-6.64,-9.639999,-2.61,992.4,86.64,3.07,101,0.6817033,1992,3,28
29.03.1992,0,-5.71,-9.78,-2.23,1001.2,74.72,2.9299998,59,0.4138755,1992,3,29
30.03.1992,4.1,-6.5699997,-11.25,-3.36,1005.8,79.520004,2.9099998,90,0.6038481,1992,3,30
31.03.1992,9.2,-7.7,-8.38,-4.9,1008.2,78.565,3.51,78,0.4940132,1992,3,31
01.04.1992,2.2,-8.139999,-9.71,-6.54,1010.3,81.57,3.3,93,0.5751644,1992,4,1
02.04.1992,0,-9.92,-14.589999,-5.52,1013.4,83.325005,2.75,99,0.55658686,1992,4,2
03.04.1992,0,-9.849999,-14.7699995,-6.5099998,1013.8,85.9,2.6299999,70,0.3949079,1992,4,3
04.04.1992,0,-6.5099998,-8.12,-4.25,1013.10004,84.945,2.26,80,0.53560823,1992,4,4
05.04.1992,0,-7.52,-8.96,-5.7,1010.9,86.665,2.48,86,0.54857993,1992,4,5
06.04.1992,0,-7.62,-8.87,-6,1007.7,85.725,2.32,97,0.6170455,1992,4,6
07.04.1992,3.5,-4.75,-7.3399997,-2.85,1003.3,85.37,2.22,63,0.46156967,1992,4,7
08.04.1992,0,-3.1499999,-10.41,4.63,1014.2,83.67,2.3999999,89,0.69581664,1992,4,8
09.04.1992,0,-1.23,-3.57,2.22,1023,74.05,2.33,140,1.1816965,1992,4,9
10.04.1992,0,-1.3,-5.12,2.8799999,1015.8,78.175,2.3,143,1.2088263,1992,4,10
11.04.1992,0,0.93,-2.69,4.17,1006,86.89,2.1399999,96,0.8923149,1992,4,11
12.04.1992,0,-1.03,-3.81,2.6799998,999.3,88.71,2.18,130,1.1225497,1992,4,12
13.04.1992,0,-2.9199998,-4.13,-0.14,997.9,86.494736,2.79,141,1.1252469,1992,4,13
14.04.1992,0,-5.1,-7.71,-1.51,1005.60004,83.285,3.1599998,140,1.0076405,1992,4,14
15.04.1992,0,-6.5299997,-10.94,-2.1499999,1012.5,82.8,3.9599998,156,1.0438514,1992,4,15
16.04.1992,0,-7.99,-16.8,-0.48,1012.60004,78.66,3.33,187,1.1634699,1992,4,16
17.04.1992,0,-4.56,-11.34,1.18,1006.60004,73.455,2.96,189,1.3937871,1992,4,17
18.04.1992,3.5,-3.21,-8.5199995,2.11,1000.8,77.915,3.1399999,180,1.4157436,1992,4,18
19.04.1992,0,-0.66999996,-2.77,1.87,1000.10004,88.005554,3.29,87,0.76194674,1992,4,19
20.04.1992,0,-0.63,-2.6299999,1.9399999,1013,76.47,3.37,160,1.3926055,1992,4,20
21.04.1992,0,-5.27,-9.309999,-0.24,1022.2,77.81,2.3799999,217,1.5322685,1992,4,21
22.04.1992,0,-5.0899997,-9.809999,-1.13,1018.8,76.805,2.61,185,1.3203983,1992,4,22
23.04.1992,1.1,-4.9,-6.24,-1.81,1011.3,81.32,2.4199998,119,0.8612,1992,4,23
24.04.1992,2.6000001,-3.8999999,-6.75,-1.65,1011.8,82.565,2.4099998,91,0.68915415,1992,4,24
25.04.1992,3,-0.93,-2.1599998,1.1,1012.5,82.62,2.31,98,0.84286034,1992,4,25
26.04.1992,10.2,-0.55,-2.08,0.9,1014.9,81.55,2.58,111,0.96814644,1992,4,26
27.04.1992,0,0.45999998,-1.22,1.51,1015.3,86.375,2.81,67,0.6082044,1992,4,27
28.04.1992,1.7,1.02,-0.14999999,1.92,1010.9,85.57,2.95,128,1.1904699,1992,4,28
29.04.1992,3.3,1.75,0.69,2.45,1015.4,88.94211,3.01,73,0.6961762,1992,4,29
30.04.1992,3.4,1.0799999,0.58,2.22,999.10004,93.69091,2.72,85,0.79781485,1992,4,30
01.05.1992,1.7,3.9099998,0.95,8.01,1005.10004,64.86,3.4399998,220,2.2804818,1992,5,1
02.05.1992,6.5,3.09,1.1999999,6.2799997,1003.5,81.58,3.09,117,1.1794997,1992,5,2
03.05.1992,0,2.3999999,0.78999996,4.98,1003.60004,89.246666,2.78,143,1.4061971,1992,5,3
04.05.1992,0,2.81,-1.35,6.67,1014.7,65.29,2.5,184,1.8251489,1992,5,4
05.05.1992,7.4,6.8999996,2.72,11.21,1012.9,70.630005,2.26,193,2.1974773,1992,5,5
06.05.1992,1.5,4.75,1.65,10.099999,997.8,82.365,2.7,148,1.584638,1992,5,6
07.05.1992,0,3.74,0.75,6.87,987.8,74.51,2.77,183,1.9035972,1992,5,7
08.05.1992,8.1,0.25,-2.33,5.43,976.8,62.145,3.1699998,168,1.547687,1992,5,8
09.05.1992,1.5,1.4,-0.85999995,3.97,982.8,86.72632,3.08,138,1.3235302,1992,5,9
10.05.1992,0,2.99,-1.81,7.5699997,992.7,65.185,2.98,193,1.9503852,1992,5,10
11.05.1992,0,3.82,-0.93,7.3999996,1002.4,68.155,3.25,229,2.3698478,1992,5,11
12.05.1992,0,2.57,-0.88,7.1299996,1007.4,59.535,2.9199998,247,2.4387457,1992,5,12
13.05.1992,0,3.1499999,-1.8499999,7.95,1009.9,74.48,2.45,216,2.1745317,1992,5,13
14.05.1992,0,5.2599998,-0.04,9.94,1027.5,68.515,2.74,240,2.5737066,1992,5,14
15.05.1992,0,12.349999,4.04,19.96,1014.7,54.935,2.73,255,3.378136,1992,5,15
16.05.1992,0,8.34,6.2999997,15.78,1014.10004,73.18,2.83,189,2.2461605,1992,5,16
17.05.1992,0,4.11,-2.81,8.33,1018.10004,79,3.04,186,1.9279583,1992,5,17
18.05.1992,1.9,8.09,5.2599998,10.09,1022.4,72.335,3.1799998,173,2.0329466,1992,5,18
19.05.1992,0,7.48,3.74,13.16,1018.8,80.79,3.01,184,2.1265407,1992,5,19
20.05.1992,0,6.31,2.8799999,10.349999,1022.2,70.39,2.6699998,233,2.5922873,1992,5,20
21.05.1992,0,8.71,3.1299999,13.099999,1021.3,85.65,2.28,194,2.3228257,1992,5,21
22.05.1992,0,10.21,4.04,15.21,1024.2001,65.24,2.45,259,3.2309234,1992,5,22
23.05.1992,0,13.259999,2.6499999,21.3,1019.60004,56.615,2.7,259,3.5018742,1992,5,23
24.05.1992,0,15.21,8.72,21.48,1020.8,68.950005,2.78,295,4.1716776,1992,5,24
25.05.1992,0,10.84,4.49,16.58,1031,47.61,2.24,277,3.5046482,1992,5,25
26.05.1992,0,15.65,7.89,21.96,1026.4,38.100002,2.72,303,4.3178835,1992,5,26
27.05.1992,0,16.02,7.02,22.689999,1027.6,33.4,2.8799999,295,4.23614,1992,5,27
28.05.1992,0,18.19,6.14,25.91,1026.3,31.91,2.84,290,4.35774,1992,5,28
29.05.1992,0,19.02,9.9,24.74,1021.2,43.325,2.5,274,4.1911607,1992,5,29
30.05.1992,0,16.83,9.75,22.51,1018.3,64.49,2.12,233,3.4152155,1992,5,30
31.05.1992,0,15,9.76,21.359999,1015,61.615,2.3,247,3.4840457,1992,5,31
01.06.1992,0,11.82,6.83,16.529999,1020.8,54.665,2.3799999,307,4.002629,1992,6,1
02.06.1992,0,12.809999,4.8399997,19.07,1023.3,43.495,2.72,346,4.620176,1992,6,2
03.06.1992,0,16.199999,8.41,22.51,1021.60004,37.46,2.45,347,5.0130234,1992,6,3
04.06.1992,0,18.25,8.11,26.949999,1018.60004,30.025,2.6699998,288,4.3439493,1992,6,4
05.06.1992,0,17.869999,13.679999,22.31,1020.3,44.32,3.01,255,3.815199,1992,6,5
06.06.1992,0,15.17,4.54,22.01,1017.4,40.16,2.48,265,3.748833,1992,6,6
07.06.1992,0,13.509999,8.78,19.119999,1017.10004,59.62,2.36,265,3.6081731,1992,6,7
08.06.1992,0,11.12,1.91,18.66,1025,39.99,2.3999999,307,3.9233449,1992,6,8
09.06.1992,0,17.1,5.18,24.689999,1025.9,33.135002,2.45,321,4.7190037,1992,6,9
10.06.1992,0,20.189999,10.07,27.23,1023.3,40.745003,2.37,308,4.8115225,1992,6,10
11.06.1992,0,20.119999,11.86,27.16,1025.7001,44.785,2.24,264,4.115852,1992,6,11
12.06.1992,0,20.529999,14.2699995,24.99,1024,48.79,2.49,270,4.242866,1992,6,12
13.06.1992,0,20.32,15.0199995,25.06,1019.8,49.485,2.31,292,4.5772524,1992,6,13
14.06.1992,19.1,17.26,14.889999,22.8,1009.2,70.555,2.69,266,3.9461098,1992,6,14
15.06.1992,7.8,13.95,10.12,18.449999,1005.10004,66.685,2.59,182,2.5157661,1992,6,15
16.06.1992,2.5,8.55,6.48,14.839999,1003.7,68.645004,2.8999999,158,1.898486,1992,6,16
17.06.1992,0,8.17,3.22,12.44,1010.9,66.715004,3.1699998,185,2.190948,1992,6,17
18.06.1992,1.6,9.69,6.8599997,12.46,1016.10004,69.23,3.02,226,2.7890434,1992,6,18
19.06.1992,0,13.599999,6.7,18.73,1019.9,47.56,2.74,296,4.034481,1992,6,19
20.06.1992,6.1,14.549999,11.48,19.32,1004.7,55.5,2.77,235,3.2940764,1992,6,20
21.06.1992,0,8.36,6.92,13.0199995,991.5,77.485,2.71,101,1.2138727,1992,6,21
22.06.1992,0,6.42,2.1399999,9.82,994.4,70.700005,2.55,212,2.399917,1992,6,22
23.06.1992,0,7.46,4.0499997,9.929999,1005.10004,60.030003,2.87,167,1.9416679,1992,6,23
24.06.1992,0,10.63,4.7,15.639999,1014.4,45.785,2.53,267,3.383329,1992,6,24
25.06.1992,0,14.16,4.16,20.609999,1017.60004,42.350002,2.3999999,359,4.962618,1992,6,25
26.06.1992,0,16.99,9.4,22.18,1017.4,51.64,2.49,288,4.2367644,1992,6,26
27.06.1992,4.8,16.69,12.5,21.85,1013.5,58.295002,2.3999999,251,3.6745281,1992,6,27
28.06.1992,0,12.73,10.0199995,17.67,1010.3,75.905,2.33,220,2.9473681,1992,6,28
29.06.1992,0,10.65,4.7,15.13,1012.2,52.475002,2.25,240,3.0457392,1992,6,29
30.06.1992,1.4,10.33,4.56,14.69,1009,70.345,2.36,196,2.4694805,1992,6,30
01.07.1992,3.5,8.349999,5.0299997,13.04,1007.7,81.380005,2.4199998,180,2.1462584,1992,7,1
02.07.1992,0,9.01,5.83,12.3,1009.2,76.04,2.35,123,1.4937849,1992,7,2
03.07.1992,5.3,7.96,3.59,11.59,1009.9,74.655,2.21,139,1.6367455,1992,7,3
04.07.1992,0,9.719999,5.02,13.96,1010.4,67.565,2.84,157,1.9441025,1992,7,4
05.07.1992,0,12.49,5.15,18.289999,1017.8,54.165,2.46,278,3.6910427,1992,7,5
06.07.1992,0,10.17,4.6,17.289999,1016.2,65.130005,2.5,217,2.7135677,1992,7,6
07.07.1992,0,10.3,5.18,14.28,1016.5,56.905003,2.28,221,2.773036,1992,7,7
08.07.1992,0,11.03,1.8399999,17.58,1009.10004,78.325005,2.12,171,2.1950297,1992,7,8
09.07.1992,0,13.53,9.96,17.01,1003.8,69.840004,2.2,216,2.9579213,1992,7,9
10.07.1992,7,10.389999,4.69,16.75,1003.10004,72.575005,2.28,197,2.4925733,1992,7,10
11.07.1992,0,12.389999,8.03,17.01,998.5,81.055,2.37,192,2.563121,1992,7,11
12.07.1992,0,11.59,5.0499997,17.19,1010.8,61.555,2.71,235,3.0586486,1992,7,12
13.07.1992,5.6,11.94,9.21,16.05,1006.8,80.36,2.8799999,107,1.4075321,1992,7,13
14.07.1992,22.5,14.25,12.4,18.359999,1001.60004,91.244446,2.6299999,146,2.0349724,1992,7,14
15.07.1992,2.2,13.2699995,11.099999,15.91,997.4,91.8,2.27,78,1.0642649,1992,7,15
16.07.1992,4.1,11.71,10.0199995,14.87,999.3,85.7675,2.12,113,1.4824642,1992,7,16
17.07.1992,0,10.55,8.809999,12.55,1007.4,79.735,2.32,143,1.8136935,1992,7,17
18.07.1992,0,11.16,7.7999997,14.83,1013.10004,70.565,2.6799998,184,2.3659213,1992,7,18
19.07.1992,0,10.849999,5.0299997,14.66,1012.4,70.1,2.25,144,1.8370544,1992,7,19
20.07.1992,0,14.17,10.13,17.17,1008.8,74.770004,2.1699998,165,2.2891698,1992,7,20
21.07.1992,3.9,16.17,13.049999,20.22,1009.8,86.795,2.44,174,2.5228083,1992,7,21
22.07.1992,11.3,13.259999,11.66,17.55,1003.7,91.1,2.45,112,1.5239587,1992,7,22
23.07.1992,0,14.04,10.66,16.84,1009.10004,80.155,2.46,225,3.1118255,1992,7,23
24.07.1992,7,12.969999,8.04,17.82,1020.4,65.32,2.46,189,2.5366416,1992,7,24
25.07.1992,6.5,12.009999,10.19,17.25,1016.5,84.5,1.99,171,2.244331,1992,7,25
26.07.1992,0,14.21,10.849999,17.94,1015.3,78.955,1.99,149,2.0639186,1992,7,26
27.07.1992,7.9,13.13,11.73,15.07,1003.2,89.57895,2.54,130,1.7637178,1992,7,27
28.07.1992,0,14.2,11.05,17.23,1004.60004,87.175,3.02,145,2.0163658,1992,7,28
29.07.1992,0,12.69,10.849999,15.99,1004.60004,86.265,2.34,131,1.7573732,1992,7,29
30.07.1992,5.3,11.82,6.8799996,16.59,1008.9,83.600006,2.11,159,2.0833652,1992,7,30
31.07.1992,0,11.639999,9.98,14.04,1000.7,90.293335,2.11,127,1.6621748,1992,7,31
01.08.1992,0,9.92,5.5299997,13.75,1005.5,76.43,2,205,2.5581388,1992,8,1
02.08.1992,1.6,11.309999,4.21,15.87,1005.7,81.305,1.89,186,2.4086282,1992,8,2
03.08.1992,0,13.639999,9.16,16.49,999.7,86.965004,2.21,127,1.7465068,1992,8,3
04.08.1992,12.8,12.38,11.07,15.78,995.8,93.11,2.26,93,1.2425908,1992,8,4
05.08.1992,0,13.889999,10.219999,18.15,1000.8,90.3,2.04,151,2.0878484,1992,8,5
06.08.1992,5.6,12.15,7.41,17.24,1004.7,93.130775,1.79,151,1.9986244,1992,8,6
07.08.1992,0,12.63,7.7599998,16.949999,1005.7,84.345,1.87,158,2.115506,1992,8,7
08.08.1992,0,9.69,4.8399997,14.57,1009.2,83.47,1.9799999,179,2.2158744,1992,8,8
09.08.1992,0,7.98,2.27,13.08,1015.8,74.205,2.25,205,2.4085963,1992,8,9
10.08.1992,7,6.43,0.02,10.63,1011.5,84.4,2.6299999,111,1.2462641,1992,8,10
11.08.1992,23.2,10.86,8.58,12.509999,999.2,93.075005,2.31,62,0.79570335,1992,8,11
12.08.1992,11.3,7.56,6.0099998,12.36,996.3,82.645004,2.4199998,31,0.3630577,1992,8,12
13.08.1992,0,6.27,1.14,9.73,1011.9,80.04,2.6,114,1.2732332,1992,8,13
14.08.1992,6.7000003,5.72,1.99,9.139999,1010.8,79.265,2.28,31,0.34037018,1992,8,14
15.08.1992,9.5,8.99,7.64,9.8,1007.9,92.15883,1.9799999,85,1.0323187,1992,8,15
16.08.1992,1.1,9.71,8.69,12.0199995,1005.2,86.545,1.8199999,92,1.141569,1992,8,16
17.08.1992,1.9,9.11,6.29,12.32,1008,90.04667,1.92,28,0.34120518,1992,8,17
18.08.1992,4.7000003,9.05,8.059999,10.41,1008.60004,91.520004,1.67,64,0.7783546,1992,8,18
19.08.1992,3.6000001,10.099999,8.96,11.32,1013,92.1875,1.67,62,0.77491754,1992,8,19
20.08.1992,3.4,10.389999,9.58,11.19,1016.5,90.600006,1.87,72,0.9056432,1992,8,20
21.08.1992,0,7.8199997,6.5499997,9.87,1019.10004,86.715004,1.8299999,104,1.2141906,1992,8,21
22.08.1992,0,8.49,6.0099998,11.13,1020.9,86.105,1.86,107,1.2731926,1992,8,22
23.08.1992,0,7.6699996,6.04,9.95,1019.10004,84.32,2.1699998,130,1.510902,1992,8,23
24.08.1992,0,7.33,5.89,8.48,1012.7,82.560005,2.18,89,1.0269258,1992,8,24
25.08.1992,2.7,7.04,6.48,8.139999,1006.3,86.595,2.2,83,0.9521927,1992,8,25
26.08.1992,2.4,7.83,7.2999997,8.99,1002.3,83.93,2.23,72,0.8476054,1992,8,26
27.08.1992,1.9,7.96,6.0899997,10.07,1001.5,84.875,2.07,61,0.72116065,1992,8,27
28.08.1992,24.4,9.67,7.95,11.3,997.5,92.86923,2.36,52,0.6467647,1992,8,28
29.08.1992,0,11.25,8.9,14.75,992.10004,89.035,2.6399999,101,1.3135152,1992,8,29
30.08.1992,1.2,8.88,4.71,13.84,999.9,89.14,2.57,40,0.4860676,1992,8,30
31.08.1992,7.9,8.15,4.46,12.309999,1005.3,88.17143,2.8899999,94,1.1155294,1992,8,31
01.09.1992,1.8000001,11.7,9.809999,14.179999,999.10004,90.23334,2.8899999,70,0.91818446,1992,9,1
02.09.1992,27.1,9.5199995,7.99,11.87,994.60004,88.405266,2.73,41,0.5085053,1992,9,2
03.09.1992,2,7.87,6.0899997,10.599999,993.8,92.912506,2.72,97,1.1479346,1992,9,3
04.09.1992,0,6.54,2.22,10.389999,1002.4,82.19,2.8799999,104,1.1770276,1992,9,4
05.09.1992,7.7000003,2,1.23,5.7799997,1008.10004,84.552635,3.01,61,0.5896073,1992,9,5
06.09.1992,0,3.6799998,1.37,5.5499997,1014.10004,93.12,2.76,70,0.7163601,1992,9,6
07.09.1992,4.5,5.56,0.14,11.179999,1014,85.985,2.46,109,1.1886432,1992,9,7
08.09.1992,1.6,7.46,4.23,9.84,1006.8,86.585,2.03,57,0.6621807,1992,9,8
09.09.1992,0,9.599999,8.19,12,1010.9,79.965004,1.5999999,80,0.9871024,1992,9,9
10.09.1992,0,8.07,6.27,10.99,1015.5,82.675,1.87,92,1.08398,1992,9,10
11.09.1992,0,9.91,5.16,15.41,1022.4,82.605,1.87,100,1.2381728,1992,9,11
12.09.1992,0,8.13,6.95,11.929999,1021.60004,85.090004,1.75,93,1.094567,1992,9,12
13.09.1992,0,10.11,8.23,12.65,1016.9,88.96,1.66,93,1.16069,1992,9,13
14.09.1992,2.3,8.45,5.79,11.759999,1015.60004,86.11,1.9399999,50,0.595722,1992,9,14
15.09.1992,11.1,9.679999,7.35,12.23,1009.5,87.43,2.03,46,0.56920767,1992,9,15
16.09.1992,15.3,9.16,8.92,10.309999,1006,90.275,1.91,42,0.51300347,1992,9,16
17.09.1992,0,8.929999,8.2,10.5199995,1013.7,94.00001,1.74,58,0.70132494,1992,9,17
18.09.1992,0,7.33,3.78,11.53,1021,92.17059,1.6899999,63,0.7240191,1992,9,18
19.09.1992,0,7.17,6.97,7.79,1026.7001,88.505005,1.53,60,0.6842756,1992,9,19
20.09.1992,2.2,6.5899997,6.15,7.19,1029,82.495,1.36,51,0.57055306,1992,9,20
21.09.1992,3,7.22,6.35,8.309999,1029.4,91.44737,1.81,42,0.47910896,1992,9,21
22.09.1992,2,7.58,5.2799997,8.86,1027.2001,85.810005,2.24,66,0.7620361,1992,9,22
23.09.1992,6.5,8.54,7.31,9.29,1021.2,89.27369,2.11,40,0.47659004,1992,9,23
24.09.1992,0,9.179999,8.47,9.5,1016.4,89.85294,1.7099999,35,0.42571828,1992,9,24
25.09.1992,0,9.76,7.3999996,13.61,1013.7,88.68824,1.9399999,58,0.7179382,1992,9,25
26.09.1992,6,7.97,7.31,10.0199995,1014,90.3375,1.88,47,0.552521,1992,9,26
27.09.1992,0,6.23,4.88,8.7699995,1021.2,83.605,1.9499999,60,0.6661733,1992,9,27
28.09.1992,0,5.3599997,4.79,6.6499996,1028.2001,78.54,1.6899999,46,0.4947536,1992,9,28
29.09.1992,0,3.9499998,2.27,5.8599997,1028.7001,86.64,1.66,49,0.5022646,1992,9,29
30.09.1992,0,6.0299997,2.08,10.179999,1020.3,85.94,1.48,43,0.47458962,1992,9,30
01.10.1992,0,2.6,0.61,6.81,1019.4,71.01,1.4,45,0.44183707,1992,10,1
02.10.1992,0,2.46,-0.59,7.02,1015.60004,78.015,1.39,62,0.6069323,1992,10,2
03.10.1992,0,4.0699997,2.34,5.2999997,1023.60004,81.73,2.24,35,0.36123243,1992,10,3
04.10.1992,0,4.5899997,0.69,9.469999,1023.2,79.270004,3.21,45,0.47289038,1992,10,4
05.10.1992,0,8.559999,4.77,12.59,1017.2,77.105,2.81,47,0.5613613,1992,10,5
06.10.1992,0,7,4.87,10.599999,1002.60004,70.54,2.46,39,0.44767755,1992,10,6
07.10.1992,8.400001,3.27,0.099999994,8.45,1005.10004,68.485,2.1699998,59,0.59806937,1992,10,7
08.10.1992,1.1,2.5,0.04,7.04,981.10004,84.045,2.28,25,0.24987948,1992,10,8
09.10.1992,0,-2.1599998,-2.97,0.32,1007.3,75.31,2.3999999,41,0.3360525,1992,10,9
10.10.1992,2.3,-2.07,-5.2599998,-0.049999997,1001.2,85.563156,2.19,30,0.24778394,1992,10,10
11.10.1992,0,-4.13,-5.41,-1.31,1009,84.605,2.1,42,0.31536213,1992,10,11
12.10.1992,0,-3.1899998,-5.97,-0.82,1022.5,82.6,2.4299998,54,0.41920283,1992,10,12
13.10.1992,3,-4.71,-4.7799997,-2.3999999,1018.9,79.285,2.06,37,0.2687737,1992,10,13
14.10.1992,0,-7.0299997,-8.03,-4.7999997,1017.5,82.21,2.27,30,0.19519009,1992,10,14
15.10.1992,0,-10.41,-12.799999,-6.43,1014.9,83.689476,2.72,26,0.14220236,1992,10,15
16.10.1992,0,-10.15,-13.5,-4.46,1004.3,87.755005,1.78,29,0.16212945,1992,10,16
17.10.1992,0,-8.29,-11.73,-5.04,1002,86.82632,1.99,36,0.22226658,1992,10,17
18.10.1992,0,-10.8,-14.36,-5.69,1007.7,81.525,2.34,31,0.16687582,1992,10,18
19.10.1992,0,-10.54,-12.44,-8.21,1007.8,87.89,2.19,34,0.18562771,1992,10,19
20.10.1992,0,-10.49,-12.799999,-6.87,1010.8,87.450005,1.79,33,0.1802541,1992,10,20
21.10.1992,0,-10.7,-12.9,-6.02,1007.10004,85.755005,2.11,33,0.17869703,1992,10,21
22.10.1992,0,-9.83,-11.75,-5.0299997,1005.2,89.85556,2.47,27,0.15345594,1992,10,22
23.10.1992,0,-12.099999,-14,-7.79,1007.3,80.885,2.4299998,28,0.14023957,1992,10,23
24.10.1992,0,-10.34,-14.15,-7.7799997,1004.2,80.16,2.53,22,0.12174973,1992,10,24
25.10.1992,0,-10.33,-13.73,-7.43,1005.4,88.09375,2.74,23,0.12723845,1992,10,25
26.10.1992,0,-9.73,-11.57,-8.34,1012.7,84.8,2.74,10,0.056824103,1992,10,26
27.10.1992,0,-13.83,-15.67,-10.17,1015.2,86.01053,2.2,16,0.072053276,1992,10,27
28.10.1992,0,-16.369999,-20.02,-12.389999,1017.60004,85.125,2.9099998,16,0.06159325,1992,10,28
29.10.1992,3.9,-11.65,-16.34,-10.73,1015,85.235,2.69,6,0.030642522,1992,10,29
30.10.1992,0,-12.21,-14.42,-9.809999,1013.4,77.745,1.74,27,0.13376158,1992,10,30
31.10.1992,3.3,-15.049999,-17.18,-12.04,1016.4,77.385,1.7099999,18,0.07526112,1992,10,31
01.11.1992,3.8,-13.23,-14.589999,-12.799999,1009.4,84.65,2.4199998,13,0.060919147,1992,11,1
02.11.1992,1.9,-13.11,-14.63,-11.49,997.60004,82.825005,2.95,7,0.03333928,1992,11,2
03.11.1992,10.5,-9.79,-16.24,-7.22,980.10004,90.778946,2.74,2,0.011607017,1992,11,3
04.11.1992,0,-5.3599997,-8.44,-3.6799998,990.5,91.97273,2.45,13,0.09339074,1992,11,4
05.11.1992,0,-9.03,-11.41,-4.56,1020,90.95556,2.26,9,0.05278809,1992,11,5
06.11.1992,3.9,-12.7699995,-17.13,-8.3,1013.4,89.943756,2.24,5,0.023988908,1992,11,6
07.11.1992,0,-11.75,-13.17,-8.25,1001.2,91.058334,2.4299998,8,0.04105847,1992,11,7
08.11.1992,0,-6.75,-12.719999,-3.02,1011.10004,89.04,2.1,7,0.04638331,1992,11,8
09.11.1992,0,-4.3199997,-5.5299997,-2.1299999,1012,86.53684,2.74,13,0.096581206,1992,11,9
10.11.1992,4,-1.4499999,-6.49,0.47,1000.2,78.9,3,5,0.042410977,1992,11,10
11.11.1992,1.1,0.74,-0.82,1.56,989.2,84.97,3.61,4,0.03727573,1992,11,11
12.11.1992,7,-2.1399999,-4.58,1.39,1000.9,87.79445,3.8899999,4,0.032946218,1992,11,12
13.11.1992,8.8,-2.52,-4.88,-0.61,998.10004,86.600006,2.98,3,0.024355493,1992,11,13
14.11.1992,1.2,-1.7199999,-1.8199999,-1.16,1007.60004,86.82,2.6299999,4,0.03339464,1992,11,14
15.11.1992,0,-3.72,-4.85,-1.79,1011,91.412506,2.34,4,0.030554283,1992,11,15
16.11.1992,1.1,-5.47,-6.6099997,-3.1699998,1007.3,90.78889,2.6799998,5,0.035327382,1992,11,16
17.11.1992,7,-5.64,-6.33,-5.06,999.2,88.64667,3.1499999,7,0.049334493,1992,11,17
18.11.1992,3.5,-5.74,-6.99,-2.32,1003.3,88.18889,3.3899999,6,0.04196875,1992,11,18
19.11.1992,0.8,-7.1299996,-8.16,-5.14,1005.5,83.505005,3.4399998,2,0.013057585,1992,11,19
20.11.1992,6.7000003,-6.14,-8.349999,-5.54,1001.4,84.91,3.12,2,0.013742761,1992,11,20
21.11.1992,1.5,-8.34,-11.059999,-5.3399997,1006.8,88.765,2.73,4,0.024548123,1992,11,21
22.11.1992,0,-13.5,-15.69,-10.84,1015.2,89.85294,2.49,3,0.013775412,1992,11,22
23.11.1992,0,-16.46,-20.63,-10.57,1022.3,88.53158,2.18,3,0.011439892,1992,11,23
24.11.1992,9.6,-10.099999,-20.3,-6.6299996,1006.9,85.15,2.26,3,0.01678466,1992,11,24
25.11.1992,0,-9.09,-10.45,-5.97,1009.5,90.23685,2.97,3,0.017674897,1992,11,25
26.11.1992,2.2,-9.099999,-10.37,-7.6299996,1006,87.845,3.4099998,3,0.017710812,1992,11,26
27.11.1992,1.3000001,-10.2699995,-10.639999,-8.92,1013.8,78.92,3.1299999,2.5,0.013788727,1992,11,27
28.11.1992,3.8,-13.5199995,-14.11,-11.139999,1014,78.555,2.56,2,0.009181434,1992,11,28
29.11.1992,0,-5.46,-12.88,-3.9399998,1011.9,87.83889,1.9,2,0.014093624,1992,11,29
30.11.1992,2.2,-3.1699998,-4.91,-0.71,1003.60004,92.350006,2.61,1.8,0.01415664,1992,11,30
01.12.1992,9,-2.31,-7.27,0.83,984.2,80.185,3.03,1.6,0.01322362,1992,12,1
02.12.1992,0.8,0.29999998,-2.04,2.3899999,976.3,91.509094,4.0899997,1.4,0.012926322,1992,12,2
03.12.1992,17.2,-1.76,-6.67,0.12,972.9,88.70556,3.8999999,1.2,0.010222745,1992,12,3
04.12.1992,2.5,-1.05,-1.88,0.25,976.7,88.42143,3.6799998,1,0.008749709,1992,12,4
05.12.1992,1.4,-1.26,-2.3899999,-0.26999998,980.60004,92.84167,2.81,1,0.008654038,1992,12,5
06.12.1992,0,-6.27,-7.99,-1.8199999,996.5,92.42728,2.95,1,0.006851792,1992,12,6
07.12.1992,0,-14.7,-18.47,-7.8199997,1009.7,90.588234,2.61,1,0.004293774,1992,12,7
08.12.1992,0,-15.37,-20.48,-11.12,1015.4,86.063156,2.3,1,0.004103433,1992,12,8
09.12.1992,0,-6.6499996,-11.86,-4.63,1015.3,84.57,2.54,1,0.006639368,1992,12,9
10.12.1992,3.5,0.56,-5.45,3.07,1001.60004,76.065,2.56,1,0.00918689,1992,12,10
11.12.1992,0,1.3399999,0.45999998,3.4099998,976,83.185005,2.57,1,0.009607469,1992,12,11
12.12.1992,0,-7.62,-9.92,0.32999998,983.60004,89.875,3.09,1,0.006471912,1992,12,12
13.12.1992,0,-11.179999,-12.57,-9.01,998.8,83.840004,2.97,1,0.005307403,1992,12,13
14.12.1992,14.1,-12.75,-16.869999,-7.5499997,997.8,69.915,2.62,1,0.004861959,1992,12,14
15.12.1992,0.5,-6.7,-10.7,-3.27,987.3,85.75,2.33,1,0.006754102,1992,12,15
16.12.1992,2.1000001,-9.11,-12.7699995,-5.46,1001.10004,75.585,2.28,1,0.005921714,1992,12,16
17.12.1992,0,-2.77,-5.52,-0.14999999,999.3,73.255005,1.91,1,0.008025328,1992,12,17
18.12.1992,1.8000001,-3.1799998,-5.31,-1.9599999,1004.9,85.221054,3.01,1,0.007854747,1992,12,18
19.12.1992,2.2,1.01,-1.9599999,1.5799999,980.10004,75.33,2.6599998,1,0.009466096,1992,12,19
20.12.1992,0,-5.2,-7.83,1.22,1003.5,76.045,1.8399999,1,0.007174077,1992,12,20
21.12.1992,0,-9.87,-13.549999,-5.37,1022.3,78.36,1.52,1,0.005600445,1992,12,21
22.12.1992,0,-4.92,-8.62,-2.26,1017.8,77.905,1.87,1,0.007198954,1992,12,22
23.12.1992,0,0.98999995,-2.31,2.48,1018.10004,74.340004,2.07,1,0.009251196,1992,12,23
24.12.1992,0,0.68,-0.39,2.3799999,1009.9,74.855,2.06,1,0.009184818,1992,12,24
25.12.1992,0,-0.84,-1.62,-0.51,1008.4,83.52106,2.27,1,0.008653893,1992,12,25
26.12.1992,0,-3.01,-4.7,1.05,1012.10004,80.91053,2.12,1,0.007876977,1992,12,26
27.12.1992,0,-5.48,-7.0099998,-3.82,1031.5,73.015,2.23,1,0.00694799,1992,12,27
28.12.1992,0,0.9,-5.1,3.49,1006.10004,84.65263,2.56,1,0.009283708,1992,12,28
29.12.1992,0,-3.53,-6.2999997,-1.02,1016,74.415,1.87,1,0.007678731,1992,12,29
30.12.1992,0,-10.08,-14.309999,-6.93,1023.9,80.485,1.4699999,1,0.005531035,1992,12,30
31.12.1992,0,-3.58,-8.62,-1.15,1020.9,77.155,1.74,1,0.007637396,1992,12,31
01.01.1993,0,-3.1999998,-7.1499996,0.32,1015.7,76.23,2.51,1,0.007793449,1993,1,1
02.01.1993,0,1.04,-0.32999998,2.52,1010.5,65.545,3.09,1,0.009309833,1993,1,2
03.01.1993,0,-2.86,-4.5499997,2.3899999,1026.5,77.415,2.8899999,1,0.007856574,1993,1,3
04.01.1993,0,-6.0099998,-7.79,-2.6499999,1018.2,56.77,2.9199998,1,0.006835184,1993,1,4
05.01.1993,2.5,-5.87,-7.0299997,-4.7599998,1007.2,68.715004,2.9099998,1,0.006933089,1993,1,5
06.01.1993,0,-7.2,-8.29,-5.9,984.2,91.98462,2.62,1,0.006605289,1993,1,6
07.01.1993,1.8000001,-8.2,-12.719999,-4.0899997,1000.7,78.685,2.48,1.5,0.009312472,1993,1,7
08.01.1993,4.8,-2.28,-12.78,-0.42999998,985.2,77.845,2.9199998,2,0.01653996,1993,1,8
09.01.1993,4.8,-2.57,-3.1799998,-0.39999998,985.8,79.770004,2.9299998,2,0.016330637,1993,1,9
10.01.1993,1.1,-3.59,-6.8399997,-0.74,976.9,80.22,3.4199998,2,0.0157142,1993,1,10
11.01.1993,5.9,-3.8,-9.5199995,-1.0699999,961.10004,87.48889,4.29,2,0.015734894,1993,1,11
12.01.1993,0,-6.73,-9.42,-1.37,962.4,89.37857,3.85,2,0.013730116,1993,1,12
13.01.1993,0.90000004,-11.94,-15.96,-6.81,979.8,85.695,3.1399999,2,0.010325848,1993,1,13
14.01.1993,2.6000001,-9.7,-12.84,-8.71,982.4,84.695,3.3799999,2,0.011642245,1993,1,14
15.01.1993,7.6,-14.92,-17.279999,-9.139999,996,87.361115,3.3799999,1,0.004283992,1993,1,15
16.01.1993,5.9,-5.6,-16.609999,-2.84,974.2,82.725,3.6299999,4,0.028736193,1993,1,16
17.01.1993,7.1,-6.27,-9.5,-2.22,988.8,87.255005,3.11,3,0.020666052,1993,1,17
18.01.1993,1.3000001,-6.58,-8.5,-5.99,974.60004,84.075005,2.6799998,2,0.013709793,1993,1,18
19.01.1993,1.6,-12.67,-14.0199995,-6.2,1002.10004,88.78824,2.6,1,0.00486797,1993,1,19
20.01.1993,1.9,-13.59,-16.55,-10.8,994,84.075,3.12,3,0.013933751,1993,1,20
21.01.1993,1.6,-6.39,-15.87,-4.72,975,84.985,3.6699998,2,0.013831836,1993,1,21
22.01.1993,0,-8.139999,-11.059999,-4.31,963.4,94.03334,4.17,2,0.012798359,1993,1,22
23.01.1993,0,-10.75,-12.83,-5.52,982.8,90.23334,4.65,3,0.016502293,1993,1,23
24.01.1993,0,-19.35,-22.24,-13.46,985.2,86.121056,4.7,4,0.013047263,1993,1,24
25.01.1993,0,-21.35,-24.65,-17.24,982.4,82.05,4.99,4,0.011416442,1993,1,25
26.01.1993,0,-17.64,-27.199999,-12.7699995,984.10004,90.91429,4.48,3,0.0109541,1993,1,26
27.01.1993,0,-7.27,-13.2699995,-5.5299997,992.9,89.75,3.12,5,0.03270876,1993,1,27
28.01.1993,0,-8.36,-10.94,-5.6099997,1011.5,86.395004,2.29,6,0.036660403,1993,1,28
29.01.1993,0,-13.559999,-15.33,-10.88,1019.8,75.225,1.78,14,0.06382946,1993,1,29
30.01.1993,0,-6.72,-13.24,-4.08,1005.8,79.57895,2.48,12,0.07992566,1993,1,30
31.01.1993,0,0.28,-4.8399997,2.47,997.4,79.28,2.33,11,0.10020914,1993,1,31
01.02.1993,0,4.22,-1.66,6.44,995.2,68.62,2.9199998,13,0.13691884,1993,2,1
02.02.1993,0,2.3,0.84999996,4.12,1001.9,67.64,2.6599998,21,0.20594954,1993,2,2
03.02.1993,0,-1.4399999,-2.1599998,2.24,987.60004,75.675,2.84,19,0.162501,1993,2,3
04.02.1993,0,-3.97,-4.9,-1.74,982.9,79.8,2.6399999,19,0.1462027,1993,2,4
05.02.1993,0,-4.38,-6.1,-3.5,984.9,85.336845,2.83,23,0.1735139,1993,2,5
06.02.1993,0,-7.2599998,-8.67,-3.7099998,1010.10004,72.525,2.71,18,0.1163854,1993,2,6
07.02.1993,0,-6.3799996,-9.639999,-3.9499998,1008.8,86.97369,2.36,17,0.114879146,1993,2,7
08.02.1993,0,-1.75,-3.9099998,2.8999999,1002.4,80.37,2.61,23,0.19240111,1993,2,8
09.02.1993,0,-3.06,-3.98,-0.93,1015.7,77.020004,2.47,26,0.20388237,1993,2,9
10.02.1993,2.3,-10.29,-13.63,-3.58,1035.5,74.605,2.27,30,0.1626665,1993,2,10
11.02.1993,0,-4.36,-13.809999,-0.66999996,1022.60004,87.42,2.51,33,0.24301903,1993,2,11
12.02.1993,2.8,0.19999999,-1.62,2.62,1019.7,82.905266,2.1399999,24,0.21508989,1993,2,12
13.02.1993,0,-0.79999995,-4.22,2.45,1025.8,84.850006,1.9599999,34,0.29162422,1993,2,13
14.02.1993,0,-1.8199999,-4.7599998,-0.11,1022.2,77.105,2.51,38,0.31306458,1993,2,14
15.02.1993,0,-1.35,-3.52,0.45,1000.2,83.875,3.06,15,0.12776087,1993,2,15
16.02.1993,0,-4.93,-7.99,-0.47,998,84.31579,3.02,26,0.18958645,1993,2,16
17.02.1993,0,-9.01,-10.83,-6.02,999.2,87.816666,3.4399998,23,0.13710287,1993,2,17
18.02.1993,1.5,-15.23,-17.779999,-9.73,1005.60004,81.494736,3.11,29,0.12097399,1993,2,18
19.02.1993,0,-14.23,-17.67,-12.139999,1001.4,85.58948,4.5,16,0.07113441,1993,2,19
20.02.1993,0,-20.02,-25.21,-13.45,999.7,81.62,4.65,32,0.09854541,1993,2,20
21.02.1993,0,-16.32,-22.25,-11.98,1001.8,79.825005,5.49,42,0.16429597,1993,2,21
22.02.1993,0,-12.19,-14.49,-7.2999997,1015.7,79.565,4.17,38,0.18813965,1993,2,22
23.02.1993,0,-14.2699995,-21.869999,-10.53,1027.8,70.78,4.22,41,0.1780925,1993,2,23
24.02.1993,0,-11.61,-15.11,-8.04,1026.5,75.875,3.6399999,46,0.23341818,1993,2,24
25.02.1993,0,-7.2,-11.679999,-3.84,1016.4,75.17,2.8999999,33,0.2130681,1993,2,25
26.02.1993,3.8,-2.6799998,-3.83,-2.6399999,1003.9,76.450005,2.83,17,0.13655975,1993,2,26
27.02.1993,0,-5.6299996,-7.45,-3.3999999,1003.3,74.16,3.24,33,0.23203538,1993,2,27
28.02.1993,0,-8.429999,-11.59,-3.76,1020.7,84.695,3.1799998,58,0.35079262,1993,2,28
01.03.1993,0,-6.95,-12,-3.1,1028.6,73.855,3.4499998,58,0.37596357,1993,3,1
02.03.1993,0,-1.22,-3.51,1.63,1025.9,67.98,3.25,62,0.5226162,1993,3,2
03.03.1993,0,-3.1799998,-5.91,0.47,1022,75.57,2.97,68,0.5282871,1993,3,3
04.03.1993,1.3000001,-3.29,-5.75,-1.4,1016.2,78.045,3.12,49,0.38024122,1993,3,4
05.03.1993,7.4,-4.29,-5.75,-2.71,999.10004,81.32,3.1799998,36,0.2701197,1993,3,5
06.03.1993,0,-8.17,-9.559999,-3.98,1008.7,82.69,2.8799999,33,0.2040119,1993,3,6
07.03.1993,2.6000001,-12.42,-15.929999,-9.23,1024.9,73.035,3.02,38,0.18438551,1993,3,7
08.03.1993,2.7,-5.73,-11.44,-3,1013.2,74.935,3.6699998,26,0.18072642,1993,3,8
09.03.1993,0,0.51,-3,3.29,992.8,80.605,2.75,37,0.34102914,1993,3,9
10.03.1993,0,-7.49,-10.09,-0.56,1002.10004,81.53,2.44,77,0.49498367,1993,3,10
11.03.1993,1.9,-11.04,-15.15,-3.81,1003.8,76.68,2.3799999,55,0.29305407,1993,3,11
12.03.1993,3.8,-12.57,-16.92,-9.65,1011.60004,77,2.06,49,0.23814192,1993,3,12
13.03.1993,0,-4.87,-10.12,0.76,999.8,87.35,2.1299999,62,0.4527972,1993,3,13
14.03.1993,0,5.23,0.97999996,8.389999,1000.7,81.71,2.19,67,0.72774833,1993,3,14
15.03.1993,1.7,5.17,3.79,7.43,1000.5,65.200005,1.9599999,65,0.7047076,1993,3,15
16.03.1993,0,3.04,1.8299999,5.35,982.4,80.450005,2.85,73,0.7432645,1993,3,16
17.03.1993,0,-2.82,-8.37,2.62,982.2,78.245,3.3799999,79,0.63966143,1993,3,17
18.03.1993,2.1000001,-3.24,-8.559999,1.3399999,981.60004,81.975,3.4099998,74,0.5885913,1993,3,18
19.03.1993,2.4,-3.35,-5.0099998,-0.84999996,981.7,82.66,3.74,83,0.6569649,1993,3,19
20.03.1993,1.2,-3.99,-6.74,0.42,988.4,72.85,2.6699998,91,0.69704807,1993,3,20
21.03.1993,3.5,-5.23,-13.009999,-3.1,987.7,75.08,2.78,66,0.47793776,1993,3,21
22.03.1993,0,-5.29,-10.929999,0.95,1000.10004,66.675,2.83,109,0.7804863,1993,3,22
23.03.1993,2.7,-3.54,-8.88,-1.67,993.5,84.025,3.1799998,41,0.31933415,1993,3,23
24.03.1993,0,-3.9099998,-7.54,1.18,993.7,77.165,2.85,108,0.8273212,1993,3,24
25.03.1993,0,-3.6899998,-8.62,1.79,1007.2,86.344444,3.51,93,0.7131056,1993,3,25
26.03.1993,0,-4.18,-7.7799997,0.32,1028,73.525,3.3,116,0.85827863,1993,3,26
27.03.1993,0,-7.06,-14.44,-0.48999998,1031.7001,66.785,3.01,137,0.88132644,1993,3,27
28.03.1993,0,-8.05,-15.87,-2.04,1031.3,68.965004,3.62,123,0.75291014,1993,3,28
29.03.1993,0,-7.98,-14.92,-2.3799999,1032.6,66.595,3.3,132,0.8101582,1993,3,29
30.03.1993,5.1,-5.69,-10.7699995,-2.3799999,1034.5,78.015,2.78,104,0.7139543,1993,3,30
31.03.1993,5.6,-2.2,-5.06,-0.97999996,1022.7,80.065,2.46,51,0.41329366,1993,3,31
01.04.1993,1.9,-1.73,-2.84,-0.03,1023.60004,91.200005,2.35,80,0.66102314,1993,4,1
02.04.1993,0,-2.6,-4.2799997,1.4399999,1024.6,87.025,2.1499999,88,0.7001019,1993,4,2
03.04.1993,0,-4.1,-4.71,-2.69,1029.1,76.695,1.9,120,0.89048356,1993,4,3
04.04.1993,0,-7.73,-14.719999,-0.84999996,1026.7001,79.05,2,149,0.9300422,1993,4,4
05.04.1993,0,-4.58,-8.83,-1.29,1016.3,79.22,2.46,131,0.95898175,1993,4,5
06.04.1993,0,-2.3799999,-5.1099997,0.93,1008.3,90.038895,2.3799999,92,0.74654436,1993,4,6
07.04.1993,0,-3.82,-5.66,-0.37,1017,89.39412,2.49,92,0.696874,1993,4,7
08.04.1993,0,-8,-14.929999,-2.6399999,1030.3,69.11,2.3899999,187,1.1484058,1993,4,8
09.04.1993,0,-6.33,-12.929999,-0.08,1025.3,75.415,2.37,129,0.86400104,1993,4,9
10.04.1993,0,-2.44,-12.0199995,3.73,1024.1,68.95,2.09,189,1.5145591,1993,4,10
11.04.1993,0,-1.64,-10.48,4.8399997,1018.2,57.375,2.1499999,201,1.6726929,1993,4,11
12.04.1993,0,-1,-10.25,6.15,1014.3,72.9,1.63,196,1.6790452,1993,4,12
13.04.1993,0,-0.38,-5.74,3.6,1016.60004,84.425,1.77,153,1.3422923,1993,4,13
14.04.1993,0,-1.4,-3.8899999,2.12,1021.4,78.14,1.74,156,1.3087417,1993,4,14
15.04.1993,0,-1.1899999,-6.1299996,3.24,1021.9,72.33,2.1499999,184,1.5567096,1993,4,15
16.04.1993,1.7,-3.03,-8.15,0.66999996,1013.3,69.655,2.46,160,1.2582449,1993,4,16
17.04.1993,8.1,-0.32999998,-2.08,1.39,991.8,88.62,2.56,55,0.49077925,1993,4,17
18.04.1993,0,-1.8499999,-3.29,0.74,982.8,89.600006,2.73,91,0.7674793,1993,4,18
19.04.1993,0,-4.3199997,-6.5899997,-1.73,1000.7,84.93,3.06,151,1.1302557,1993,4,19
20.04.1993,0,-3.1799998,-9.7,1.77,1011.4,78.225,2.3899999,220,1.7208185,1993,4,20
21.04.1993,5.8,-1.54,-4.44,0.19999999,997.4,73.63,2.6299999,102,0.8634618,1993,4,21
22.04.1993,0,0.39999998,-0.98999995,0.97999996,995.2,78.505005,2.09,92,0.843148,1993,4,22
23.04.1993,0,2.62,-0.65,5.5499997,1004.7,72.04,2.08,171,1.6939679,1993,4,23
24.04.1993,0,6.27,0.91999996,11.38,1010.3,83.57,2.35,146,1.6319369,1993,4,24
25.04.1993,0,5.67,0.52,10.099999,1010.3,86.26,2.58,159,1.7433879,1993,4,25
26.04.1993,0,3.81,-2.8799999,8,1019.7,66.805,2.3899999,191,1.9576375,1993,4,26
27.04.1993,0,4.24,1.68,6.0299997,1018.2,58.05,2.29,194,2.0197814,1993,4,27
28.04.1993,0,3.9399998,2.12,6.54,1020.5,70.485,2.57,206,2.1200426,1993,4,28
29.04.1993,0,8.28,1.42,12.889999,1017,53.4,2.28,238,2.8196812,1993,4,29
30.04.1993,0,8.82,5.13,11.139999,1017.5,69.225,1.9799999,228,2.743424,1993,4,30
01.05.1993,0,7.5099998,-0.17999999,13.71,1014.3,83.915,2.48,205,2.376532,1993,5,1
02.05.1993,0,9.58,0.5,15.79,1013.8,56.02,2.28,244,3.0050545,1993,5,2
03.05.1993,0,9.179999,3.9199998,15.9,1012.8,90.37857,2.52,202,2.4610384,1993,5,3
04.05.1993,0,3.1299999,1.25,11.21,1021.9,90.6353,3.05,85,0.84952486,1993,5,4
05.05.1993,0,2.8799999,0.07,5.19,1034.4,73.695,2.82,156,1.5346777,1993,5,5
06.05.1993,0,5.47,2.46,8.94,1035.7001,75.595,2.9399998,185,1.9894339,1993,5,6
07.05.1993,0,8.22,2.6,13.34,1032.2001,62.84,2.6499999,221,2.59513,1993,5,7
08.05.1993,2,9.45,4.63,14.16,1022.7,87.615005,2.79,168,2.0532677,1993,5,8
09.05.1993,0,9.099999,4.08,13.48,1030,68,2.79,236,2.846347,1993,5,9
10.05.1993,0,8,1.86,14.09,1028.6,72.39,2.9199998,259,3.0265458,1993,5,10
11.05.1993,0,5.68,-2.71,11.25,1023.3,75.35,2.83,193,2.1029608,1993,5,11
12.05.1993,0,5.2799997,3.3,9.559999,1009.3,74.345,2.55,185,2.0038316,1993,5,12
13.05.1993,0,2.9199998,-2.11,6.48,1011,71.64,2.3999999,182,1.8161635,1993,5,13
14.05.1993,3.3,2.08,-0.41,4.75,1008.3,81.16,2.55,129,1.2504239,1993,5,14
15.05.1993,7.5,4.43,2.18,5.91,1011.2,68.78,2.5,216,2.2718399,1993,5,15
16.05.1993,1.8000001,7.7,3.6799998,10.4,1013.3,76.55,2.69,126,1.4698015,1993,5,16
17.05.1993,8.3,6.8599997,4.96,10.26,1011.2,90.17778,3.12,158,1.79824,1993,5,17
18.05.1993,0,12.36,4.27,20.8,1017.9,68.285,2.6599998,243,3.215744,1993,5,18
19.05.1993,0,16.65,6.67,23.13,1021.10004,72.58,2.36,257,3.7491307,1993,5,19
20.05.1993,0,13.5199995,9.889999,21.34,1028.3,63.785,2.73,267,3.6202776,1993,5,20
21.05.1993,0,10.17,4.7999997,14.809999,1026.8,53.375,2.9099998,255,3.1739075,1993,5,21
22.05.1993,0,10.469999,4.21,15.88,1022.3,64.205,2.59,228,2.8668199,1993,5,22
23.05.1993,0,11.63,7.73,15.179999,1016.60004,64.555,2.3999999,210,2.7294014,1993,5,23
24.05.1993,0,5.15,2.46,14.03,1011,71.015,2.29,221,2.3814383,1993,5,24
25.05.1993,0,2.74,-0.77,5.98,1012.4,75.595,2.4299998,161,1.5950012,1993,5,25
26.05.1993,0,2.32,-0.03,4.45,1008.3,82.185,2.62,126,1.2321614,1993,5,26
27.05.1993,0,2.74,0.66999996,5.33,1007,70.395004,3.26,154,1.5302237,1993,5,27
28.05.1993,0,3.72,-0.39,6.33,1006.3,66.485,3.1499999,188,1.9347408,1993,5,28
29.05.1993,0,4.47,-0.02,7.7999997,1006.3,72.675,2.86,185,1.9534767,1993,5,29
30.05.1993,0,5.92,-0.16,11.57,1003.60004,78.76,2.72,232,2.5731263,1993,5,30
31.05.1993,7.6,6.7999997,1.9599999,10.76,1002.60004,76.325005,3.08,184,2.0991347,1993,5,31
01.06.1993,3.3,8.0199995,5.74,11.38,1002.9,67.605,2.4199998,139,1.6451207,1993,6,1
02.06.1993,20.5,8.51,6.62,11.83,1006.60004,74.975,2.6499999,99,1.1865692,1993,6,2
